before_mask,after_mask
昨日、やまださんから聞いた話によると、彼の新しい職場は株式会社東海プラスティックという企業名で、住所は愛知県名古屋市中区東桜2丁目22番地、郵便番号は〒4600005だそうです。やまださんはこの会社の営業部で働いており、会社の電話番号は0521234567とのことです。また、やまださんのメールアドレスはyamada.tokai@example.comで、業務において頻繁に使用しているようです。やまださんの生年月日は1985年5月25日で、最近家族と誕生日会をしたのでその話を聞きました。やまださんの新しい住居も教えてもらいました。住所は愛知県名古屋市西区城北1丁目10番地、郵便番号は〒4510001で、引越しは先月行われたそうです。今度、やまださんのお宅でホームパーティーを予定しているそうなので、詳細を後日教えてくれるという話でした。,昨日、<マスキング済みの氏名>さんから聞いた話によると、彼の新しい職場は<マスキング済みの会社名>という企業名で、住所は<マスキング済みの住所>、郵便番号は<マスキング済みの郵便番号>だそうです。<マスキング済みの氏名>さんはこの会社の営業部で働いており、会社の電話番号は<マスキング済みの電話番号>とのことです。また、<マスキング済みの氏名>さんのメールアドレスは<マスキング済みのemailアドレス>で、業務において頻繁に使用しているようです。<マスキング済みの氏名>さんの生年月日は<マスキング済みの生年月日>で、最近家族と誕生日会をしたのでその話を聞きました。<マスキング済みの氏名>さんの新しい住居も教えてもらいました。住所は<マスキング済みの住所>、郵便番号は<マスキング済みの郵便番号>で、引越しは先月行われたそうです。今度、<マスキング済みの氏名>さんのお宅でホームパーティーを予定しているそうなので、詳細を後日教えてくれるという話でした。
私は最近、たなかさんと再会しました。彼とは中学校時代の同級生で、久しぶりに地元の公園で偶然出会ったのです。たなかさんは今、大手のグローバル企業である株式会社未来インターナショナルで働いているそうで、その会社は東京都港区高輪2丁目3-1に所在するとのことです。彼の話によると、仕事はとても忙しいけれど充実していて、自分のスキルを存分に活かせる職場だということでした。彼は現在独身で、生まれは1987年4月20日だそうです。たなかさんの住んでいるマンションは東京都世田谷区奥沢5丁目で、静かで住み心地が良い場所のようです。また、彼の電話番号は09012345678、emailアドレスはtanaka.taro@example.comとのことです。彼とは中学校のクラス会に参加する約束をしましたが、こうして昔の友人と再会し、近況を語り合うのは本当に良いものですね。,私は最近、<マスキング済みの氏名>さんと再会しました。彼とは中学校時代の同級生で、久しぶりに地元の公園で偶然出会ったのです。<マスキング済みの氏名>さんは今、大手のグローバル企業である<マスキング済みの会社名>で働いているそうで、その会社は<マスキング済みの住所>に所在するとのことです。彼の話によると、仕事はとても忙しいけれど充実していて、自分のスキルを存分に活かせる職場だということでした。彼は現在独身で、生まれは<マスキング済みの生年月日>だそうです。<マスキング済みの氏名>さんの住んでいるマンションは<マスキング済みの住所>で、静かで住み心地が良い場所のようです。また、彼の電話番号は<マスキング済みの電話番号>、emailアドレスは<マスキング済みのemailアドレス>とのことです。彼とは中学校のクラス会に参加する約束をしましたが、こうして昔の友人と再会し、近況を語り合うのは本当に良いものですね。
やまださんは、株式会社斉藤商事の営業部に勤めています。彼の職場の住所は東京都品川区南大井1丁目10番12号で、郵便番号は〒1400013です。職場の固定電話番号は03-1234-5678、または彼自身の携帯番号090-8765-4321に連絡するのが最適です。さらに、彼に連絡を取りたい場合は、彼のemailアドレスであるyamada.saito@example.comにメールを送ることができます。また、やまださんは1980年5月12日生まれで、今年で43歳になりました。最近では、営業成績が向上し、彼の上司から評価される機会が増えています。来週、やまださんは大阪支社へ出張予定です。大阪支社の所在地は大阪府大阪市中央区心斎橋筋2丁目5番14号で、郵便番号は〒5420085です。出張中には現地のクライアントとの面談や契約書の確認が予定されています。このように、やまださんは忙しいながらも充実した仕事を続けています。,<マスキング済みの氏名>さんは、<マスキング済みの会社名>の営業部に勤めています。彼の職場の住所は<マスキング済みの住所>で、郵便番号は<マスキング済みの郵便番号>です。職場の固定電話番号は<マスキング済みの電話番号>、または彼自身の携帯番号<マスキング済みの電話番号>に連絡するのが最適です。さらに、彼に連絡を取りたい場合は、彼のemailアドレスである<マスキング済みのemailアドレス>にメールを送ることができます。また、<マスキング済みの氏名>さんは<マスキング済みの生年月日>生まれで、今年で<マスキング済みの生年月日>歳になりました。最近では、営業成績が向上し、彼の上司から評価される機会が増えています。来週、<マスキング済みの氏名>さんは大阪支社へ出張予定です。大阪支社の所在地は<マスキング済みの住所>で、郵便番号は<マスキング済みの郵便番号>です。出張中には現地のクライアントとの面談や契約書の確認が予定されています。このように、<マスキング済みの氏名>さんは忙しいながらも充実した仕事を続けています。
やまださんが経営する株式会社もみじ商事は広島県広島市中区大手町2丁目に本社を構えています。広島市の中心部に位置し、会社の郵便番号は7300051です。本社ビルはオフィス街の中でも目立つ存在で、電話番号は0822400000です。やまださんは生年月日が1980年5月12日で現在43歳です。会社の業務内容には地元企業向けのITコンサルティングや運用支援が含まれており、多くの企業に対して支援を行っています。特に地方の中小企業の課題を解決することに力を入れており、やまださんがリードするプロジェクトチームはこれまでに多くの成功事例を作り出してきました。また、彼自身のemailアドレスはyamada@example.comで、顧客や取引先とのコミュニケーションに活用されています。この会社は数年前に新しい分野に進出し、今ではオンラインショッピングのプラットフォーム運営も手掛けています。本社周辺には便利な商業施設があり、社員たちがランチを楽しむ人気のエリアとなっています。やまださんは毎朝散歩がてら近くの公園でリフレッシュする時間を設け、仕事に取り組むエネルギーを蓄えているそうです。,<マスキング済みの氏名>さんが経営する<マスキング済みの会社名>は<マスキング済みの住所>に本社を構えています。広島市の中心部に位置し、会社の郵便番号は<マスキング済みの郵便番号>です。本社ビルはオフィス街の中でも目立つ存在で、電話番号は<マスキング済みの電話番号>です。<マスキング済みの氏名>さんは生年月日が<マスキング済みの生年月日>で現在43歳です。会社の業務内容には地元企業向けのITコンサルティングや運用支援が含まれており、多くの企業に対して支援を行っています。特に地方の中小企業の課題を解決することに力を入れており、<マスキング済みの氏名>さんがリードするプロジェクトチームはこれまでに多くの成功事例を作り出してきました。また、彼自身のemailアドレスは<マスキング済みのemailアドレス>で、顧客や取引先とのコミュニケーションに活用されています。この会社は数年前に新しい分野に進出し、今ではオンラインショッピングのプラットフォーム運営も手掛けています。本社周辺には便利な商業施設があり、社員たちがランチを楽しむ人気のエリアとなっています。<マスキング済みの氏名>さんは毎朝散歩がてら近くの公園でリフレッシュする時間を設け、仕事に取り組むエネルギーを蓄えているそうです。
昨日、地元の商工会議所が主催する定例会議に参加しました。今回のテーマは地域活性化に向けた情報共有であり、様々な分野の専門家が参加していました。その中でも、株式会社ネクストステップの代表を務めるたかはしさんの講演は非常に印象的でした。たかはしさんは、東京都世田谷区上野毛4丁目12番9号に本社を構え、郵便番号は154-0001、連絡先は03-1234-5678です。彼の講演では、地域密着型の事業展開が地域経済にどのように貢献するかについて事例を交えながら説明されました。また、特に印象に残ったのは、彼の生年月日が1970年5月15日であるにもかかわらず、若い世代との連携に非常に積極的である点です。その後、会議終了後には参加者同士で名刺交換が行われ、彼の連絡先であるtakahashi@example.comにもフォローアップするよう依頼されました。地域の課題について率直な意見交換が行われた場は非常に有意義であり、次回の会議も楽しみにしています。,昨日、地元の商工会議所が主催する定例会議に参加しました。今回のテーマは地域活性化に向けた情報共有であり、様々な分野の専門家が参加していました。その中でも、<マスキング済みの会社名>の代表を務める<マスキング済みの氏名>さんの講演は非常に印象的でした。<マスキング済みの氏名>さんは、<マスキング済みの住所>に本社を構え、<マスキング済みの郵便番号>、連絡先は<マスキング済みの電話番号>です。彼の講演では、地域密着型の事業展開が地域経済にどのように貢献するかについて事例を交えながら説明されました。また、特に印象に残ったのは、彼の生年月日が<マスキング済みの生年月日>であるにもかかわらず、若い世代との連携に非常に積極的である点です。その後、会議終了後には参加者同士で名刺交換が行われ、彼の連絡先である<マスキング済みのemailアドレス>にもフォローアップするよう依頼されました。地域の課題について率直な意見交換が行われた場は非常に有意義であり、次回の会議も楽しみにしています。
さくら出版株式会社は、東京都港区赤坂2丁目8番1号に本社を構えています。同社は、長年にわたり教育出版を手掛けており、地域社会の教育向上に寄与してきました。昨年、同社の新しいプロジェクトリーダーとなったのは、やまださんです。このプロジェクトは、主に地方学校の教員向けにデジタル教材の普及を図るもので、彼女の指導のもと大きな進展を遂げています。なお、やまださんの連絡先は、メールアドレスがyamada@example.com、直通の携帯電話番号が080-1234-5678となっています。さらに、新しいオフィス拡張計画が進められ、年内に福岡支社を福岡市博多区に移転する予定です。この計画により、同社の従業員数は15％増加し、総勢200名以上の規模を目指しています。また、やまださんは、1990年4月15日生まれで、大学卒業後に同社に入社した経緯を持ち、現在では業界内での注目を集めています。,<マスキング済みの会社名>は、<マスキング済みの住所>に本社を構えています。同社は、長年にわたり教育出版を手掛けており、地域社会の教育向上に寄与してきました。昨年、同社の新しいプロジェクトリーダーとなったのは、<マスキング済みの氏名>さんです。このプロジェクトは、主に地方学校の教員向けにデジタル教材の普及を図るもので、彼女の指導のもと大きな進展を遂げています。なお、<マスキング済みの氏名>さんの連絡先は、メールアドレスが<マスキング済みのemailアドレス>、直通の携帯電話番号が<マスキング済みの電話番号>となっています。さらに、新しいオフィス拡張計画が進められ、年内に福岡支社を<マスキング済みの住所>に移転する予定です。この計画により、同社の従業員数は15％増加し、総勢200名以上の規模を目指しています。また、<マスキング済みの氏名>さんは、<マスキング済みの生年月日>で、大学卒業後に同社に入社した経緯を持ち、現在では業界内での注目を集めています。
株式会社みなと建設の本社所在地は東京都港区南青山3-2-5で、郵便番号は〒1070062です。営業部には、たかはしさんが在籍しており、先日は彼と直接仕事をする機会がありました。彼のメールアドレスはtakahashi@example.comですが、普段は直接携帯に連絡することが多く、彼の携帯番号は080-1234-5678です。また、たかはしさんの生年月日は1985年12月15日で、今回のプロジェクトにおいてその経験が非常に役立ちました。彼は以前に大阪市にある支店で働いていた際も、同様の業務を得意としており、お客様からの評判も良かったと聞いています。,<マスキング済みの会社名>の本社所在地は<マスキング済みの住所>で、<マスキング済みの郵便番号>です。営業部には、<マスキング済みの氏名>さんが在籍しており、先日は彼と直接仕事をする機会がありました。彼のメールアドレスは<マスキング済みのemailアドレス>ですが、普段は直接携帯に連絡することが多く、彼の携帯番号は<マスキング済みの電話番号>です。また、<マスキング済みの氏名>さんの生年月日は<マスキング済みの生年月日>で、今回のプロジェクトにおいてその経験が非常に役立ちました。彼は以前に<マスキング済みの住所>にある支店で働いていた際も、同様の業務を得意としており、お客様からの評判も良かったと聞いています。
今年の新年度会議は、やまださんが担当することになりました。やまださんは総務部の一員で、株式会社東亜技術開発の本社勤務です。同社の本社所在地は東京都港区芝公園1丁目2番3号です。郵便番号は1050011で、社用電話番号は03-1234-5678となっています。やまださんの役職は課長で、業務に関する問い合わせは彼の専用メールアドレスであるyamadakacho@example.co.jpに送付してください。また、やまださんの生年月日は1981年7月15日で、今年の誕生日には社内イベントが予定されています。昨年の同イベントは非常に盛況でしたが、今年は規模を拡大して開催される予定です。さらに、新年度を迎えるにあたり新入社員の研修スケジュールが練られ、やまださんがその責任者として運営をサポートすることになりました。彼の豊富な業務経験と緻密なスケジュール管理能力により、スムーズな進行が期待されています。やまださんは、新人研修以外にも、会社の外部連携プロジェクトで代表を務めており、周囲からの信頼も厚いです。,今年の新年度会議は、<マスキング済みの氏名>さんが担当することになりました。<マスキング済みの氏名>さんは総務部の一員で、<マスキング済みの会社名>の本社勤務です。同社の本社所在地は<マスキング済みの住所>です。郵便番号は<マスキング済みの郵便番号>で、社用電話番号は<マスキング済みの電話番号>となっています。<マスキング済みの氏名>さんの役職は課長で、業務に関する問い合わせは彼の専用メールアドレスである<マスキング済みのemailアドレス>に送付してください。また、<マスキング済みの氏名>さんの生年月日は<マスキング済みの生年月日>で、今年の誕生日には社内イベントが予定されています。昨年の同イベントは非常に盛況でしたが、今年は規模を拡大して開催される予定です。さらに、新年度を迎えるにあたり新入社員の研修スケジュールが練られ、<マスキング済みの氏名>さんがその責任者として運営をサポートすることになりました。彼の豊富な業務経験と緻密なスケジュール管理能力により、スムーズな進行が期待されています。<マスキング済みの氏名>さんは、新人研修以外にも、会社の外部連携プロジェクトで代表を務めており、周囲からの信頼も厚いです。
新宿区にある株式会社アイビー・コミュニケーションズは、広報業を手掛ける企業です。最近、やまださんが入社し、広報担当として活躍されています。彼女のメールアドレスはyamada@example.comで、連絡先は携帯電話の080-1234-5678です。広報課のオフィスは東京都新宿区西新宿6丁目10番1号で、郵便番号は160-0023。この住所は新宿中央公園のすぐ近くに位置しており、夜には公園のイルミネーションが綺麗に見える場所です。やまださんは東京都渋谷区代官山2丁目に住んでおり、郵便番号は150-0032です。休日には代官山ヒルズへ行くのが彼女の楽しみで、地元のお店を巡るのが趣味だそうです。さらに、彼女の生年月日は1992年7月15日で、先日30歳の誕生日を迎えました。職場ではその誕生日を祝うため、みんなでケーキを用意しました。,<マスキング済みの会社名>は、広報業を手掛ける企業です。最近、<マスキング済みの氏名>さんが入社し、広報担当として活躍されています。彼女のメールアドレスは<マスキング済みのemailアドレス>で、連絡先は携帯電話の<マスキング済みの電話番号>です。広報課のオフィスは<マスキング済みの住所>で、郵便番号は<マスキング済みの郵便番号>。この住所は新宿中央公園のすぐ近くに位置しており、夜には公園のイルミネーションが綺麗に見える場所です。<マスキング済みの氏名>さんは<マスキング済みの住所>に住んでおり、郵便番号は<マスキング済みの郵便番号>です。休日には地元のお店を巡るのが趣味だそうです。さらに、彼女の生年月日は<マスキング済みの生年月日>で、先日30歳の誕生日を迎えました。職場ではその誕生日を祝うため、みんなでケーキを用意しました。
小学校の同窓会についての詳細が明確になったのでお伝えします。2023年11月5日（日）に開催する予定です。会場は東京都渋谷区道玄坂1丁目12番3号のイベントホール「渋谷ミーティングスペース」で、開始時間は午後3時からとなります。参加される予定のやまださんには、日程の確認のために再度電子メールをお送りしました。やまださんの登録されているメールアドレスはyamadayamada@example.comです。また、何か問題がある場合には幹事のすずきさんに直接連絡を取っていただければと思います。すずきさんの電話番号は09012345678となります。なお、会場までは渋谷駅から徒歩5分ほどですので、公共交通機関の利用がおすすめです。どうぞお楽しみにしてください。,小学校の同窓会についての詳細が明確になったのでお伝えします。2023年11月5日（日）に開催する予定です。会場は<マスキング済みの住所>のイベントホール<マスキング済みの会社名>で、開始時間は午後3時からとなります。参加される予定の<マスキング済みの氏名>さんには、日程の確認のために再度電子メールをお送りしました。<マスキング済みの氏名>さんの登録されているメールアドレスは<マスキング済みのemailアドレス>です。また、何か問題がある場合には幹事の<マスキング済みの氏名>さんに直接連絡を取っていただければと思います。<マスキング済みの氏名>さんの電話番号は<マスキング済みの電話番号>となります。なお、会場までは渋谷駅から徒歩5分ほどですので、公共交通機関の利用がおすすめです。どうぞお楽しみにしてください。
やまださんは長年、株式会社光栄建設で勤務してきましたが、今年の夏に退職しました。彼の住所は大阪府大阪市西区新町1丁目2番3号で、郵便番号は〒5500013です。やまださんは1965年7月20日生まれで、退職後は趣味である旅行に専念する予定だそうです。最近では音楽にも興味を持ち始め、休日には楽器店巡りをしているそうです。友人であるたなかさんからは「年齢に関わらず新たなミッションに挑戦できるのは素晴らしい」と言われて喜んでいました。たなかさんの連絡先はtanaka.osaka@example.comで、電話番号は09012345678です。現在、やまださんは次の旅行先を計画中で、インターネットで情報収集を行っています。,<マスキング済みの氏名>さんは長年、<マスキング済みの会社名>で勤務してきましたが、今年の夏に退職しました。彼の住所は<マスキング済みの住所>で、郵便番号は<マスキング済みの郵便番号>です。<マスキング済みの氏名>さんは<マスキング済みの生年月日>生まれで、退職後は趣味である旅行に専念する予定だそうです。最近では音楽にも興味を持ち始め、休日には楽器店巡りをしているそうです。友人である<マスキング済みの氏名>さんからは「年齢に関わらず新たなミッションに挑戦できるのは素晴らしい」と言われて喜んでいました。<マスキング済みの氏名>さんの連絡先は<マスキング済みのemailアドレス>で、電話番号は<マスキング済みの電話番号>です。現在、<マスキング済みの氏名>さんは次の旅行先を計画中で、インターネットで情報収集を行っています。
