before_mask,after_mask
山田花子さんは東京都新宿区西新宿2丁目8番地のマンションに住んでいます。彼女は現在「株式会社未来テクノロジー」という会社でITエンジニアとして働いています。ちなみに、山田さんの生年月日は1985年5月15日で、メールアドレスはhanako.yamada@example.comです。彼女の自宅の郵便番号は1600023で、電話番号は03-1234-5678です。同僚の佐藤雄太さんは「株式会社未来テクノロジー」の営業部に所属しており、住所は埼玉県さいたま市中央区123-4567です。佐藤さんの生年月日は1990年2月20日で、電話番号は048-9876-5432です。,<マスキング済みの氏名>さんは<マスキング済みの住所>のマンションに住んでいます。彼女は現在<マスキング済みの会社名>という会社でITエンジニアとして働いています。ちなみに、<マスキング済みの氏名>さんの生年月日は<マスキング済みの生年月日>で、メールアドレスは<マスキング済みのemailアドレス>です。彼女の自宅の郵便番号は<マスキング済みの郵便番号>で、電話番号は<マスキング済みの電話番号>です。同僚の<マスキング済みの氏名>さんは<マスキング済みの会社名>の営業部に所属しており、住所は<マスキング済みの住所>です。<マスキング済みの氏名>さんの生年月日は<マスキング済みの生年月日>で、電話番号は<マスキング済みの電話番号>です。
先日、佐藤花子さんから、自宅の住所について教えてもらいました。彼女の住所は東京都渋谷区神南1-10-1で、郵便番号は150-0041だそうです。また、佐藤さんはABC商事株式会社に勤めており、役職は営業部のマネージャーです。会社の住所は東京都千代田区丸の内3-5-1で、郵便番号は100-0005とのことでした。彼女の職場のメールアドレスはhanako.sato@abc-shoji.co.jpで、電話番号は03-1234-5678です。一方、公私ともに交流のある田中一郎さんは、彼女の親しい友人で、生年月日は1985年5月20日だと言っていました。田中さんのご自宅の住所は大阪府大阪市北区梅田1-2-3で、郵便番号が530-0001で、中堅IT企業のXYZテクノロジー株式会社に勤務しています。彼の会社では、tanaka.ichiro@xyz-tech.jpというメールアドレスを使い、職場での連絡は06-9876-5432の電話番号がよく用いられるそうです。さらに、彼は趣味で旅行を楽しむことが多く、休日には友人らと旅行先の計画を立てることが習慣だと言っていました。,先日、<マスキング済みの氏名>さんから、自宅の住所について教えてもらいました。彼女の住所は<マスキング済みの住所>で、郵便番号は<マスキング済みの郵便番号>だそうです。また、<マスキング済みの氏名>さんは<マスキング済みの会社名>に勤めており、役職は営業部のマネージャーです。会社の住所は<マスキング済みの住所>で、郵便番号は<マスキング済みの郵便番号>とのことでした。彼女の職場のメールアドレスは<マスキング済みのemailアドレス>で、電話番号は<マスキング済みの電話番号>です。一方、公私ともに交流のある<マスキング済みの氏名>さんは、彼女の親しい友人で、生年月日は<マスキング済みの生年月日>だと言っていました。<マスキング済みの氏名>さんのご自宅の住所は<マスキング済みの住所>で、郵便番号が<マスキング済みの郵便番号>で、中堅IT企業の<マスキング済みの会社名>に勤務しています。彼の会社では、<マスキング済みのemailアドレス>というメールアドレスを使い、職場での連絡は<マスキング済みの電話番号>の電話番号がよく用いられるそうです。さらに、彼は趣味で旅行を楽しむことが多く、休日には友人らと旅行先の計画を立てることが習慣だと言っていました。
私が勤務している株式会社大和製作所は神奈川県横浜市中区本町3丁目12番8号に位置しています。郵便番号は231-0005です。私の名前は鈴木一朗で、生年月日は1985年6月15日です。また、会社の電話番号は045-123-9876でして、私は毎日この番号を使って多くの取引先と連絡を取っています。さらに、私の個人用メールアドレスはichiro.suzuki@example.comです。毎週末には、家族で都内に出かけることが多いです。自宅の住所は東京都杉並区高円寺南2丁目10番5号で、郵便番号は166-0003です。部屋の片付けが好きなので、家にいるときはよく掃除をしています。,私が勤務している<マスキング済みの会社名>は<マスキング済みの住所>に位置しています。郵便番号は<マスキング済みの郵便番号>です。私の名前は<マスキング済みの氏名>で、生年月日は<マスキング済みの生年月日>です。また、会社の電話番号は<マスキング済みの電話番号>でして、私は毎日この番号を使って多くの取引先と連絡を取っています。さらに、私の個人用メールアドレスは<マスキング済みのemailアドレス>です。毎週末には、家族で都内に出かけることが多いです。自宅の住所は<マスキング済みの住所>で、郵便番号は<マスキング済みの郵便番号>です。部屋の片付けが好きなので、家にいるときはよく掃除をしています。
昨日、山田太郎さんが東京都千代田区丸の内1丁目1番1号のABC不動産株式会社に訪ねてきました。彼とは学生時代からの友人で、長らく連絡を取っていなかったのですが、突然の電話で「最近どう？」と話しかけてきました。電話番号は09012345678で、しばらく聞き慣れた声に驚きました。久しぶりに会えたので、近くの喫茶店で2時間ほど談笑しましたが、太郎さんの仕事は大変多忙なようです。彼は現在、ABC不動産株式会社でIT関連のプロジェクトを担当しています。その途中で、彼の電子メールアドレス（例：taroyamada@example.com）の話題が出ましたが、最近は専用のオンラインツールが導入され、メールの使用頻度が減ってきたとぼやいていました。なお、彼の誕生日は1981年7月7日で、その日にお祝いメッセージを送り忘れることのないように、私は密かに日付をメモしておくことにしました。,昨日、<マスキング済みの氏名>さんが<マスキング済みの住所>の<マスキング済みの会社名>に訪ねてきました。彼とは学生時代からの友人で、長らく連絡を取っていなかったのですが、突然の電話で「最近どう？」と話しかけてきました。電話番号は<マスキング済みの電話番号>で、しばらく聞き慣れた声に驚きました。久しぶりに会えたので、近くの喫茶店で2時間ほど談笑しましたが、<マスキング済みの氏名>さんの仕事は大変多忙なようです。彼は現在、<マスキング済みの会社名>でIT関連のプロジェクトを担当しています。その途中で、彼の電子メールアドレス（例：<マスキング済みのemailアドレス>）の話題が出ましたが、最近は専用のオンラインツールが導入され、メールの使用頻度が減ってきたとぼやいていました。なお、彼の誕生日は<マスキング済みの生年月日>で、その日にお祝いメッセージを送り忘れることのないように、私は密かに日付をメモしておくことにしました。
昨日、私は友人の鈴木健二さんの新しい家を訪問しました。彼の住所は大阪府吹田市山田西4-2-31で、郵便番号は565-0825です。家に到着する前に彼の電話番号である080-4444-1234に連絡を取って、道順を確認しました。鈴木さんは株式会社勝利建設で営業部の課長をしており、その会社の所在地は大阪府大阪市北区梅田1丁目1番地です。また、彼のemailアドレスはkenji.suzuki@gmail.comです。彼は1990年5月15日生まれで、最近31歳の誕生日を祝ったばかりです。家に着くと、彼が得意な手料理で大歓迎してくれました。鈴木さんの家はとても広々としていて、近くに大きな公園もあるので、休日はよく家族とそこで過ごしているそうです。彼の奥さんとも話をしましたが、とても気さくで楽しい人でした。彼らの子供は今年小学1年生になり、元気いっぱいで遊びまわっていました。その日は夕方まで談笑しながら楽しいひと時を過ごしました。鈴木さんが勤務している会社では新しいプロジェクトを進めており、かなり忙しい時期だそうですが、とてもやりがいを感じていると話していました。,昨日、私は友人の<マスキング済みの氏名>さんの新しい家を訪問しました。彼の住所は<マスキング済みの住所>で、郵便番号は<マスキング済みの郵便番号>です。家に到着する前に彼の電話番号である<マスキング済みの電話番号>に連絡を取って、道順を確認しました。<マスキング済みの氏名>さんは<マスキング済みの会社名>で営業部の課長をしており、その会社の所在地は<マスキング済みの住所>です。また、彼のemailアドレスは<マスキング済みのemailアドレス>です。彼は<マスキング済みの生年月日>生まれで、最近<マスキング済みの年齢>歳の誕生日を祝ったばかりです。家に着くと、彼が得意な手料理で大歓迎してくれました。<マスキング済みの氏名>さんの家はとても広々としていて、近くに大きな公園もあるので、休日はよく家族とそこで過ごしているそうです。彼の奥さんとも話をしましたが、とても気さくで楽しい人でした。彼らの子供は今年小学1年生になり、元気いっぱいで遊びまわっていました。その日は夕方まで談笑しながら楽しいひと時を過ごしました。<マスキング済みの氏名>さんが勤務している会社では新しいプロジェクトを進めており、かなり忙しい時期だそうですが、とてもやりがいを感じていると話していました。
昨年の夏、佐藤花子さんが所属している株式会社〇〇工業の社員旅行に参加しました。その旅行先は沖縄県でした。社員みんなで海辺のリゾートホテルに滞在し、地元の料理やシュノーケリングを楽しみました。旅行中に花子さんが誕生日を迎えたこともあり、ケーキが用意されてお祝いしました。彼女の誕生日は1985年8月15日で、その日は晴天に恵まれた素晴らしい日となりました。また、ホテルに滞在している際、彼女は佐藤さん担当のクライアントから電話がかかってきました。そのクライアントは彼女の対応を高く評価しているので、何か業務関連の話だったようです。旅行終了後、彼女のメールアドレス（hanako.sato@example.com）に旅の写真や感想が送られてきて、非常に感動していた様子でした。ちなみに株式会社〇〇工業の所在地は東京都新宿区西新宿1丁目2番3号、その郵便番号は〒1634431です。,昨年の夏、<マスキング済みの氏名>さんが所属している<マスキング済みの会社名>の社員旅行に参加しました。その旅行先は沖縄県でした。社員みんなで海辺のリゾートホテルに滞在し、地元の料理やシュノーケリングを楽しみました。旅行中に<マスキング済みの氏名>さんが誕生日を迎えたこともあり、ケーキが用意されてお祝いしました。彼女の誕生日は<マスキング済みの生年月日>で、その日は晴天に恵まれた素晴らしい日となりました。また、ホテルに滞在している際、彼女は<マスキング済みの氏名>担当のクライアントから電話がかかってきました。そのクライアントは彼女の対応を高く評価しているので、何か業務関連の話だったようです。旅行終了後、彼女のメールアドレス（<マスキング済みのemailアドレス>）に旅の写真や感想が送られてきて、非常に感動していた様子でした。ちなみに<マスキング済みの会社名>の所在地は<マスキング済みの住所>、その郵便番号は<マスキング済みの郵便番号>です。
先日、私は旧友である佐藤健一さんと久々に再会しました。彼は現在、株式会社スターフォワードという物流関連の大手企業で管理職を務めており、住所は東京都台東区台東3丁目16番5号、第2グリーンビル402号室に住んでいると聞きました。佐藤さんは、電話番号09012345678で連絡を取ることもでき、連絡先メールアドレスはkenichi.sato@example.comを使用しているそうです。さらに、彼の生年月日は1985年2月15日で、今年で38歳になります。彼の話では、会社の新規プロジェクトで成功を収めたそうで、それを祝うために彼が提案した銀座のレストランで夕食を取ることにしました。そこでは、当日連絡を取りやすいように、彼の会社の受付番号である0335001234を活用することとなりました。夕食中、彼は会社でのエピソードや、自宅近くの上野に新しくオープンしたカフェについて話し、充実した時間を過ごしました。,先日、私は旧友である<マスキング済みの氏名>さんと久々に再会しました。彼は現在、<マスキング済みの会社名>という物流関連の大手企業で管理職を務めており、住所は<マスキング済みの住所>に住んでいると聞きました。<マスキング済みの氏名>さんは、電話番号<マスキング済みの電話番号>で連絡を取ることもでき、連絡先メールアドレスは<マスキング済みのemailアドレス>を使用しているそうです。さらに、彼の生年月日は<マスキング済みの生年月日>で、今年で38歳になります。彼の話では、会社の新規プロジェクトで成功を収めたそうで、それを祝うために彼が提案した銀座のレストランで夕食を取ることにしました。そこでは、当日連絡を取りやすいように、彼の会社の受付番号である<マスキング済みの電話番号>を活用することとなりました。夕食中、彼は会社でのエピソードや、自宅近くの上野に新しくオープンしたカフェについて話し、充実した時間を過ごしました。
先日、友人の山田花子さんから新しい仕事の話を聞きました。彼女は「株式会社日本未来ソリューション」に就職し、東京都渋谷区神南1-23-28の本社で働いています。そのオフィスはとてもモダンなデザインで、まさに未来を象徴するような建物だそうです。山田さんの連絡先は電話番号が08012345678で、メールアドレスがhanako.yamada@example.comとのことでした。彼女の生年月日は1990年4月8日で、今年で33歳になります。また、私は彼女に会いに行くため、近くにあるカフェの住所「東京都渋谷区宇田川町12-8」をメモしておきました。このカフェは駅から歩いて5分程度の距離にあり、アクセスも良いとのことでした。ちなみに、山田さんの実家は愛知県名古屋市中区栄1丁目14-15で、郵便番号は4600008です。子供の頃からの友人として、彼女の努力が実ったことを本当に嬉しく思っています。,先日、友人の<マスキング済みの氏名>さんから新しい仕事の話を聞きました。彼女は<マスキング済みの会社名>に就職し、<マスキング済みの住所>の本社で働いています。そのオフィスはとてもモダンなデザインで、まさに未来を象徴するような建物だそうです。<マスキング済みの氏名>さんの連絡先は電話番号が<マスキング済みの電話番号>で、メールアドレスが<マスキング済みのemailアドレス>とのことでした。彼女の生年月日は<マスキング済みの生年月日>で、今年で<マスキング済みの年齢>になります。また、私は彼女に会いに行くため、近くにあるカフェの住所<マスキング済みの住所>をメモしておきました。このカフェは駅から歩いて5分程度の距離にあり、アクセスも良いとのことでした。ちなみに、<マスキング済みの氏名>さんの実家は<マスキング済みの住所>で、郵便番号は<マスキング済みの郵便番号>です。子供の頃からの友人として、彼女の努力が実ったことを本当に嬉しく思っています。
松井花子さんは2020年に東京都渋谷区千駄ヶ谷3丁目14番地のマンションに引っ越してきました。その住所は今まで彼女が住んできた場所の中でも一番便利で、近くにはスーパーマーケットや公園があり、生活に困ることがありません。その一方で、彼女は仕事も忙しく、休日はできるだけ家でのんびり過ごすことを心がけています。松井さんが働いている会社は享楽株式会社で、場所は港区赤坂1丁目のオフィスビルにあります。郵便番号は1070052で電話番号は0355554444です。彼女のメールアドレスはhanako123@matsui.comで、上司や同僚とのやりとりのほか、クライアントとも日々連絡を取り合っています。松井さんは1987年5月16日生まれで、今年で36歳になります。彼女の職場では30代後半ながらも若手と呼ばれ、リーダーシップが評価されています。,<マスキング済みの氏名>さんは2020年に<マスキング済みの住所>に引っ越してきました。その住所は今まで彼女が住んできた場所の中でも一番便利で、近くにはスーパーマーケットや公園があり、生活に困ることがありません。その一方で、彼女は仕事も忙しく、休日はできるだけ家でのんびり過ごすことを心がけています。<マスキング済みの氏名>さんが働いている会社は<マスキング済みの会社名>で、場所は<マスキング済みの住所>にあります。郵便番号は<マスキング済みの郵便番号>で電話番号は<マスキング済みの電話番号>です。彼女のメールアドレスは<マスキング済みのemailアドレス>で、上司や同僚とのやりとりのほか、クライアントとも日々連絡を取り合っています。<マスキング済みの氏名>さんは<マスキング済みの生年月日>生まれで、今年で36歳になります。彼女の職場では30代後半ながらも若手と呼ばれ、リーダーシップが評価されています。
昨日、私の友人である小林大輔さんが勤務する株式会社大和企画に初めて訪問しました。株式会社大和企画は東京都渋谷区神宮前3丁目12番1号という立地にあり、非常におしゃれで洗練された建物に入居しています。小林さんは普段IT部門のリーダーとして業務をしているそうで、メールアドレスはdaisuke.kobayashi@example.com、連絡を取りたいときは職場の電話番号03-1234-5678か、個人携帯の090-8765-4321で連絡が可能です。彼の生年月日は1985年5月15日で、今年で38歳を迎えることになります。話を聞いていると、小林さんの役職にはプロジェクト管理やチームビルディングなどの重要な責任が伴っているそうで、かなり忙しいようです。会議室でコーヒーを飲みながら、最近のIT業界の動向やAIの活用について議論する機会があり、大変充実した時間を過ごしました。また、小林さんが今住んでいる住所は東京都世田谷区桜新町2丁目10番7号、郵便番号は〒154-0016で、近くには美味しいカフェがたくさんあるとのことでした。和やかな会話の時間が続き、最後には渋谷駅前でお別れしました。,昨日、私の友人である<マスキング済みの氏名>さんが勤務する<マスキング済みの会社名>に初めて訪問しました。<マスキング済みの会社名>は<マスキング済みの住所>という立地にあり、非常におしゃれで洗練された建物に入居しています。<マスキング済みの氏名>さんは普段IT部門のリーダーとして業務をしているそうで、メールアドレスは<マスキング済みのemailアドレス>、連絡を取りたいときは職場の電話番号<マスキング済みの電話番号>か、個人携帯の<マスキング済みの電話番号>で連絡が可能です。彼の生年月日は<マスキング済みの生年月日>で、今年で38歳を迎えることになります。話を聞いていると、<マスキング済みの氏名>さんの役職にはプロジェクト管理やチームビルディングなどの重要な責任が伴っているそうで、かなり忙しいようです。会議室でコーヒーを飲みながら、最近のIT業界の動向やAIの活用について議論する機会があり、大変充実した時間を過ごしました。また、<マスキング済みの氏名>さんが今住んでいる住所は<マスキング済みの住所>、郵便番号は<マスキング済みの郵便番号>で、近くには美味しいカフェがたくさんあるとのことでした。和やかな会話の時間が続き、最後には渋谷駅前でお別れしました。
田中花子さんが代表を務める株式会社未来企画の本社所在地は東京都渋谷区代々木2丁目6番8号、郵便番号は151-0053です。この会社は国内外のビジネス展開を行っており、革新的な商品を多数生み出しています。田中さんの職場の固定電話番号は03-1234-5678で、彼女の直接の連絡先のメールアドレスはhanako.tanaka@example.comです。また、彼女の生年月日は1985年3月15日で、先日38歳の誕生日を祝ったばかりです。株式会社未来企画は営業部門で200人以上の社員を抱え、多彩な業界で活躍していることでも知られています。毎年社員旅行を実施しており、昨年度は沖縄を訪問しました。その際、田中花子さんは団体の先頭に立ち、スケジュール調整から参加者管理までを行い、そのリーダーシップには社員全員が感心していました。なお、今年度の旅行先は北海道に決まったそうです。,<マスキング済みの氏名>さんが代表を務める<マスキング済みの会社名>の本社所在地は<マスキング済みの住所>、郵便番号は<マスキング済みの郵便番号>です。この会社は国内外のビジネス展開を行っており、革新的な商品を多数生み出しています。<マスキング済みの氏名>さんの職場の固定電話番号は<マスキング済みの電話番号>で、彼女の直接の連絡先のメールアドレスは<マスキング済みのemailアドレス>です。また、彼女の生年月日は<マスキング済みの生年月日>で、先日<マスキング済みの年齢>歳の誕生日を祝ったばかりです。<マスキング済みの会社名>は営業部門で200人以上の社員を抱え、多彩な業界で活躍していることでも知られています。毎年社員旅行を実施しており、昨年度は沖縄を訪問しました。その際、<マスキング済みの氏名>さんは団体の先頭に立ち、スケジュール調整から参加者管理までを行い、そのリーダーシップには社員全員が感心していました。なお、今年度の旅行先は北海道に決まったそうです。
