before_mask,after_mask
鈴木太郎さんは東京都渋谷区千駄ヶ谷2丁目13-12に住んでおり、生年月日は1980年5月25日です。彼の職場は株式会社未来創造で、会社の所在地は東京都港区赤坂5丁目3-1。職場の代表電話番号は03-1234-5678で、書類送付用の郵便番号は〒150-0001です。また、彼の個人メールアドレスはtaro.suzuki1980@gmail.comで、お友達や家族との連絡によく使用しています。先日、彼は地元の友人である佐藤花子さんと連絡を取るため、スポーツイベントへの招待状を送付しました。花子さんの住所は神奈川県横浜市中区山下町45-9で、電話番号は080-9876-5432です。このイベントに関連して、参加者は事前に同意書に署名するよう求められていますが、返送先の電子メールアドレスはrequest@miraifuture.co.jpで指定されています。この同意書には、参加者がイベント開催日である2023年12月15日までに署名し、返送する必要があります。鈴木さんは友人を招待しつつ、自分もイベント準備に忙しく取り組んでいます。,<マスキング済みの氏名>さんは<マスキング済みの住所>に住んでおり、生年月日は<マスキング済みの生年月日>です。彼の職場は<マスキング済みの会社名>で、会社の所在地は<マスキング済みの住所>。職場の代表電話番号は<マスキング済みの電話番号>で、書類送付用の郵便番号は<マスキング済みの郵便番号>です。また、彼の個人メールアドレスは<マスキング済みのemailアドレス>で、お友達や家族との連絡によく使用しています。先日、彼は地元の友人である<マスキング済みの氏名>さんと連絡を取るため、スポーツイベントへの招待状を送付しました。<マスキング済みの氏名>さんの住所は<マスキング済みの住所>で、電話番号は<マスキング済みの電話番号>です。このイベントに関連して、参加者は事前に同意書に署名するよう求められていますが、返送先の電子メールアドレスは<マスキング済みのemailアドレス>で指定されています。この同意書には、参加者がイベント開催日である<マスキング済みの生年月日>までに署名し、返送する必要があります。<マスキング済みの氏名>さんは友人を招待しつつ、自分もイベント準備に忙しく取り組んでいます。
先日、佐藤花子さんから連絡をいただいて、彼女の現在の住まいが東京都渋谷区神南1丁目11番3号であると知りました。これまで彼女が埼玉県に住んでいると思っていたので、少し驚きました。実は、彼女が最近転職をしていて、新しい勤務先の会社名がABCソリューション株式会社で、東京都港区六本木4丁目12番24号にオフィスがあります。そんな話をしていたとき、彼女の誕生日である1990年4月25日が近づいていることも思い出しました。「そろそろ誕生日のお祝いを兼ねて、一緒に食事をしたいね」と持ち掛けると、彼女もその提案に喜んでくれました。佐藤さんのメールアドレス（hanako.sato@example.jp）に連絡を取ると、すぐに返信をくれたのは嬉しかったです。それから日時と場所を決めるためのやり取りをしました。連絡内容のなかで、彼女の携帯電話番号が090-1234-5678であることも改めて確認しました。ちなみに、ご自宅の郵便番号は150-0041で、自宅と勤務先のちょうど中間地点にあるレストランでの集まりを計画することにしました。,先日、<マスキング済みの氏名>さんから連絡をいただいて、彼女の現在の住まいが<マスキング済みの住所>であると知りました。これまで彼女が埼玉県に住んでいると思っていたので、少し驚きました。実は、彼女が最近転職をしていて、新しい勤務先の会社名が<マスキング済みの会社名>で、<マスキング済みの住所>にオフィスがあります。そんな話をしていたとき、彼女の誕生日である<マスキング済みの生年月日>が近づいていることも思い出しました。「そろそろ誕生日のお祝いを兼ねて、一緒に食事をしたいね」と持ち掛けると、彼女もその提案に喜んでくれました。<マスキング済みの氏名>さんのメールアドレス（<マスキング済みのemailアドレス>）に連絡を取ると、すぐに返信をくれたのは嬉しかったです。それから日時と場所を決めるためのやり取りをしました。連絡内容のなかで、彼女の携帯電話番号が<マスキング済みの電話番号>であることも改めて確認しました。ちなみに、ご自宅の郵便番号は<マスキング済みの郵便番号>で、自宅と勤務先のちょうど中間地点にあるレストランでの集まりを計画することにしました。
昨日、私の友人であり大学時代の同級生である佐藤健一が、ついに自分の夢を叶えたと聞きました。彼が経営している株式会社未来工房の新しいオフィスが東京都港区赤坂1丁目2番3号に移転し、仕事がますます繁忙になっているそうです。実際、会社の電話番号07012345678に電話してお祝いを伝えたところ、佐藤自身は電話に出る時間がないほど多忙とのことでした。また、佐藤は昨年6月15日に結婚し、現在妻と一緒に川崎市高津区の一軒家に住んでいます。結婚式の招待状が届いた際には、彼のメールアドレスkenichi.sato@example.com経由で問い合わせをしたことを思い出しました。郵便番号2100001の自宅に訪問する機会があり、そこで新婚夫婦の幸せそうな暮らしぶりを目にしたのがついこの間のことのようです。お互い中学時代からの知り合いで、彼が1978年3月27日に東京都で生まれた際からの友人関係は続いています。新オフィスの展示会でまた再会する予定ですが、忙しい中健康管理もしっかりしてほしいと願うばかりです。,昨日、私の友人であり大学時代の同級生である<マスキング済みの氏名>が、ついに自分の夢を叶えたと聞きました。彼が経営している<マスキング済みの会社名>の新しいオフィスが<マスキング済みの住所>に移転し、仕事がますます繁忙になっているそうです。実際、会社の電話番号<マスキング済みの電話番号>に電話してお祝いを伝えたところ、<マスキング済みの氏名>自身は電話に出る時間がないほど多忙とのことでした。また、<マスキング済みの氏名>は昨年<マスキング済みの生年月日>に結婚し、現在妻と一緒に<マスキング済みの住所>の一軒家に住んでいます。結婚式の招待状が届いた際には、彼のメールアドレス<マスキング済みのemailアドレス>経由で問い合わせをしたことを思い出しました。<マスキング済みの郵便番号>の自宅に訪問する機会があり、そこで新婚夫婦の幸せそうな暮らしぶりを目にしたのがついこの間のことのようです。お互い中学時代からの知り合いで、彼が<マスキング済みの生年月日>に<マスキング済みの住所>で生まれた際からの友人関係は続いています。新オフィスの展示会でまた再会する予定ですが、忙しい中健康管理もしっかりしてほしいと願うばかりです。
先週末の土曜日、佐藤香織さんの新居祝いを兼ねて都内でホームパーティーが開かれました。彼女の新居の住所は東京都渋谷区恵比寿1丁目9-23で、郵便番号は〒1500013です。そのパーティーには彼女の友人である松本颯太さんや井上美智子さんも参加しました。井上さんは株式会社未来創造に勤めており、会社の所在地は東京都港区高輪3丁目5-10、郵便番号は〒1080074とのことです。さらに、佐藤さんの職場である株式会社光輝技術研究所からも人が招かれており、職場の所在地は東京都新宿区西新宿7丁目22-31です。パーティー中には佐藤さんの誕生日のお祝いもありました。彼女の生年月日は1985年5月14日で、井上さんがピンクの花束を贈っていました。また、佐藤さんの弟の香太郎さんも参加し、久しぶりに顔を合わせたとのことで楽しい宴会となりました。佐藤さんはパーティーの様子をInstagramに投稿して、「楽しい時間をありがとう！」とコメントしていました。井上さんの連絡先のメールアドレスはinoue.michiko@example.co.jpで、電話番号は03-3456-7890です。,先週末の土曜日、<マスキング済みの氏名>さんの新居祝いを兼ねて都内でホームパーティーが開かれました。彼女の新居の住所は<マスキング済みの住所>で、郵便番号は<マスキング済みの郵便番号>です。そのパーティーには彼女の友人である<マスキング済みの氏名>さんや<マスキング済みの氏名>さんも参加しました。<マスキング済みの氏名>さんは<マスキング済みの会社名>に勤めており、会社の所在地は<マスキング済みの住所>、郵便番号は<マスキング済みの郵便番号>とのことです。さらに、<マスキング済みの氏名>さんの職場である<マスキング済みの会社名>からも人が招かれており、職場の所在地は<マスキング済みの住所>です。パーティー中には<マスキング済みの氏名>さんの誕生日のお祝いもありました。彼女の生年月日は<マスキング済みの生年月日>で、<マスキング済みの氏名>さんがピンクの花束を贈っていました。また、<マスキング済みの氏名>さんの弟の<マスキング済みの氏名>さんも参加し、久しぶりに顔を合わせたとのことで楽しい宴会となりました。<マスキング済みの氏名>さんはパーティーの様子をInstagramに投稿して、「楽しい時間をありがとう！」とコメントしていました。<マスキング済みの氏名>さんの連絡先のメールアドレスは<マスキング済みのemailアドレス>で、電話番号は<マスキング済みの電話番号>です。
高橋由美さんは、株式会社東京テクノロジーに勤めています。同社の本社は東京都新宿区西新宿6丁目5番1号に構えています。彼女の自宅は埼玉県さいたま市浦和区北浦和3丁目4番2号のマンションで、郵便番号は123-4567です。また、高橋さんのメールアドレスはyumi.takahashi@example.jpで、彼女の誕生日は1988年6月14日です。さらに、お問い合わせの際は、会社の代表電話番号03-1234-5678か、彼女自身の携帯番号080-9876-5432に連絡をお願いします。,<マスキング済みの氏名>さんは、<マスキング済みの会社名>に勤めています。同社の本社は<マスキング済みの住所>に構えています。彼女の自宅は<マスキング済みの住所>のマンションで、郵便番号は<マスキング済みの郵便番号>です。また、<マスキング済みの氏名>さんのメールアドレスは<マスキング済みのemailアドレス>で、彼女の誕生日は<マスキング済みの生年月日>です。さらに、お問い合わせの際は、会社の代表電話番号<マスキング済みの電話番号>か、彼女自身の携帯番号<マスキング済みの電話番号>に連絡をお願いします。
佐藤一郎さんと私の父との友情は、もう10年以上も続いています。最初に出会ったのは、父が勤めていた株式会社山田商事の取引先企業の担当者同士という立場だったそうです。その頃、佐藤一郎さんは東京都渋谷区道玄坂1丁目2番3号というオフィスに勤務しており、頻繁に電話でやり取りをしていました。当時は03-1234-5678という電話番号で連絡を取り合っていたと聞いています。佐藤さんはとても気さくで面倒見のいい方で、父の相談にもよく乗ってくれていたそうです。今でも家族ぐるみでお付き合いをしており、先日も私の誕生日、2000年12月15日を祝ってくれるために、自宅まで来てくれました。その時のメールは、satoichiro@example.comというアドレスから届き、とても心のこもった内容でした。我が家は横浜市中区桜木町1丁目のマンションに住んでいるのですが、そこで催した小さなホームパーティーに参加していただきました。,<マスキング済みの氏名>さんと私の父との友情は、もう10年以上も続いています。最初に出会ったのは、父が勤めていた<マスキング済みの会社名>の取引先企業の担当者同士という立場だったそうです。その頃、<マスキング済みの氏名>さんは<マスキング済みの住所>というオフィスに勤務しており、頻繁に電話でやり取りをしていました。当時は<マスキング済みの電話番号>という電話番号で連絡を取り合っていたと聞いています。<マスキング済みの氏名>さんはとても気さくで面倒見のいい方で、父の相談にもよく乗ってくれていたそうです。今でも家族ぐるみでお付き合いをしており、先日も私の誕生日、<マスキング済みの生年月日>を祝ってくれるために、自宅まで来てくれました。その時のメールは、<マスキング済みのemailアドレス>というアドレスから届き、とても心のこもった内容でした。我が家は<マスキング済みの住所>に住んでいるのですが、そこで催した小さなホームパーティーに参加していただきました。
秋田県出身の佐藤陽子さんは、1985年7月12日生まれで、現在東京都新宿区に住んでいます。新宿駅近くの株式会社未来技術研究所という会社でAI開発に携わる仕事をしています。この会社は東京都新宿区西新宿3丁目15番5号、郵便番号は〒1600023にあります。彼女の同僚からは「よく気が回る人」として高く評価されており、プロジェクトリーダーとしても信頼されています。仕事ではemailアドレスとしてyoko.sato@mirairi.co.jpを使用しており、問い合わせなどは主にこのアドレスに送られます。また、彼女の連絡先電話番号は03-1234-5678で、業務連絡や緊急時に使われています。佐藤さんは、仕事以外でも地元の学生向けにAI関連のワークショップを企画しており、多くの若者からの支持を得ています。,<マスキング済みの住所>出身の<マスキング済みの氏名>さんは、<マスキング済みの生年月日>生まれで、現在<マスキング済みの住所>に住んでいます。新宿駅近くの<マスキング済みの会社名>という会社でAI開発に携わる仕事をしています。この会社は<マスキング済みの住所>、郵便番号は<マスキング済みの郵便番号>にあります。彼女の同僚からは「よく気が回る人」として高く評価されており、プロジェクトリーダーとしても信頼されています。仕事ではemailアドレスとして<マスキング済みのemailアドレス>を使用しており、問い合わせなどは主にこのアドレスに送られます。また、彼女の連絡先電話番号は<マスキング済みの電話番号>で、業務連絡や緊急時に使われています。<マスキング済みの氏名>さんは、仕事以外でも地元の学生向けにAI関連のワークショップを企画しており、多くの若者からの支持を得ています。
山本幸太郎は、株式会社友栄技研で勤めています。同社は福岡県福岡市博多区博多駅前2丁目5-28に拠点を構えており、郵便番号は8120011です。山本さんの生年月日は1982年7月15日で、会社の専用電話番号は092-411-1234です。彼は技術部に所属し、メールアドレスはkouji.yamamoto@tomoei-giken.co.jpを使用しています。さらに、彼の自宅住所は福岡県福岡市東区香椎浜1丁目9-3-102号室です。休日にはよく香椎宮を訪れてはリラックスしています。地域コミュニティ活動にも力を入れており、地元のイベントで顔を合わせることが多いです。,<マスキング済みの氏名>は、<マスキング済みの会社名>で勤めています。同社は<マスキング済みの住所>に拠点を構えており、<マスキング済みの郵便番号>です。<マスキング済みの氏名>さんの生年月日は<マスキング済みの生年月日>で、会社の専用電話番号は<マスキング済みの電話番号>です。彼は技術部に所属し、メールアドレスは<マスキング済みのemailアドレス>を使用しています。さらに、彼の自宅住所は<マスキング済みの住所>です。休日にはよく香椎宮を訪れてはリラックスしています。地域コミュニティ活動にも力を入れており、地元のイベントで顔を合わせることが多いです。
昨日は田中花子さんに初めて会ったのですが、驚くほど親切で、いろいろなことを丁寧に教えていただきました。田中さんは、株式会社東京ビジネスソリューションという会社で経理課長をしているそうです。その会社のオフィスは東京都千代田区丸の内1丁目5番8号にあり、郵便番号は〒1000005です。私も一度、その会社に訪問する予定があり、事前に田中さんから連絡をいただいていたのですが、メールはhanako.tanaka@example.comから届きました。さらに、会社の代表番号は03-1234-5678で、田中さんの内線番号は567です。また、彼女は昭和56年（1981年）12月15日生まれで、現在41歳です。そんな経歴を聞いて、彼女がとても経験豊富であることがよくわかりました。来週もまた田中さんに相談する予定があり、次回は部署全体の資金運用についてアドバイスをいただくつもりです。田中さんから真摯なメッセージをもらって、本当に信頼できる方だと思っています。,昨日は<マスキング済みの氏名>さんに初めて会ったのですが、驚くほど親切で、いろいろなことを丁寧に教えていただきました。<マスキング済みの氏名>さんは、<マスキング済みの会社名>という会社で経理課長をしているそうです。その会社のオフィスは<マスキング済みの住所>にあり、郵便番号は<マスキング済みの郵便番号>です。私も一度、その会社に訪問する予定があり、事前に<マスキング済みの氏名>さんから連絡をいただいていたのですが、メールは<マスキング済みのemailアドレス>から届きました。さらに、会社の代表番号は<マスキング済みの電話番号>で、<マスキング済みの氏名>さんの内線番号は<マスキング済みの電話番号>です。また、彼女は<マスキング済みの生年月日>生まれで、現在<マスキング済みの氏名>歳です。そんな経歴を聞いて、彼女がとても経験豊富であることがよくわかりました。来週もまた<マスキング済みの氏名>さんに相談する予定があり、次回は部署全体の資金運用についてアドバイスをいただくつもりです。<マスキング済みの氏名>さんから真摯なメッセージをもらって、本当に信頼できる方だと思っています。
昨日、株式会社未来企画の研修会に参加してきました。この会社は東京都新宿区西新宿8丁目3番1号にオフィスを構えており、郵便番号は160-0023です。研修会の講師は高橋幸子さんという方で、生年月日は1978年12月10日です。講義の中では日本の企業が直面する課題について議論があり、途中で講師の方から名刺交換をお願いされ、contact@mirai.co.jpというメールアドレスと、03-1234-5678という電話番号が記載されていました。また、参加者は20名程度で、様々なバックグラウンドを持つ方々でした。隣に座っていた男性は、山田一郎という名前で、彼の自己紹介によると大阪府堺市堺区大浜3-1-4に住んでおり、郵便番号は590-0977でした。彼の連絡先メールアドレスはichiro.yamada.osaka@xxxxxx.comとのことで、頻繁に東京や海外を行き来していると言っていました。講義の最後にはアンケートが配られ、「今後の活動に活用させていただきますので、詳しいご意見をお聞かせください」と案内がありました。思った以上に内容の深い研修会で、帰りの電車では久しぶりにメモを見返しながら新しい発見を多く得た過程を振り返りました。,昨日、<マスキング済みの会社名>の研修会に参加してきました。この会社は<マスキング済みの住所>にオフィスを構えており、郵便番号は<マスキング済みの郵便番号>です。研修会の講師は<マスキング済みの氏名>という方で、生年月日は<マスキング済みの生年月日>です。講義の中では日本の企業が直面する課題について議論があり、途中で講師の方から名刺交換をお願いされ、<マスキング済みのemailアドレス>というメールアドレスと、<マスキング済みの電話番号>という電話番号が記載されていました。また、参加者は20名程度で、様々なバックグラウンドを持つ方々でした。隣に座っていた男性は、<マスキング済みの氏名>という名前で、彼の自己紹介によると<マスキング済みの住所>に住んでおり、郵便番号は<マスキング済みの郵便番号>でした。彼の連絡先メールアドレスは<マスキング済みのemailアドレス>とのことで、頻繁に東京や海外を行き来していると言っていました。講義の最後にはアンケートが配られ、「今後の活動に活用させていただきますので、詳しいご意見をお聞かせください」と案内がありました。思った以上に内容の深い研修会で、帰りの電車では久しぶりにメモを見返しながら新しい発見を多く得た過程を振り返りました。
