before_mask,after_mask,category,sub_category
"ある日、私は友人の佐藤健二とともに、株式会社グローバルテクノロジーのオフィスを訪れました。彼はその会社でシステムエンジニアとして働いており、私もその分野に興味があったため、見学させてもらうことになったのです。東京都新宿区西新宿にあるそのオフィスは、非常にモダンで、最先端の設備が整っていました。友人は私にいろいろと説明してくれましたが、特に印象に残ったのは、彼が話していたプロジェクトの内容でした。そのプロジェクトは、人工知能を活用したデータ解析システムの開発で、革新的な技術が用いられているとのことでした。

所々にいる社員の皆さんは忙しそうに作業をしていて、活気に満ちた雰囲気が漂っていました。私は、「このような環境で仕事をするのは楽しそうだな」と思いながら見学を続けました。佐藤は、私にチームメンバーとのインタビューやミーティングの様子を見せてくれました。その中で、チームリーダーの高橋未来さんがプロジェクトの進行状況や問題点について話し合っていた姿がとても印象的でした。

見学が終わった後、佐藤は私を連れて、近くの飲食店でランチを取ることにしました。店は青山に位置していて、洒落た雰囲気が漂っています。私たちはパスタやサラダを注文しながら、これからのキャリアについて話しました。それに加えて、未来の技術やAIについての考えも交えて楽しい時間を過ごしました。

午前中の見学やランチの後、佐藤は私に「もしあなたがこの業界に興味があるなら、ぜひ技術者としての道を考えてみてほしい。」と励ましの言葉をかけてくれました。私は彼の言葉に大いに感銘を受け、自分のこれからについて真剣に考えるきっかけとなりました。楽しい一日を過ごし、夜遅くに自宅に戻ったとき、すでに充実感が漂っていました。

私のメールアドレスはexample@gmail.comで、何か質問などあればいつでも連絡してもらえればと思います。電話番号は090-9876-5432ですが、留守番電話にメッセージを残してくれれば、すぐに折り返します。さて、今後はどのような方向に進むべきか、じっくりと考えてみるつもりです。","ある日、私は友人の<マスキング済の氏名>とともに、<マスキング済の会社名>のオフィスを訪れました。彼はその会社でシステムエンジニアとして働いており、私もその分野に興味があったため、見学させてもらうことになったのです。<マスキング済の住所>にあるそのオフィスは、非常にモダンで、最先端の設備が整っていました。友人は私にいろいろと説明してくれましたが、特に印象に残ったのは、彼が話していたプロジェクトの内容でした。そのプロジェクトは、人工知能を活用したデータ解析システムの開発で、革新的な技術が用いられているとのことでした。

所々にいる社員の皆さんは忙しそうに作業をしていて、活気に満ちた雰囲気が漂っていました。私は、「このような環境で仕事をするのは楽しそうだな」と思いながら見学を続けました。<マスキング済の氏名>は、私にチームメンバーとのインタビューやミーティングの様子を見せてくれました。その中で、チームリーダーの<マスキング済の氏名>がプロジェクトの進行状況や問題点について話し合っていた姿がとても印象的でした。

見学が終わった後、<マスキング済の氏名>は私を連れて、近くの飲食店でランチを取ることにしました。店は青山に位置していて、洒落た雰囲気が漂っています。私たちはパスタやサラダを注文しながら、これからのキャリアについて話しました。それに加えて、未来の技術やAIについての考えも交えて楽しい時間を過ごしました。

午前中の見学やランチの後、<マスキング済の氏名>は私に「もしあなたがこの業界に興味があるなら、ぜひ技術者としての道を考えてみてほしい。」と励ましの言葉をかけてくれました。私は彼の言葉に大いに感銘を受け、自分のこれからについて真剣に考えるきっかけとなりました。楽しい一日を過ごし、夜遅くに自宅に戻ったとき、すでに充実感が漂っていました。

私のメールアドレスは<マスキング済のemailアドレス>で、何か質問などあればいつでも連絡してもらえればと思います。電話番号は<マスキング済の電話番号>ですが、留守番電話にメッセージを残してくれれば、すぐに折り返します。さて、今後はどのような方向に進むべきか、じっくりと考えてみるつもりです。",company_name,add_corp_after_english_company_name
私は最近、株式会社Sonyのプロジェクトに参加することになりました。私の名前は山田花子で、東京都中央区銀座5丁目のオフィスで働いています。このプロジェクトは、最新のゲーム技術を開発するためのもので、チームは非常に多様なバックグラウンドを持つ専門家たちで構成されています。生年月日は1985年5月15日で、仕事以外でも週末には友人と遊びに行ったり、趣味の写真撮影を楽しんでいます。チーム内でのコミュニケーションは主にメールで行っており、私のメールアドレスはhanako.yamada@sony.co.jpです。何か連絡があれば、私の携帯電話番号、090-9876-5432にご連絡ください。また、私の自宅は東京都世田谷区羽根木3丁目にあり、郵便番号は154-0005です。プロジェクトは来年の夏に発表予定で、私たちはそれに向けて一生懸命頑張っています。,私は最近、<マスキング済の会社名>のプロジェクトに参加することになりました。私の名前は<マスキング済の氏名>で、<マスキング済の住所>のオフィスで働いています。このプロジェクトは、最新のゲーム技術を開発するためのもので、チームは非常に多様なバックグラウンドを持つ専門家たちで構成されています。生年月日は<マスキング済の生年月日>で、仕事以外でも週末には友人と遊びに行ったり、趣味の写真撮影を楽しんでいます。チーム内でのコミュニケーションは主にメールで行っており、私のメールアドレスは<マスキング済のemailアドレス>です。何か連絡があれば、私の携帯電話番号、<マスキング済の電話番号>にご連絡ください。また、私の自宅は<マスキング済の住所>にあり、郵便番号は<マスキング済の郵便番号>です。プロジェクトは来年の夏に発表予定で、私たちはそれに向けて一生懸命頑張っています。,company_name,add_corp_after_english_company_name
私の名前は山田花子です。私は東京に住んでおり、東京都渋谷区道玄坂2丁目にあるカフェで働いています。お店の名前は、株式会社フード＆カフェです。生年月日は1988年5月15日で、私の趣味は読書と料理です。もし連絡が必要でしたら、私のメールアドレスはhanako.yamada@example.com、電話番号は03-1234-5678です。毎週火曜日は休みなので、その日以外に連絡をもらえると助かります。会社は毎日多忙で、特にランチタイムはたくさんの人が訪れます。最近、私たちのカフェでは新しいメニューを導入しました。それは、特製のグリーンスムージーです。私たちのカフェに来たら、ぜひ試してみてください。会話の中で新しいお客様とも親しくなれるのが大好きですし、美味しい料理を提供することで喜んでもらえるのが何より嬉しいですね。そういった日々のやり取りを通じて、たくさんの人とのつながりができていくのが楽しいです。お客様とのコミュニケーションを大切にしながら、これからも頑張っていきたいと思っています。,私の名前は<マスキング済の氏名>です。私は東京に住んでおり、<マスキング済の住所>にあるカフェで働いています。お店の名前は、<マスキング済の会社名>です。生年月日は<マスキング済の生年月日>で、私の趣味は読書と料理です。もし連絡が必要でしたら、私のメールアドレスは<マスキング済のemailアドレス>、電話番号は<マスキング済の電話番号>です。毎週火曜日は休みなので、その日以外に連絡をもらえると助かります。会社は毎日多忙で、特にランチタイムはたくさんの人が訪れます。最近、私たちのカフェでは新しいメニューを導入しました。それは、特製のグリーンスムージーです。私たちのカフェに来たら、ぜひ試してみてください。会話の中で新しいお客様とも親しくなれるのが大好きですし、美味しい料理を提供することで喜んでもらえるのが何より嬉しいですね。そういった日々のやり取りを通じて、たくさんの人とのつながりができていくのが楽しいです。お客様とのコミュニケーションを大切にしながら、これからも頑張っていきたいと思っています。,company_name,add_corp_after_english_company_name
私は、株式会社Neural Networks Japanの井上健司と申します。普段は東京都渋谷区のオフィスで働いており、主に機械学習関連のプロジェクトに携わっています。生まれは1985年5月10日で、今年で38歳になります。私の連絡先は090-1234-5678で、メールアドレスはinoue.kenji@example.comです。今度、社内で行われるプロジェクト発表会の準備をしているので、その際にお手伝いいただける方を探しています。具体的には、発表内容のブラッシュアップと、リハーサルが必要です。ご興味のある方がいれば、1週間後の水曜日までにご連絡をいただけると助かります。それにしても、昨日はとても良い天気でしたので、仕事の合間に外に出てリフレッシュしました。その際、近くの公園でランニングをすることができたので、心身ともにリフレッシュできました。ぜひ、一緒に働く仲間を増やし、みんなで楽しんでプロジェクトを進められたらと思っています。よろしくお願いいたします。,私は、<マスキング済の会社名>の<マスキング済の氏名>と申します。普段は<マスキング済の住所>のオフィスで働いており、主に機械学習関連のプロジェクトに携わっています。生まれは<マスキング済の生年月日>で、今年で38歳になります。私の連絡先は<マスキング済の電話番号>で、メールアドレスは<マスキング済のemailアドレス>です。今度、社内で行われるプロジェクト発表会の準備をしているので、その際にお手伝いいただける方を探しています。具体的には、発表内容のブラッシュアップと、リハーサルが必要です。ご興味のある方がいれば、1週間後の水曜日までにご連絡をいただけると助かります。それにしても、昨日はとても良い天気でしたので、仕事の合間に外に出てリフレッシュしました。その際、近くの公園でランニングをすることができたので、心身ともにリフレッシュできました。ぜひ、一緒に働く仲間を増やし、みんなで楽しんでプロジェクトを進められたらと思っています。よろしくお願いいたします。,company_name,add_corp_after_english_company_name
こんにちは、私の名前は佐藤花子です。私は東京の渋谷区に住んでおり、ABC Corporationで働いています。私の所属する部署では、毎日新しいプロジェクトが立ち上がり、多くのチャレンジしています。私のオフィスは、東京都渋谷区桜丘町123-456にあり、週末には友人たちと一緒に渋谷のカフェでリフレッシュすることが好きです。また、私の生年月日は1990年5月12日で、今月の誕生日には大きなパーティーを計画しています。連絡は080-9876-5432にしてもらえれば嬉しいですし、私のメールアドレスはsato.hanako@example.comです。お時間があれば、ぜひお話ししましょう。,こんにちは、私の名前は<マスキング済の氏名>です。私は東京の渋谷区に住んでおり、<マスキング済の会社名>で働いています。私の所属する部署では、毎日新しいプロジェクトが立ち上がり、多くのチャレンジしています。私のオフィスは、<マスキング済の住所>にあり、週末には友人たちと一緒に渋谷のカフェでリフレッシュすることが好きです。また、私の生年月日は<マスキング済の生年月日>で、今月の誕生日には大きなパーティーを計画しています。連絡は<マスキング済の電話番号>にしてもらえれば嬉しいですし、私のメールアドレスは<マスキング済のemailアドレス>です。お時間があれば、ぜひお話ししましょう。,company_name,add_corp_after_english_company_name
こんにちは、私は株式会社Sony Corporationの佐藤花子と申します。最近、私たちの会社では新しいプロジェクトが始まり、エンジニアリングチームを募集しています。興味のある方はぜひご応募ください。私の連絡先は03-9876-5432、メールアドレスはhanako.sato@example.comです。なお、私の生年月日は1995年2月15日です。私の勤め先は東京都港区南青山4丁目1-2です。勤務地は、青山のオフィスで、都会的で便利なエリアです。また、私は趣味で写真撮影をしており、休日には風景を撮影するために旅行に出かけることも多いです。ぜひ、興味があればお話ししましょう。,こんにちは、私は<マスキング済の会社名>の<マスキング済の氏名>と申します。最近、私たちの会社では新しいプロジェクトが始まり、エンジニアリングチームを募集しています。興味のある方はぜひご応募ください。私の連絡先は<マスキング済の電話番号>、メールアドレスは<マスキング済のemailアドレス>です。なお、私の生年月日は<マスキング済の生年月日>です。私の勤め先は<マスキング済の住所>です。勤務地は、青山のオフィスで、都会的で便利なエリアです。また、私は趣味で写真撮影をしており、休日には風景を撮影するために旅行に出かけることも多いです。ぜひ、興味があればお話ししましょう。,company_name,add_corp_after_english_company_name
私は株式会社SONYの佐藤花子です。最近、地元の友人たちと集まる機会がありました。私たちは東京都渋谷区神南1丁目にあるおしゃれなカフェでランチを楽しみました。友人の一人は新しい職場での出来事を話してくれました。その友人は社員番号が00123の若手社員で、会社名は株式会社GOOGLEでした。私たちはその後、カフェから徒歩数分の田代公園を散歩しながら、さまざまな話題に花を咲かせました。私のメールアドレスはhanako_sato@example.comで、何かあれば気軽に連絡をくれるとうれしいです。また、私の電話番号は090-9876-5432です。そして、皆で集まる日を計画していたのですが、私の生年月日は1995年4月1日です。もし近くの郵便番号が必要であれば、150-0041だと言っておきます。今後も楽しい集まりが続くことを楽しみにしています。,私は<マスキング済の会社名>の<マスキング済の氏名>です。最近、地元の友人たちと集まる機会がありました。私たちは東京都渋谷区にあるおしゃれなカフェでランチを楽しみました。友人の一人は新しい職場での出来事を話してくれました。その友人は社員番号が<マスキング済の電話番号>の若手社員で、会社名は<マスキング済の会社名>でした。私たちはその後、カフェから徒歩数分の公園を散歩しながら、さまざまな話題に花を咲かせました。私のメールアドレスは<マスキング済のemailアドレス>で、何かあれば気軽に連絡をくれるとうれしいです。また、私の電話番号は<マスキング済の電話番号>です。そして、皆で集まる日を計画していたのですが、私の生年月日は<マスキング済の生年月日>です。もし近くの郵便番号が必要であれば、<マスキング済の郵便番号>だと言っておきます。今後も楽しい集まりが続くことを楽しみにしています。,company_name,add_corp_after_english_company_name
こんにちは、私の名前は佐藤花子です。私は東京にある株式会社Tech Innovatorsでプロジェクトマネージャーをしています。この会社では、最新技術を活用したプロジェクトを数多く手掛けています。私たちの主なクライアントには、国内外の大手企業が含まれており、そこでの経験を通じて業界のトレンドやニーズを常に把握しています。最近、私たちは新しいAI技術を導入するプロジェクトを進めており、その結果、クライアントから非常に良い反響をいただいています。私のメールアドレスはhanako.sato@example.comで、何かご意見や質問があればいつでもご連絡ください。連絡先電話番号は03-1234-5678です。また、私は1985年5月15日生まれで、毎年誕生日を祝っています。夏には家族で旅行に行くのが恒例となっており、最近は北海道へ行きました。北海道の美しい自然の中で、心が安らぐ時間を過ごすことができました。今年も良い年になることを祈っています。,こんにちは、私の名前は<マスキング済の氏名>です。私は<マスキング済の住所>にある<マスキング済の会社名>でプロジェクトマネージャーをしています。この会社では、最新技術を活用したプロジェクトを数多く手掛けています。私たちの主なクライアントには、国内外の大手企業が含まれており、そこでの経験を通じて業界のトレンドやニーズを常に把握しています。最近、私たちは新しいAI技術を導入するプロジェクトを進めており、その結果、クライアントから非常に良い反響をいただいています。私のメールアドレスは<マスキング済のemailアドレス>で、何かご意見や質問があればいつでもご連絡ください。連絡先電話番号は<マスキング済の電話番号>です。また、私は<マスキング済の生年月日>生まれで、毎年誕生日を祝っています。夏には家族で旅行に行くのが恒例となっており、最近は北海道へ行きました。北海道の美しい自然の中で、心が安らぐ時間を過ごすことができました。今年も良い年になることを祈っています。,company_name,add_corp_after_english_company_name
今年の春、私たちの会社、XYZ Corporationは新たなプロジェクトを開始しました。このプロジェクトには、私たちの優秀なチームのメンバーである佐藤花子が中心となって進めています。佐藤は大学で情報工学を専攻し、以前はABC株式会社で5年間働いていた経験があります。彼女の専門知識とリーダーシップは、私たちがこの挑戦的なプロジェクトを成功させるためには欠かせません。プロジェクトの内容は、クライアントである東京都渋谷区内の企業にとって、非常に重要なシステムの開発です。そのクライアントは、今後のビジネス展開を視野に入れたIT戦略を求めており、私たちはその期待に応えるべく日々努力しています。佐藤は、自身のメールアドレスであるsato@example.comを通じてクライアントとの連絡を密に取り合っており、プロジェクトの進行状況を報告するための会議を月に2回開催しています。また、プロジェクトチームのメンバーは、定期的に進捗状況を報告し合い、それぞれの役割を理解し、協力して作業を進めています。加えて、私たちのオフィスの電話番号は03-1234-5678で、何か緊急の要件があればいつでもご連絡いただけます。なお、佐藤は1990年1月1日生まれで、仕事以外にも趣味としてプログラミングを楽しんでいます。郵便番号は150-0002で、オフィスは東京都渋谷区神宮前にあります。これからもお客様にご満足いただけるサービスを提供できるよう、全力を尽くしていきたいと思います。,今年の春、私たちの会社、<マスキング済の会社名>は新たなプロジェクトを開始しました。このプロジェクトには、私たちの優秀なチームのメンバーである<マスキング済の氏名>が中心となって進めています。<マスキング済の氏名>は大学で情報工学を専攻し、以前は<マスキング済の会社名>で5年間働いていた経験があります。彼女の専門知識とリーダーシップは、私たちがこの挑戦的なプロジェクトを成功させるためには欠かせません。プロジェクトの内容は、クライアントである<マスキング済の住所>内の企業にとって、非常に重要なシステムの開発です。そのクライアントは、今後のビジネス展開を視野に入れたIT戦略を求めており、私たちはその期待に応えるべく日々努力しています。<マスキング済の氏名>は、自身のメールアドレスである<マスキング済のemailアドレス>を通じてクライアントとの連絡を密に取り合っており、プロジェクトの進行状況を報告するための会議を月に2回開催しています。また、プロジェクトチームのメンバーは、定期的に進捗状況を報告し合い、それぞれの役割を理解し、協力して作業を進めています。加えて、私たちのオフィスの電話番号は<マスキング済の電話番号>で、何か緊急の要件があればいつでもご連絡いただけます。なお、<マスキング済の氏名>は<マスキング済の生年月日>生まれで、仕事以外にも趣味としてプログラミングを楽しんでいます。郵便番号は<マスキング済の郵便番号>で、オフィスは<マスキング済の住所>にあります。これからもお客様にご満足いただけるサービスを提供できるよう、全力を尽くしていきたいと思います。,company_name,add_corp_after_english_company_name
