before_mask,after_mask,category,sub_category
こんにちは、私の名前は鈴木一郎です。私の仕事はソフトウェア開発で、現在はABC Technologies株式会社でシステムエンジニアとして働いています。会社のプロジェクトで忙しい日々を送っており、自宅は東京都新宿区西新宿5丁目にあります。もし何か質問があれば、電話番号は090-9876-5432までご連絡ください。また、メールアドレスはsuzuki.ichiro@example.comです。生年月日は1985年3月15日です。この業界での経験は10年ほどになりますが、常に新しい技術を学ぶことに情熱を持っています。最近は、クラウドコンピューティングやAIに関するプロジェクトにも携わっており、非常に楽しいです。私のチームはとても良い雰囲気で、互いに協力し合って成長しています。これからも、新しいチャレンジに取り組みながらスキルを磨いていきたいと思っています。,こんにちは、私の名前は<マスキング済の氏名>です。私の仕事はソフトウェア開発で、現在は<マスキング済の会社名>でシステムエンジニアとして働いています。会社のプロジェクトで忙しい日々を送っており、自宅は<マスキング済の住所>にあります。もし何か質問があれば、電話番号は<マスキング済の電話番号>までご連絡ください。また、メールアドレスは<マスキング済のemailアドレス>です。生年月日は<マスキング済の生年月日>です。この業界での経験は10年ほどになりますが、常に新しい技術を学ぶことに情熱を持っています。最近は、クラウドコンピューティングやAIに関するプロジェクトにも携わっており、非常に楽しいです。私のチームはとても良い雰囲気で、互いに協力し合って成長しています。これからも、新しいチャレンジに取り組みながらスキルを磨いていきたいと思っています。,company_name,add_corp_after_english_company_name
こんにちは、株式会社Global Tech Solutionsの鈴木花子です。最近、私たちのサービスについて非常に良いフィードバックをいただいており、これを機にさらなる改善を進めたいと考えています。私たちのオフィスは東京都渋谷区道玄坂2丁目15-1にあり、ぜひお越しいただければと思います。何かご意見やご質問等がありましたら、気軽にご連絡ください。私のメールアドレスは hanako.suzuki@globaltech.com で、電話番号は03-1234-5678です。また、私の生年月日は1990年5月20日ですので、もし何かお祝いなどありましたらご連絡ください。私たちの目指しているのは、より多くの顧客のニーズに応えることですので、皆様のご意見が非常に大切です。ぜひいろいろなご意見をお寄せいただけると嬉しいです。ご協力のほど、よろしくお願い申し上げます。,こんにちは、<マスキング済の会社名>の<マスキング済の氏名>です。最近、私たちのサービスについて非常に良いフィードバックをいただいており、これを機にさらなる改善を進めたいと考えています。私たちのオフィスは<マスキング済の住所>にあり、ぜひお越しいただければと思います。何かご意見やご質問等がありましたら、気軽にご連絡ください。私のメールアドレスは <マスキング済のemailアドレス> で、電話番号は<マスキング済の電話番号>です。また、私の生年月日は<マスキング済の生年月日>ですので、もし何かお祝いなどありましたらご連絡ください。私たちの目指しているのは、より多くの顧客のニーズに応えることですので、皆様のご意見が非常に大切です。ぜひいろいろなご意見をお寄せいただけると嬉しいです。ご協力のほど、よろしくお願い申し上げます。,company_name,add_corp_after_english_company_name
私は株式会社Sony Corporationで長年働いている鈴木花子です。この会社での経験を通じてたくさんのことを学んできました。日々の業務に追われる中、同僚たちと協力しながらプロジェクトを進めています。私たちのチームは製品開発を担当しており、様々な新技術を取り入れながら、世の中に新しい価値を提供することを目指しています。私の担当は主にソフトウェア開発ですが、ハードウェアに関する知識も持っています。私の生年月日は1987年5月12日で、出身は東京都豊島区です。会社の本社は品川区にありますが、私は普段渋谷区のオフィスで働いています。ここ数年、テレワークが普及してきた影響で、在宅勤務の日も多くなりましたが、家では仕事の合間に趣味の映画鑑賞を楽しんでいます。また、プライベートでは友人と毎月集まって、食事を共にすることが楽しみになっています。先月も、友達と一緒に「ごちそうさま」っていうレストランでディナーをしました。私のメールアドレスはhana.Suzuki@example.comで、何かご質問があればお気軽に連絡してください。電話番号は03-9876-5432ですので、こちらでもお知らせがいただければと思います。これからも、Sonyの一員として、多くの人に喜んでもらえる製品を開発し続けたいと思っています。,私は<マスキング済の会社名>で長年働いている<マスキング済の氏名>です。この会社での経験を通じてたくさんのことを学んできました。日々の業務に追われる中、同僚たちと協力しながらプロジェクトを進めています。私たちのチームは製品開発を担当しており、様々な新技術を取り入れながら、世の中に新しい価値を提供することを目指しています。私の担当は主にソフトウェア開発ですが、ハードウェアに関する知識も持っています。私の生年月日は<マスキング済の生年月日>で、出身は<マスキング済の住所>です。会社の本社は<マスキング済の住所>にありますが、私は普段<マスキング済の住所>で働いています。ここ数年、テレワークが普及してきた影響で、在宅勤務の日も多くなりましたが、家では仕事の合間に趣味の映画鑑賞を楽しんでいます。また、プライベートでは友人と毎月集まって、食事を共にすることが楽しみになっています。先月も、友達と一緒にレストランでディナーをしました。私のメールアドレスは<マスキング済のemailアドレス>で、何かご質問があればお気軽に連絡してください。電話番号は<マスキング済の電話番号>ですので、こちらでもお知らせがいただければと思います。これからも、<マスキング済の会社名>の一員として、多くの人に喜んでもらえる製品を開発し続けたいと思っています。,company_name,add_corp_after_english_company_name
先日、私の勤めている会社、Tech Innovations Inc.の年次総会が開催されました。参加者は多く、私の同僚である鈴木花子さんも来ていました。鈴木さんは最近、子供が生まれたばかりで、嬉しそうに赤ちゃんの写真を見せてくれました。また、会議の冒頭では、社長のジョン・スミスが今年の業績について詳しく説明し、次年度の目標についても話をしていました。私たちも各部署の役割について意見を交わし、非常に有意義な時間を過ごしました。会議後には、地元のレストラン、銀座ダイニングで懇親会が催され、社員同士の親睦を深める良い機会となりました。懇親会では、私が担当しているプロジェクトについて話をしたり、他の部署の方々と交流したりしました。ちなみに、私の住所は東京都港区南青山5-4-20で、連絡先は03-1234-5678、メールアドレスはtanaka@example.comです。こうした活動を通じて、会社全体の連携が深まることを願っています。,先日、私の勤めている会社、<マスキング済の会社名>の年次総会が開催されました。参加者は多く、私の同僚である<マスキング済の氏名>さんも来ていました。<マスキング済の氏名>さんは最近、子供が生まれたばかりで、嬉しそうに赤ちゃんの写真を見せてくれました。また、会議の冒頭では、社長の<マスキング済の氏名>が今年の業績について詳しく説明し、次年度の目標についても話をしていました。私たちも各部署の役割について意見を交わし、非常に有意義な時間を過ごしました。会議後には、地元のレストラン、<マスキング済の住所>で懇親会が催され、社員同士の親睦を深める良い機会となりました。懇親会では、私が担当しているプロジェクトについて話をしたり、他の部署の方々と交流したりしました。ちなみに、私の住所は<マスキング済の住所>で、連絡先は<マスキング済の電話番号>、メールアドレスは<マスキング済のemailアドレス>です。こうした活動を通じて、会社全体の連携が深まることを願っています。,company_name,add_corp_after_english_company_name
私の名前は佐藤健で、株式会社Tech Innovationsに勤めています。最近、私たちの会社では新しいプロジェクトを開始しました。それは、最新のAI技術を使ったアプリケーションの開発です。このアプリケーションは、特に教育分野での利用を見込んでいます。私のチームはその開発に全力を尽くしており、毎日新しいアイデアを出し合っています。私の連絡先は、電話番号が090-9876-5432で、メールアドレスはsato@example.comです。プロジェクトの進捗に関心がある方は、ぜひご連絡ください。私のオフィスは東京都渋谷区桜丘町にあります。また、私の生年月日は1985年5月15日です。ふと思い出しましたが、私の大学時代の友人もTech Innovationsに勤めていて、彼の名前は高橋雄一です。彼は現在、プロダクトマネージャーをしています。私たちのオフィスは近くにあり、よくランチを一緒に食べることがあります。最新技術の話題で盛り上がり、将来のビジョンを語り合う時間がとても楽しみです。私たちは、業界をリードする製品を市場に送り出すために、一丸となって取り組んでいます。,私の名前は<マスキング済の氏名>で、<マスキング済の会社名>に勤めています。最近、私たちの会社では新しいプロジェクトを開始しました。それは、最新のAI技術を使ったアプリケーションの開発です。このアプリケーションは、特に教育分野での利用を見込んでいます。私のチームはその開発に全力を尽くしており、毎日新しいアイデアを出し合っています。私の連絡先は、電話番号が<マスキング済の電話番号>で、メールアドレスは<マスキング済のemailアドレス>です。プロジェクトの進捗に関心がある方は、ぜひご連絡ください。私のオフィスは<マスキング済の住所>にあります。また、私の生年月日は<マスキング済の生年月日>です。ふと思い出しましたが、私の大学時代の友人も<マスキング済の会社名>に勤めていて、彼の名前は<マスキング済の氏名>です。彼は現在、プロダクトマネージャーをしています。私たちのオフィスは近くにあり、よくランチを一緒に食べることがあります。最新技術の話題で盛り上がり、将来のビジョンを語り合う時間がとても楽しみです。私たちは、業界をリードする製品を市場に送り出すために、一丸となって取り組んでいます。,company_name,add_corp_after_english_company_name
今日は、私たちの会社であるGlobal Tech Solutions株式会社の新しいプロジェクトについてお知らせします。本プロジェクトでは、最新の技術を活用して、より効率的なビジネスモデルを構築することを目指しています。プロジェクトに関わるメンバーは、株式会社島田産業の佐藤花子さんを含む数名が予定されています。彼女は、チームリーダーとしてプロジェクトの進行を管理する予定です。プロジェクトの具体的な開始日は2023年10月15日となっており、東京都新宿区のオフィスでキックオフミーティングを行う予定です。もし何かご質問やご意見があれば、私の携帯番号080-9876-5432、またはメールアドレスmy_email_address@example.comまでご連絡ください。プロジェクトが成功するよう、皆様のご協力をお願い申し上げます。,今日は、私たちの会社である<マスキング済の会社名>の新しいプロジェクトについてお知らせします。本プロジェクトでは、最新の技術を活用して、より効率的なビジネスモデルを構築することを目指しています。プロジェクトに関わるメンバーは、<マスキング済の会社名>の<マスキング済の氏名>を含む数名が予定されています。彼女は、チームリーダーとしてプロジェクトの進行を管理する予定です。プロジェクトの具体的な開始日は<マスキング済の生年月日>となっており、<マスキング済の住所>でキックオフミーティングを行う予定です。もし何かご質問やご意見があれば、私の携帯番号<マスキング済の電話番号>、またはメールアドレス<マスキング済のemailアドレス>までご連絡ください。プロジェクトが成功するよう、皆様のご協力をお願い申し上げます。,company_name,add_corp_after_english_company_name
こんにちは、私の名前は佐藤健一で、現在、株式会社Tech Innovatorsでマーケティングを担当しています。会社の所在地は東京都中央区日本橋3丁目1-1で、郵便番号は103-0027です。当社は最新のテクノロジーを活用して、顧客のニーズに応えるための革新的なソリューションを提供しています。私たちのチームは、常に新しいアイデアを追求しており、毎年多数のプロジェクトを展開しています。今年も新商品の発表を控えており、関係者にはご案内をお送りする予定です。もし何かご質問があれば、電話でのご連絡が便利ですので、ぜひこちらの番号にご連絡ください：03-1234-5678。私のメールアドレスはsato.kenichi@example.comです。私たちの製品やサービスについてもっと知りたい方は、ぜひ公式ウェブサイトも訪れてください。最近では、オンラインセミナーも開催するようになり、今後の予定についてもお知らせをしていくつもりです。ぜひ参加していただければと思います。これからも引き続きお客様に満足いただけるよう努めて参りますので、よろしくお願い申し上げます。,こんにちは、私の名前は<マスキング済の氏名>で、現在、<マスキング済の会社名>でマーケティングを担当しています。会社の所在地は<マスキング済の住所>で、郵便番号は<マスキング済の郵便番号>です。当社は最新のテクノロジーを活用して、顧客のニーズに応えるための革新的なソリューションを提供しています。私たちのチームは、常に新しいアイデアを追求しており、毎年多数のプロジェクトを展開しています。今年も新商品の発表を控えており、関係者にはご案内をお送りする予定です。もし何かご質問があれば、電話でのご連絡が便利ですので、ぜひこちらの番号にご連絡ください：<マスキング済の電話番号>。私のメールアドレスは<マスキング済のemailアドレス>です。私たちの製品やサービスについてもっと知りたい方は、ぜひ公式ウェブサイトも訪れてください。最近では、オンラインセミナーも開催するようになり、今後の予定についてもお知らせをしていくつもりです。ぜひ参加していただければと思います。これからも引き続きお客様に満足いただけるよう努めて参りますので、よろしくお願い申し上げます。,company_name,add_corp_after_english_company_name
こんにちは、私は株式会社Global Techの佐藤健一と申します。先日、私たちの会社で新しいプロジェクトが始まり、その一環としてイベントを開催することになりました。イベントは東京都新宿区西新宿のビル内で行われ、日時は2023年11月15日の午後2時から4時までとなっています。参加希望の方は、私のメールアドレス、sato.kenichi@example.comまでご連絡いただければと思います。また、何かご不明な点があれば、080-9876-5432までお電話いただければ嬉しいです。私たちはこのイベントで多くの方々と交流できることを楽しみにしています。さらに、イベント参加者には、私たちのサービスに関する詳細な資料や特別なオファーをお渡しする予定です。皆さんが楽しめるような内容を準備しているので、ご期待ください！最後に、私の生年月日は1985年3月12日で、住まいは神奈川県横浜市中区元町の地域です。多くの方々の参加を心よりお待ちしております。,こんにちは、私は<マスキング済の会社名>の<マスキング済の氏名>と申します。先日、私たちの会社で新しいプロジェクトが始まり、その一環としてイベントを開催することになりました。イベントは<マスキング済の住所>のビル内で行われ、日時は<マスキング済の生年月日>の午後2時から4時までとなっています。参加希望の方は、私のメールアドレス、<マスキング済のemailアドレス>までご連絡いただければと思います。また、何かご不明な点があれば、<マスキング済の電話番号>までお電話いただければ嬉しいです。私たちはこのイベントで多くの方々と交流できることを楽しみにしています。さらに、イベント参加者には、私たちのサービスに関する詳細な資料や特別なオファーをお渡しする予定です。皆さんが楽しめるような内容を準備しているので、ご期待ください！最後に、私の生年月日は<マスキング済の生年月日>で、住まいは<マスキング済の住所>の地域です。多くの方々の参加を心よりお待ちしております。,company_name,add_corp_after_english_company_name
こんにちは、私は株式会社ABCの鈴木花子と申します。私たちの会社は、テクノロジーとデザインの融合を目指しており、全国各地のお客様に高品質なサービスを提供しています。私たちのオフィスは東京都渋谷区桜丘町に所在し、アクセスも非常に便利です。この業界での経験は10年以上あり、特にウェブデザインやシステム開発において多くの実績があります。プロジェクトの進行中には、社内のチームとともに緊密に連携し、お客様の要望を最大限に反映させる努力をしています。また、私の生まれた日は1985年5月10日で、趣味は旅行や読書です。もし協力していただけることがあれば、電話番号080-9876-5432もしくはメールアドレスsuzuki@example.comにご連絡ください。私たちのプロジェクトを通じて、あなたと一緒に素晴らしいものを作り上げていけることを楽しみにしています。,こんにちは、私は<マスキング済の会社名>の<マスキング済の氏名>と申します。私たちの会社は、テクノロジーとデザインの融合を目指しており、全国各地のお客様に高品質なサービスを提供しています。私たちのオフィスは<マスキング済の住所>に所在し、アクセスも非常に便利です。この業界での経験は10年以上あり、特にウェブデザインやシステム開発において多くの実績があります。プロジェクトの進行中には、社内のチームとともに緊密に連携し、お客様の要望を最大限に反映させる努力をしています。また、私の生まれた日は<マスキング済の生年月日>で、趣味は旅行や読書です。もし協力していただけることがあれば、電話番号<マスキング済の電話番号>もしくはメールアドレス<マスキング済のemailアドレス>にご連絡ください。私たちのプロジェクトを通じて、あなたと一緒に素晴らしいものを作り上げていけることを楽しみにしています。,company_name,add_corp_after_english_company_name
こんにちは、私はABC株式会社の佐藤花子です。普段はマーケティング部で働いていて、主にSNSの運営を担当しています。最近では、新製品のPRを行っており、その一環でイベントを企画しています。イベント招待のためには、ぜひともお時間をいただきたいと思っています。 日時は11月15日（土）で、場所は東京都渋谷区の会議室です。もし参加していただける場合は、こちらにご連絡ください。私の電話番号は03-9876-5432、メールアドレスはhanako_sato@example.comです。また、私の誕生日は1985年5月20日で、幼少期からこの業界に興味がありました。大学では経営学を学び、今につながるキャリアを歩んでいます。お忙しい中恐縮ですが、ぜひ参加をご検討ください。,こんにちは、私は<マスキング済の会社名>の<マスキング済の氏名>です。普段はマーケティング部で働いていて、主にSNSの運営を担当しています。最近では、新製品のPRを行っており、その一環でイベントを企画しています。イベント招待のためには、ぜひともお時間をいただきたいと思っています。 日時は11月15日（土）で、場所は<マスキング済の住所>の会議室です。もし参加していただける場合は、こちらにご連絡ください。私の電話番号は<マスキング済の電話番号>、メールアドレスは<マスキング済のemailアドレス>です。また、私の誕生日は<マスキング済の生年月日>で、幼少期からこの業界に興味がありました。大学では経営学を学び、今につながるキャリアを歩んでいます。お忙しい中恐縮ですが、ぜひ参加をご検討ください。,company_name,add_corp_after_english_company_name
