before_mask,after_mask,category,sub_category
私は、株式会社Global Tech Solutionsの佐藤花子と申します。私たちの会社では、最先端のテクノロジーを用いたソリューションを提供し、多くのクライアントに支持されています。最近、東京目黒区のオフィスで開催されたセミナーに参加しました。このイベントではさまざまな業界からの専門家が集まり、情報交換を行いました。セミナーの後には、名刺交換も行い、ビジネスの連携を深める良い機会となりました。もし何か質問やご要望がありましたら、私のメールアドレスまでご連絡ください：sato_hanako@example.com。また、私の電話番号は03-1234-5678です。なお、私の生年月日は1990年5月10日です。これからも新しいプロジェクトが続く予定なので、成功に向けてチーム一丸となって頑張ります。,私は、<マスキング済の会社名>の<マスキング済の氏名>と申します。私たちの会社では、最先端のテクノロジーを用いたソリューションを提供し、多くのクライアントに支持されています。最近、<マスキング済の住所>のオフィスで開催されたセミナーに参加しました。このイベントではさまざまな業界からの専門家が集まり、情報交換を行いました。セミナーの後には、名刺交換も行い、ビジネスの連携を深める良い機会となりました。もし何か質問やご要望がありましたら、私のメールアドレスまでご連絡ください：<マスキング済のemailアドレス>。また、私の電話番号は<マスキング済の電話番号>です。なお、私の生年月日は<マスキング済の生年月日>です。これからも新しいプロジェクトが続く予定なので、成功に向けてチーム一丸となって頑張ります。,company_name,add_corp_after_english_company_name
こんにちは。私は東京に住んでいる佐藤花子と申します。最近、株式会社Global Techに転職しました。現在、システムエンジニアとして働いており、日々新しい技術を学ぶことに励んでいます。私の仕事に関しては、特にデータベース管理やクラウドサービスに興味があります。また、仕事の後にはスポーツジムにも通っています。私の趣味はランニングと読書で、週末には友人と一緒にランニングクラブに参加しています。私の電話番号は03-1234-5678で、もし何かあればお気軽にご連絡ください。メールはhanako.sato@example.comです。私の生年月日は1985年5月15日ですが、年齢はあまり気にしていません。住所は東京都新宿区西新宿5丁目1-1です。今後ともよろしくお願い致します。,こんにちは。私は<マスキング済の住所>に住んでいる<マスキング済の氏名>と申します。最近、<マスキング済の会社名>に転職しました。現在、システムエンジニアとして働いており、日々新しい技術を学ぶことに励んでいます。私の仕事に関しては、特にデータベース管理やクラウドサービスに興味があります。また、仕事の後にはスポーツジムにも通っています。私の趣味はランニングと読書で、週末には友人と一緒にランニングクラブに参加しています。私の電話番号は<マスキング済の電話番号>で、もし何かあればお気軽にご連絡ください。メールは<マスキング済のemailアドレス>です。私の生年月日は<マスキング済の生年月日>ですが、年齢はあまり気にしていません。住所は<マスキング済の住所>です。今後ともよろしくお願い致します。,company_name,add_corp_after_english_company_name
"先日、私たちの会社であるGlobal Tech Solutions株式会社の社員旅行が行われました。旅行の日程は2023年の9月15日から9月17日で、参加者は総勢30名でした。旅行のプランは、早朝に東京都を出発し、長野県の温泉宿へ向かいました。参加者の中には、佐藤一郎や鈴木花子など、普段はなかなか会わない部署のメンバーもいたため、交流を深める良い機会となりました。

宿に到着すると、まず地元の美味しい料理を楽しみました。特に、長野の名産である信州そばはみんなに大好評でした。その後、川辺でバーベキューをしながら、仲間たちと楽しい時間を過ごしました。夕方には、温泉に浸かり、心身ともにリフレッシュしました。

翌日は、観光地を訪れる予定だったため、早起きして軽めの朝食をとり、八ヶ岳の登山に挑戦しました。自然の中でのハイキングはとても気持ちが良く、頂上からの眺めは感動的でした。この時の様子を撮影した写真を、私は自分のメールアドレスであるsato_ichiro@example.comに送信しました。

最後の夜には、全員集まっての打ち上げが行われ、旅行の思い出を語り合いました。連絡先として、私の電話番号は090-9876-5432です。旅行後の懐かしい気持ちを忘れないために、このような経験は今後も続けていきたいです。また、公式な報告として、旅行に参加した社員の名前や生年月日（1978年5月10日など）をまとめた資料を会社に提出することになっています。参加者の中には、福岡県から来た平方春子や、北海道在住の高橋健二もいましたが、彼らとの交流もとても楽しかったです。","先日、私たちの会社である<マスキング済の会社名>の社員旅行が行われました。旅行の日程は<マスキング済の生年月日>の9月15日から9月17日で、参加者は総勢30名でした。旅行のプランは、早朝に東京都を出発し、長野県の温泉宿へ向かいました。参加者の中には、<マスキング済の氏名>や<マスキング済の氏名>など、普段はなかなか会わない部署のメンバーもいたため、交流を深める良い機会となりました。

宿に到着すると、まず地元の美味しい料理を楽しみました。特に、長野の名産である信州そばはみんなに大好評でした。その後、川辺でバーベキューをしながら、仲間たちと楽しい時間を過ごしました。夕方には、温泉に浸かり、心身ともにリフレッシュしました。

翌日は、観光地を訪れる予定だったため、早起きして軽めの朝食をとり、八ヶ岳の登山に挑戦しました。自然の中でのハイキングはとても気持ちが良く、頂上からの眺めは感動的でした。この時の様子を撮影した写真を、私は自分のメールアドレスである<マスキング済のemailアドレス>に送信しました。

最後の夜には、全員集まっての打ち上げが行われ、旅行の思い出を語り合いました。連絡先として、私の電話番号は<マスキング済の電話番号>です。旅行後の懐かしい気持ちを忘れないために、このような経験は今後も続けていきたいです。また、公式な報告として、旅行に参加した社員の名前や生年月日（<マスキング済の生年月日>など）をまとめた資料を会社に提出することになっています。参加者の中には、<マスキング済の住所>や、北海道在住の<マスキング済の氏名>もいましたが、彼らとの交流もとても楽しかったです。",company_name,add_corp_after_english_company_name
私の名前は田中花子です。実は、最近私が勤めている会社、Tech Innovations株式会社が新しいプロジェクトを発表しました。それに関する情報をお伝えしたいと思います。このプロジェクトは、日本国内の小さな企業をサポートするためのものです。私たちのオフィスは東京都新宿区の4丁目5番地にあります。また、このプロジェクトに関連する詳細な情報を知りたい方は、メールを送っていただければと思います。私のアドレスはhanako.tanaka@example.comです。さらに、私の電話番号は03-1234-5678ですので、お気軽にご連絡下さい。プロジェクトの開始日予定は2023年11月1日で、参加企業の募集を開始しています。私たちは、さまざまな専門分野の企業と協力して、日本のビジネスをより成長させるためのサポートを行うつもりです。また、私の誕生日は1990年5月15日ですので、同じ日が近づくと毎年特別な気持ちになります。この新プロジェクトについてさらに詳しく知りたい方々は、ぜひお問い合わせをお待ちしております。,私の名前は<マスキング済の氏名>です。実は、最近私が勤めている会社、<マスキング済の会社名>が新しいプロジェクトを発表しました。それに関する情報をお伝えしたいと思います。このプロジェクトは、日本国内の小さな企業をサポートするためのものです。私たちのオフィスは<マスキング済の住所>にあります。また、このプロジェクトに関連する詳細な情報を知りたい方は、メールを送っていただければと思います。私のアドレスは<マスキング済のemailアドレス>です。さらに、私の電話番号は<マスキング済の電話番号>ですので、お気軽にご連絡下さい。プロジェクトの開始日予定は<マスキング済の生年月日>で、参加企業の募集を開始しています。私たちは、さまざまな専門分野の企業と協力して、日本のビジネスをより成長させるためのサポートを行うつもりです。また、私の誕生日は<マスキング済の生年月日>ですので、同じ日が近づくと毎年特別な気持ちになります。この新プロジェクトについてさらに詳しく知りたい方々は、ぜひお問い合わせをお待ちしております。,company_name,add_corp_after_english_company_name
こんにちは、私は「Global Tech Innovations Inc.」の営業部門で働いている佐藤智子です。最近、社内プロジェクトでリーダーを任されており、日々充実した業務を過ごしています。私の連絡先は080-9876-5432で、メールはsato.tomoko@example.comです。実は、プロジェクトの進行にあたり、チームメンバーとの連携が重要で、特に今月の会議で発表する内容が大きな影響を与えると考えています。会議には東京都中央区銀座3丁目2-1にある本社で行われる予定です。また、私の生年月日は1985年5月15日で、若い頃からテクノロジーの世界に興味を持っていました。趣味はプログラミングで、休日には新しい言語を学ぶことが多いです。このプロジェクトが成功すれば、今後のキャリアにおいても大きなステップになると思っています。このように、日々の業務を通じて成長し続けられる環境に感謝しています。,こんにちは、私は<マスキング済の会社名>の営業部門で働いている<マスキング済の氏名>です。最近、社内プロジェクトでリーダーを任されており、日々充実した業務を過ごしています。私の連絡先は<マスキング済の電話番号>で、メールは<マスキング済のemailアドレス>です。実は、プロジェクトの進行にあたり、チームメンバーとの連携が重要で、特に今月の会議で発表する内容が大きな影響を与えると考えています。会議には<マスキング済の住所>にある本社で行われる予定です。また、私の生年月日は<マスキング済の生年月日>で、若い頃からテクノロジーの世界に興味を持っていました。趣味はプログラミングで、休日には新しい言語を学ぶことが多いです。このプロジェクトが成功すれば、今後のキャリアにおいても大きなステップになると思っています。このように、日々の業務を通じて成長し続けられる環境に感謝しています。,company_name,add_corp_after_english_company_name
こんにちは、株式会社Sonyの佐藤花子と申します。私は東京の渋谷区に住んでおり、最近は新しいプロジェクトに力を入れています。もし何かお手伝いできることがあれば、ぜひお知らせください。私の連絡先は090-9876-5432、そしてメールはhanako_sato@gmail.comです。私の生年月日は1990年5月15日です。東京で行われるイベントに参加する予定なので、興味があればぜひお越しください。また、地元のカフェやレストランのことについてもお話しできればと思っています。最近訪れたカフェでは、特にコーヒーが美味しく、居心地の良い空間がありました。お勧めできるスポットです。何か気になることがあれば、いつでも連絡してください。お待ちしています。,こんにちは、<マスキング済の会社名>の<マスキング済の氏名>と申します。私は<マスキング済の住所>に住んでおり、最近は新しいプロジェクトに力を入れています。もし何かお手伝いできることがあれば、ぜひお知らせください。私の連絡先は<マスキング済の電話番号>、そしてメールは<マスキング済のemailアドレス>です。私の生年月日は<マスキング済の生年月日>です。<都道府県>で行われるイベントに参加する予定なので、興味があればぜひお越しください。また、地元のカフェやレストランのことについてもお話しできればと思っています。最近訪れたカフェでは、特にコーヒーが美味しく、居心地の良い空間がありました。お勧めできるスポットです。何か気になることがあれば、いつでも連絡してください。お待ちしています。,company_name,add_corp_after_english_company_name
こんにちは、私は株式会社NECソリューションイノベータの佐藤花子と申します。私たちの会社は新しい技術を通じて、クライアントに最適な情報ソリューションを提供することに力を入れています。私たちのオフィスは東京都港区に位置していて、交通も便が良いです。もしご興味がある際には、ぜひこちらの番号080-9876-5432または、私のメールアドレスsato_hanako@example.comにご連絡ください。もちろん、私たちのサービスについての詳細も記載された資料をお送りすることができますので、お知らせいただければ郵送いたします。私の生年月日は1985年5月21日で、その影響か責任感を持って仕事に取り組むことができると自負しています。また、私の趣味は旅行や料理で、新しいレシピを試すことに楽しみを見出しています。今後とも、何かご質問があればいつでもお知らせください。,こんにちは、私は<マスキング済の会社名>の<マスキング済の氏名>と申します。私たちの会社は新しい技術を通じて、クライアントに最適な情報ソリューションを提供することに力を入れています。私たちのオフィスは<マスキング済の住所>に位置していて、交通も便が良いです。もしご興味がある際には、ぜひこちらの番号<マスキング済の電話番号>または、私のメールアドレス<マスキング済のemailアドレス>にご連絡ください。もちろん、私たちのサービスについての詳細も記載された資料をお送りすることができますので、お知らせいただければ郵送いたします。私の生年月日は<マスキング済の生年月日>で、その影響か責任感を持って仕事に取り組むことができると自負しています。また、私の趣味は旅行や料理で、新しいレシピを試すことに楽しみを見出しています。今後とも、何かご質問があればいつでもお知らせください。,company_name,add_corp_after_english_company_name
こんにちは、私は株式会社CyberAgentで働いている佐藤花子です。実は、私たちの会社では新しいプロジェクトを開始するにあたり、チームメンバーを募集しています。このプロジェクトは特にデジタルマーケティングに重点を置いており、私たちのクライアントのために最も効果的な広告戦略を立てていく予定です。もし興味がある方がいれば、ぜひご連絡ください。また、私の連絡先は050-9876-5432で、メールアドレスは satoh@example.com です。私は東京都新宿区4丁目に住んでおり、これまでの経験を活かせる場を得られることを楽しみにしています。生年月日は1988年4月12日で、同じような志を持った方々と語り合えたら嬉しいです。ご多忙にもかかわらず、こちらをお読みいただき、本当にありがとうございます。これからの楽しいやり取りを待っています。,こんにちは、私は<マスキング済の会社名>で働いている<マスキング済の氏名>です。実は、私たちの会社では新しいプロジェクトを開始するにあたり、チームメンバーを募集しています。このプロジェクトは特にデジタルマーケティングに重点を置いており、私たちのクライアントのために最も効果的な広告戦略を立てていく予定です。もし興味がある方がいれば、ぜひご連絡ください。また、私の連絡先は<マスキング済の電話番号>で、メールアドレスは<マスキング済のemailアドレス>です。私は<マスキング済の住所>に住んでおり、これまでの経験を活かせる場を得られることを楽しみにしています。生年月日は<マスキング済の生年月日>で、同じような志を持った方々と語り合えたら嬉しいです。ご多忙にもかかわらず、こちらをお読みいただき、本当にありがとうございます。これからの楽しいやり取りを待っています。,company_name,add_corp_after_english_company_name
先日、友人と一緒にランチに行くことにしました。行き先は株式会社テクノロジーで、私たちがいつも利用するカフェです。友人の名前は佐藤花子で、彼女は私と同じ大学を卒業しました。その日のランチはとても美味しく、特にサラダが新鮮で絶品でした。食事をしながら、色々な話をしました。最近の仕事の話やプライベートの話まで幅広く話題が広がり、時間が経つのを忘れてしまうほどでした。田舎に住んでいる私の両親の近況についても話し、彼女が以前訪れた際の楽しかった思い出も共有しました。ランチの後、私たちはカフェの近くにある公園で散歩をしました。公園の風景はとても綺麗で、青空の下で気持ちよく過ごせました。帰り際、彼女が一緒に写真を撮ろうと言いだし、携帯電話で記念撮影をしました。その日は私にとって楽しい思い出として心に残りました。家に帰った後、彼女に送ったメールアドレスが my_email_adress@example.com だと気づき、思わず笑ってしまいました。そんな小さなことでも、彼女との交流を楽しませてくれますよね。それから数日後、彼女から「今度はみんなでバーベキューしない？」というメールがありました。私たちの友人の一人である鈴木健一、彼は製造業で働いていて、いつも明るくて楽しい人です。彼が言うには、日曜日にバーベキューをするために、私たちの住んでいる地域のキャンプ場を予約したとのこと。楽しみです。,先日、友人と一緒にランチに行くことにしました。行き先は<マスキング済の会社名>で、私たちがいつも利用するカフェです。友人の名前は<マスキング済の氏名>で、彼女は私と同じ大学を卒業しました。その日のランチはとても美味しく、特にサラダが新鮮で絶品でした。食事をしながら、色々な話をしました。最近の仕事の話やプライベートの話まで幅広く話題が広がり、時間が経つのを忘れてしまうほどでした。田舎に住んでいる私の両親の近況についても話し、彼女が以前訪れた際の楽しかった思い出も共有しました。ランチの後、私たちはカフェの近くにある公園で散歩をしました。公園の風景はとても綺麗で、青空の下で気持ちよく過ごせました。帰り際、彼女が一緒に写真を撮ろうと言いだし、携帯電話で記念撮影をしました。その日は私にとって楽しい思い出として心に残りました。家に帰った後、彼女に送ったメールアドレスが<マスキング済のemailアドレス>だと気づき、思わず笑ってしまいました。そんな小さなことでも、彼女との交流を楽しませてくれますよね。それから数日後、彼女から「今度はみんなでバーベキューしない？」というメールがありました。私たちの友人の一人である<マスキング済の氏名>、彼は製造業で働いていて、いつも明るくて楽しい人です。彼が言うには、日曜日にバーベキューをするために、私たちの住んでいる地域のキャンプ場を予約したとのこと。楽しみです。,company_name,add_corp_after_english_company_name
