before_mask,after_mask,category,sub_category
私の名前は鈴木一郎で、東京にあるABC Corporationでマーケティングの担当をしています。私の誕生日は1985年4月12日で、現在は34歳です。ABC Corporationは特にデジタルマーケティングで有名な会社で、グローバルにも展開しています。最近は深刻な市場競争に直面していますが、新しいキャンペーンを立ち上げることで競争力を高める努力をしています。私の趣味は旅行や映画を見ることで、仕事の合間にリラックスするために休日にはよく出かけます。今年の夏には、友人と一緒に沖縄に旅行を計画しています。滞在先のホテルはまだ決めていないので、色々な候補を検討中です。連絡が必要な場合は、次の電話番号にご連絡ください。090-2345-6789。また、過去のプロジェクトに関する情報は私のメールアドレス、suzuki.ichiro@example.comで受け付けていますので、気軽にご連絡ください。私が住んでいる住所は東京都中央区銀座4丁目5番10号です。このあたりは買い物にも便利な場所ですし、オフィスへのアクセスも良好です。今後ともどうぞよろしくお願いいたします。,私の名前は<マスキング済の氏名>で、東京にある<マスキング済の会社名>でマーケティングの担当をしています。私の誕生日は<マスキング済の生年月日>で、現在は34歳です。<マスキング済の会社名>は特にデジタルマーケティングで有名な会社で、グローバルにも展開しています。最近は深刻な市場競争に直面していますが、新しいキャンペーンを立ち上げることで競争力を高める努力をしています。私の趣味は旅行や映画を見ることで、仕事の合間にリラックスするために休日にはよく出かけます。今年の夏には、友人と一緒に沖縄に旅行を計画しています。滞在先のホテルはまだ決めていないので、色々な候補を検討中です。連絡が必要な場合は、次の電話番号にご連絡ください。<マスキング済の電話番号>。また、過去のプロジェクトに関する情報は私のメールアドレス、<マスキング済のemailアドレス>で受け付けていますので、気軽にご連絡ください。私が住んでいる住所は<マスキング済の住所>です。このあたりは買い物にも便利な場所ですし、オフィスへのアクセスも良好です。今後ともどうぞよろしくお願いいたします。,company_name,add_corp_after_english_company_name
私の友人、鈴木一郎は株式会社Google Japanに勤めています。昨年の誕生日には、都内のレストランで素晴らしいディナーを楽しみました。彼の誕生日は1985年5月3日で、ますます大人になっていく彼を見ていると感慨深いものがあります。ディナーを終えた後、彼の家に帰る途中で、080-9876-5432の電話番号で家族に連絡を取りました。彼は、彼の住んでいる住所が新宿区西新宿2丁目3-4であることをいつも自慢していました。そんな彼と過ごした特別な時間は今でも心に残っています。私たちは、友達の関係を超え、長い付き合いを続けていくことでしょう。この間、彼から学んだことはたくさんあります。特に、ビジネスシーンでも役立つ彼の豊富な経験から、多くのことを吸収しました。彼のアドバイスは、私のキャリアにも良い影響を与えています。お気に入りのカフェで仕事の合間に話をすることもしばしばです。,私の友人、<マスキング済の氏名>は<マスキング済の会社名>に勤めています。昨年の誕生日には、都内のレストランで素晴らしいディナーを楽しみました。彼の誕生日は<マスキング済の生年月日>で、ますます大人になっていく彼を見ていると感慨深いものがあります。ディナーを終えた後、彼の家に帰る途中で、<マスキング済の電話番号>の電話番号で家族に連絡を取りました。彼は、彼の住んでいる住所が<マスキング済の住所>であることをいつも自慢していました。そんな彼と過ごした特別な時間は今でも心に残っています。私たちは、友達の関係を超え、長い付き合いを続けていくことでしょう。この間、彼から学んだことはたくさんあります。特に、ビジネスシーンでも役立つ彼の豊富な経験から、多くのことを吸収しました。彼のアドバイスは、私のキャリアにも良い影響を与えています。お気に入りのカフェで仕事の合間に話をすることもしばしばです。,company_name,add_corp_after_english_company_name
"私の名前は佐藤花子です。現在、東京にあるテクノロジー企業のInnovative Tech Solutions株式会社でプロジェクトマネージャーとして働いています。会社では、新しいシステムの開発やプロジェクトの進行管理を担当しており、国内外のクライアントとの打ち合わせも頻繁に行います。特に最近は、AIを活用したプラットフォームの構築に携わっており、楽しい挑戦の真っ最中です。

さて、もし私に連絡が必要な場合は、電話番号の080-2345-6789か、私のメールアドレスのsato.hanako@example.comまでご連絡ください。また、私の自宅は東京都渋谷区恵比寿南1丁目3-5にあります。この地域はアクセスが良く、普段はサイクリングを楽しんだり、近くのカフェで友人と過ごすことが多いです。生まれは1988年6月15日で、今は35歳です。

最近の趣味は写真撮影で、休日にはカメラを持っていろいろな場所を訪れることが好きです。友人たちとの旅行や、美味しい料理探しも楽しみの一つです。旅行した場所の写真をSNSで共有することで、他の人たちとも交流を持っています。私の会社でも、こういった個人的な趣味を仕事に活かせるプロジェクトがあれば良いなと思っています。","私の名前は<マスキング済の氏名>です。現在、東京にあるテクノロジー企業の<マスキング済の会社名>でプロジェクトマネージャーとして働いています。会社では、新しいシステムの開発やプロジェクトの進行管理を担当しており、国内外のクライアントとの打ち合わせも頻繁に行います。特に最近は、AIを活用したプラットフォームの構築に携わっており、楽しい挑戦の真っ最中です。

さて、もし私に連絡が必要な場合は、電話番号の<マスキング済の電話番号>か、私のメールアドレスの<マスキング済のemailアドレス>までご連絡ください。また、私の自宅は<マスキング済の住所>にあります。この地域はアクセスが良く、普段はサイクリングを楽しんだり、近くのカフェで友人と過ごすことが多いです。生まれは<マスキング済の生年月日>で、今は35歳です。

最近の趣味は写真撮影で、休日にはカメラを持っていろいろな場所を訪れることが好きです。友人たちとの旅行や、美味しい料理探しも楽しみの一つです。旅行した場所の写真をSNSで共有することで、他の人たちとも交流を持っています。私の会社でも、こういった個人的な趣味を仕事に活かせるプロジェクトがあれば良いなと思っています。",company_name,add_corp_after_english_company_name
私の名前は鈴木一郎で、今年の春に新しい職場であるApex Corporationに入社しました。これまでは別の会社で5年間働いていましたが、新しい環境で仕事ができることにワクワクしています。私の今の住所は東京都渋谷区神南1丁目10-6です。この新しい職場では、プロジェクトマネージャーとして、チームを率いる役割を担っています。先週、初めての大きなプレゼンテーションがありましたが、無事に成功しました。上司の山田さんからも良い評価をいただき、自信を持って働けるようになりました。また、趣味としているフットサルのチームメイトと一緒に、新しい仲間を早く作りたいと思っています。頑張れば1年後には自分のチームも持ちたいと考えています。ちなみに、私の生年月日は1985年5月10日で、連絡先は090-9876-5432、メールアドレスはichiro.suzuki@email.comです。これからさらに成長していきたいですので、何かご意見があればお聞かせください。,私の名前は<マスキング済の氏名>で、今年の春に新しい職場である<マスキング済の会社名>に入社しました。これまでは別の会社で5年間働いていましたが、新しい環境で仕事ができることにワクワクしています。私の今の住所は<マスキング済の住所>です。この新しい職場では、プロジェクトマネージャーとして、チームを率いる役割を担っています。先週、初めての大きなプレゼンテーションがありましたが、無事に成功しました。上司の<マスキング済の氏名>さんからも良い評価をいただき、自信を持って働けるようになりました。また、趣味としているフットサルのチームメイトと一緒に、新しい仲間を早く作りたいと思っています。頑張れば1年後には自分のチームも持ちたいと考えています。ちなみに、私の生年月日は<マスキング済の生年月日>で、連絡先は<マスキング済の電話番号>、メールアドレスは<マスキング済のemailアドレス>です。これからさらに成長していきたいですので、何かご意見があればお聞かせください。,company_name,add_corp_after_english_company_name
こんにちは、私の名前は鈴木一郎です。私は東京の港区に住んでおり、仕事は外国の企業であるConTech株式会社に勤めています。私の役割はプロジェクトマネージャーであり、日々様々なクライアントとやり取りをしながらプロジェクトを進めています。具体的には、先日、ABC社とのミーティングがあり、プロジェクトの進捗について話し合いました。また、メールでのやり取りも多く、私のメールアドレスはsuzuki.ichiro@example.comです。最近、仕事の連絡が増えてきて、電話番号も含めて070-5678-1234で連絡が取れるようにしています。生年月日は1985年5月15日ですので、趣味としては体を動かすことが好きで、特にジョギングをよくしています。自宅の近くにある公園で、休日にはフレンドたちと一緒に走ったりしています。このように忙しい日々ですが、時には家族と一緒に出かける時間も大切にしています。私の母は埼玉県に住んでおり、頻繁には会えませんが、電話でのコミュニケーションを欠かさずに行っています。自宅の郵便番号は105-0001です。,こんにちは、私の名前は<マスキング済の氏名>です。私は<マスキング済の住所>に住んでおり、仕事は外国の企業である<マスキング済の会社名>に勤めています。私の役割はプロジェクトマネージャーであり、日々様々なクライアントとやり取りをしながらプロジェクトを進めています。具体的には、先日、ABC社とのミーティングがあり、プロジェクトの進捗について話し合いました。また、メールでのやり取りも多く、私のメールアドレスは<マスキング済のemailアドレス>です。最近、仕事の連絡が増えてきて、電話番号も含めて<マスキング済の電話番号>で連絡が取れるようにしています。生年月日は<マスキング済の生年月日>ですので、趣味としては体を動かすことが好きで、特にジョギングをよくしています。自宅の近くにある公園で、休日にはフレンドたちと一緒に走ったりしています。このように忙しい日々ですが、時には家族と一緒に出かける時間も大切にしています。私の母は埼玉県に住んでおり、頻繁には会えませんが、電話でのコミュニケーションを欠かさずに行っています。自宅の郵便番号は<マスキング済の郵便番号>です。,company_name,add_corp_after_english_company_name
先日、株式会社CyberAgentでの会議に参加しました。参加者は多く、特に印象に残ったのは、マーケティング部の鈴木一郎さんです。彼のプレゼンテーションは非常に分かりやすく、魅力的でした。その後、私たちは会議室を出て、近くのカフェでランチを取りました。カフェは東京都渋谷区に位置しており、素晴らしい雰囲気でした。そこでの会話では、私の趣味や最近読んだ本について話しました。特に、鈴木さんが勧めてくれた本はとても面白そうでした。帰りに鈴木さんが「何かあったら連絡してね」と言って、彼の連絡先を教えてくれました。電話番号は03-1234-5678、メールアドレスはsuzuki@example.comでした。私はその後、彼の会社の所在地である〒150-0002 東京都渋谷区渋谷1-2-3まで戻り、いくつかのプロジェクトについて考えました。私自身は、1985年5月12日生まれで、年齢がもうすぐ39歳になることを思うと、時が経つのが早いと感じます。とはいえ、仕事に対する情熱はいつまでも持ち続けたいと思っています。この会議で得た知識をもとに、次のプロジェクトに励むつもりです。,先日、<マスキング済の会社名>での会議に参加しました。参加者は多く、特に印象に残ったのは、マーケティング部の<マスキング済の氏名>さんです。彼のプレゼンテーションは非常に分かりやすく、魅力的でした。その後、私たちは会議室を出て、近くのカフェでランチを取りました。カフェは<マスキング済の住所>に位置しており、素晴らしい雰囲気でした。そこでの会話では、私の趣味や最近読んだ本について話しました。特に、<マスキング済の氏名>さんが勧めてくれた本はとても面白そうでした。帰りに<マスキング済の氏名>さんが「何かあったら連絡してね」と言って、彼の連絡先を教えてくれました。電話番号は<マスキング済の電話番号>、メールアドレスは<マスキング済のemailアドレス>でした。私はその後、彼の会社の所在地である<マスキング済の郵便番号> <マスキング済の住所>まで戻り、いくつかのプロジェクトについて考えました。私自身は、<マスキング済の生年月日>生まれで、年齢がもうすぐ39歳になることを思うと、時が経つのが早いと感じます。とはいえ、仕事に対する情熱はいつまでも持ち続けたいと思っています。この会議で得た知識をもとに、次のプロジェクトに励むつもりです。,company_name,add_corp_after_english_company_name
こんにちは。今日は私の職場についてお話ししたいと思います。私が働いているのは、株式会社Tech Innovation（TI）という会社です。私の名前は鈴木一郎で、東京都新宿区西新宿2丁目8-1にあるオフィスで働いています。月曜日から金曜日までの勤務で、毎朝9時から始まります。私の役割はプロジェクトマネージャーで、新しい技術を使ったプロジェクトを推進しています。先週、同僚の山田太郎と一緒にミーティングを行い、9月30日に予定している製品発表会の準備を進めました。私たちのチームが手掛けた製品は非常に魅力的で、顧客からのフィードバックも良好です。私の連絡先は080-9876-5432で、メールアドレスはichiro.suzuki@techinnovation.co.jpです。もし興味があれば、ぜひご連絡ください。,こんにちは。今日は私の職場についてお話ししたいと思います。私が働いているのは、<マスキング済の会社名>という会社です。私の名前は<マスキング済の氏名>で、<マスキング済の住所>にあるオフィスで働いています。月曜日から金曜日までの勤務で、毎朝9時から始まります。私の役割はプロジェクトマネージャーで、新しい技術を使ったプロジェクトを推進しています。先週、同僚の<マスキング済の氏名>と一緒にミーティングを行い、9月30日に予定している製品発表会の準備を進めました。私たちのチームが手掛けた製品は非常に魅力的で、顧客からのフィードバックも良好です。私の連絡先は<マスキング済の電話番号>で、メールアドレスは<マスキング済のemailアドレス>です。もし興味があれば、ぜひご連絡ください。,company_name,add_corp_after_english_company_name
こんにちは、株式会社Global Tech Solutionsの鈴木花子です。先日、弊社の新しいプロジェクトについての説明会を開きました。参加者の皆さんから非常に多くの質問をいただき、活発な意見交換が行われました。私たちのプロジェクトは、次世代のテクノロジーを使ったソリューションの開発を目指しており、特にエネルギー効率の向上に重点を置いています。また、今回のプロジェクトは、東京都渋谷区桜丘町12-3に位置している所からスタートしました。参加者の中には、以前からの取引先である佐藤商事の佐藤健一さんもいらっしゃいました。お互い、コーヒーを楽しみながら、新しいビジネスチャンスについて話し合いました。気になる方は、ぜひ私のメールアドレス(contact@suzuki.example.com)にご連絡ください。電話番号は035-1234-5678です。私たちは、より良い未来のために革新的なアイデアを実現していく予定ですので、ぜひ応援してください。プロジェクトの進捗などは定期的にニュースレターでお知らせする予定ですので、興味のある方はsubscribe@newsletter.example.comまで申し込んでください。皆様のご参加を心よりお待ちしております。,こんにちは、<マスキング済の会社名>の<マスキング済の氏名>です。先日、弊社の新しいプロジェクトについての説明会を開きました。参加者の皆さんから非常に多くの質問をいただき、活発な意見交換が行われました。私たちのプロジェクトは、次世代のテクノロジーを使ったソリューションの開発を目指しており、特にエネルギー効率の向上に重点を置いています。また、今回のプロジェクトは、<マスキング済の住所>に位置している所からスタートしました。参加者の中には、以前からの取引先である<マスキング済の会社名>の<マスキング済の氏名>さんもいらっしゃいました。お互い、コーヒーを楽しみながら、新しいビジネスチャンスについて話し合いました。気になる方は、ぜひ私のメールアドレス(<マスキング済のemailアドレス>)にご連絡ください。電話番号は<マスキング済の電話番号>です。私たちは、より良い未来のために革新的なアイデアを実現していく予定ですので、ぜひ応援してください。プロジェクトの進捗などは定期的にニュースレターでお知らせする予定ですので、興味のある方は<マスキング済のemailアドレス>まで申し込んでください。皆様のご参加を心よりお待ちしております。,company_name,add_corp_after_english_company_name
こんにちは、私はフィリップスジャパン株式会社の佐藤恵美と申します。私たちの会社では、最新のヘルスケア技術を開発し、全国の医療機関に提供しています。もしご興味があれば、ぜひご連絡ください。私のメールアドレスは emi.sato@philips.co.jp で、電話番号は 03-1234-5678 です。また、私の生年月日は 1985年4月12日 です。私の住んでいる住所は東京都新宿区西新宿2丁目8番1号で、郵便番号は 160-0023 となります。お互いの知識を共有しながら、素晴らしいプロジェクトを進めていければと思っています。お時間がある時にでもご返信いただければ嬉しいです。どうぞよろしくお願いいたします。,こんにちは、私は<マスキング済の会社名>の<マスキング済の氏名>と申します。私たちの会社では、最新のヘルスケア技術を開発し、全国の医療機関に提供しています。もしご興味があれば、ぜひご連絡ください。私のメールアドレスは<マスキング済のemailアドレス>で、電話番号は<マスキング済の電話番号>です。また、私の生年月日は<マスキング済の生年月日>です。私の住んでいる住所は<マスキング済の住所>で、郵便番号は<マスキング済の郵便番号>となります。お互いの知識を共有しながら、素晴らしいプロジェクトを進めていければと思っています。お時間がある時にでもご返信いただければ嬉しいです。どうぞよろしくお願いいたします。,company_name,add_corp_after_english_company_name
私の名前は佐藤健です。先週、東京の豊島区池袋にある友人の家を訪れました。彼の家はとても素敵で、居心地の良い空間でした。友人は最近、Yahoo! Japan Corporationに転職したばかりで、仕事がすごく忙しいと言っていました。そのため、彼とは久しぶりに会うことができました。彼の職場でのエピソードや、最近のプロジェクトについて色々と話を聞かせてくれました。仕事が終わってから、私たちはいくつかの飲食店を巡って、美味しいつけ麺や寿司を堪能しました。彼は特にその日が良い天気だったことを喜んでいました。その後、また会おうという約束をして、彼の電話番号（090-9876-5432）とメールアドレス（satou@example.com）を交換しました。また来月か再来月に会う予定です。ちなみに、私の誕生日は1990年6月15日で、特撮番組が好きです。これからも彼とは仲良くしていければいいなと思っています。,私の名前は<マスキング済の氏名>です。先週、<マスキング済の住所>にある友人の家を訪れました。彼の家はとても素敵で、居心地の良い空間でした。友人は最近、<マスキング済の会社名>に転職したばかりで、仕事がすごく忙しいと言っていました。そのため、彼とは久しぶりに会うことができました。彼の職場でのエピソードや、最近のプロジェクトについて色々と話を聞かせてくれました。仕事が終わってから、私たちはいくつかの飲食店を巡って、美味しいつけ麺や寿司を堪能しました。彼は特にその日が良い天気だったことを喜んでいました。その後、また会おうという約束をして、彼の電話番号（<マスキング済の電話番号>）とメールアドレス（<マスキング済のemailアドレス>）を交換しました。また来月か再来月に会う予定です。ちなみに、私の誕生日は<マスキング済の生年月日>で、特撮番組が好きです。これからも彼とは仲良くしていければいいなと思っています。,company_name,add_corp_after_english_company_name
