before_mask,after_mask,category,sub_category
"先日、株式会社アクシスに勤務している私、佐藤健一（生年月日:1990年5月3日）は、クライアントとの重要な会議がありました。会議は東京都港区にあるオフィスで行われました。会議に向かう途中、ふと思い出したのですが、私の学生時代の友人で今は別の会社に勤務している鈴木花子（生年月日:1991年7月15日）のことです。彼女もアクシスと取引のある企業に勤めているので、もしかしたら今度の会議で会えるかもしれないと思い、少しドキドキしました。

会議では、顧客からの新しいプロジェクトの提案について話し合われました。そのプロジェクトは、私たちの技術を駆使した新しいシステムの開発で、非常に大きなチャンスを提供してくれるものでした。具体的には、企業の業務を効率化するためのシステムで、現在の問題点を分析した上での提案を行うことになっています。私たちの会社は、これまでにも数多くのシステム開発を手がけてきた実績がありますが、今回の案件は特に大きなものになると期待しています。

会議の後、社内のスタッフと共に作成した提案書を持って顧客に連絡を取る予定です。連絡先は080-9876-5432で、私のメールアドレスはsato.kenichi@example.comです。今後の進捗については、適宜情報を更新し、予測される問題点についても事前に検討しておく必要があります。これからの挑戦に向けて、チーム一丸となって取り組んでいきたいと思います。

その日の終わりには、同僚の山田太郎と食事に行きました。彼はレストランでの食事中、私たちのプロジェクトの成功を祈る乾杯を提案してくれました。その時、ふと彼が言ったのですが、「成功するためには、互いに協力し合い、意見を出し合うことが大切だね」とのことでした。

変化の速い業界ですが、私たちアクシスは常に新しい技術を取り入れ、クライアントに最善のサービスを提供することに尽力しています。夢の実現に向けて、次のステップを進めていく所存です。ぜひ、今後ともよろしくお願いいたします。","先日、<マスキング済の会社名>に勤務している私、<マスキング済の氏名>（<マスキング済の生年月日>）は、クライアントとの重要な会議がありました。会議は<マスキング済の住所>にあるオフィスで行われました。会議に向かう途中、ふと思い出したのですが、私の学生時代の友人で今は別の会社に勤務している<マスキング済の氏名>（<マスキング済の生年月日>）のことです。彼女も<マスキング済の会社名>と取引のある企業に勤めているので、もしかしたら今度の会議で会えるかもしれないと思い、少しドキドキしました。

会議では、顧客からの新しいプロジェクトの提案について話し合われました。そのプロジェクトは、私たちの技術を駆使した新しいシステムの開発で、非常に大きなチャンスを提供してくれるものでした。具体的には、企業の業務を効率化するためのシステムで、現在の問題点を分析した上での提案を行うことになっています。私たちの会社は、これまでにも数多くのシステム開発を手がけてきた実績がありますが、今回の案件は特に大きなものになると期待しています。

会議の後、社内のスタッフと共に作成した提案書を持って顧客に連絡を取る予定です。連絡先は<マスキング済の電話番号>で、私のメールアドレスは<マスキング済のemailアドレス>です。今後の進捗については、適宜情報を更新し、予測される問題点についても事前に検討しておく必要があります。これからの挑戦に向けて、チーム一丸となって取り組んでいきたいと思います。

その日の終わりには、同僚の<マスキング済の氏名>と食事に行きました。彼はレストランでの食事中、私たちのプロジェクトの成功を祈る乾杯を提案してくれました。その時、ふと彼が言ったのですが、「成功するためには、互いに協力し合い、意見を出し合うことが大切だね」とのことでした。

変化の速い業界ですが、私たち<マスキング済の会社名>は常に新しい技術を取り入れ、クライアントに最善のサービスを提供することに尽力しています。夢の実現に向けて、次のステップを進めていく所存です。ぜひ、今後ともよろしくお願いいたします。",company_name,not_add_corp_after_kanji_company_name
私の名前は山田花子で、東京都新宿区西新宿2丁目8-1に住んでいます。現在、ソフトウェア開発会社のテクニカルサポート部門で働いており、株式会社テクノブレインという会社です。日々の業務で多くの顧客とコミュニケーションを取り、問題を解決しています。最近では、顧客からの問い合わせが増え、特に新しいソフトウェアの導入に関するサポートが多くなりました。私の電話番号は090-9876-5432、メールアドレスはhanako.yamada@example.comです。趣味は旅行で、これまでにヨーロッパやアジアなどさまざまな国を訪れました。昨年の夏には、フランスに行き、パリの美しい風景を楽しみました。また、友人たちと一緒にパリのカフェで過ごす時間もとても楽しかったです。生まれたのは1990年5月10日ですが、その記念日にはいつも特別なことをしています。今年は友達と一緒にお祝いをする予定です。私の夢は、開発業務を通じて多くの人々の役に立つサービスを提供し、私自身も成長していくことです。,私の名前は<マスキング済の氏名>で、<マスキング済の住所>に住んでいます。現在、<マスキング済の会社名>のテクニカルサポート部門で働いており、日々の業務で多くの顧客とコミュニケーションを取り、問題を解決しています。最近では、顧客からの問い合わせが増え、特に新しいソフトウェアの導入に関するサポートが多くなりました。私の電話番号は<マスキング済の電話番号>、メールアドレスは<マスキング済のemailアドレス>です。趣味は旅行で、これまでにヨーロッパやアジアなどさまざまな国を訪れました。昨年の夏には、フランスに行き、パリの美しい風景を楽しみました。また、友人たちと一緒にパリのカフェで過ごす時間もとても楽しかったです。私の生まれたのは<マスキング済の生年月日>ですが、その記念日にはいつも特別なことをしています。今年は友達と一緒にお祝いをする予定です。私の夢は、開発業務を通じて多くの人々の役に立つサービスを提供し、私自身も成長していくことです。,company_name,not_add_corp_after_kanji_company_name
私の名前は佐藤健一で、東京都渋谷区代々木1丁目1-1に住んでいます。生まれた日は1985年7月15日で、今はPM株式会社でプロジェクトマネージャーとして働いています。仕事では多くのクライアントと接する機会があり、日々新しい課題に取り組んでいます。特に最近では、デジタルトランスフォーメーションに関するプロジェクトが増えてきており、業界の変化を実感しています。私のメールアドレスはsato.k@pmcompany.co.jpで、何かあればお気軽にご連絡ください。また、電話番号は090-1234-5678です。仕事のあとは友人たちと食事に行くことが多く、最近は渋谷の新しいレストランを探すのが趣味になっています。最近行ったのは“和食の匠”というお店で、鮮魚の刺身がとても美味しかったです。ぜひ、皆さんも行ってみてください。,私の名前は<マスキング済の氏名>で、<マスキング済の住所>に住んでいます。生まれた日は<マスキング済の生年月日>で、今は<マスキング済の会社名>でプロジェクトマネージャーとして働いています。仕事では多くのクライアントと接する機会があり、日々新しい課題に取り組んでいます。特に最近では、デジタルトランスフォーメーションに関するプロジェクトが増えてきており、業界の変化を実感しています。私のメールアドレスは<マスキング済のemailアドレス>で、何かあればお気軽にご連絡ください。また、電話番号は<マスキング済の電話番号>です。仕事のあとは友人たちと食事に行くことが多く、最近は渋谷の新しいレストランを探すのが趣味になっています。最近行ったのは“和食の匠”というお店で、鮮魚の刺身がとても美味しかったです。ぜひ、皆さんも行ってみてください。,company_name,not_add_corp_after_kanji_company_name
私が働いているのはABC株式会社というIT企業です。私の名前は佐藤健で、今年の1月で30歳になりました。私の職場は東京都渋谷区にあり、プロジェクト管理を担当しています。住所は渋谷区宇田川町123-45です。連絡先としては、090-9876-5432の電話番号があります。もし何かあれば、メールはsato@example.comに送っていただければ、すぐにお返事いたします。ちなみに、私の郵便番号は150-0042です。最近、仕事で新しいシステムの導入に取り組んでいるのですが、非常に労力のいる作業です。それでもチーム全体で頑張っており、少しずつ成果が出てきています。この業界は常に進化しているため、新しい技術に常に目を向け続ける必要があります。そして、業務の合間に、チームメンバーとランチに行くことも多いです。最近は、あまり外に出ずに社内でランチを済ませることが増えていますが、たまには外に出て、気分転換したいと思っています。,私が働いているのは<マスキング済の会社名>というIT企業です。私の名前は<マスキング済の氏名>で、今年の1月で<マスキング済の生年月日>歳になりました。私の職場は<マスキング済の住所>にあり、プロジェクト管理を担当しています。連絡先としては、<マスキング済の電話番号>の電話番号があります。もし何かあれば、メールは<マスキング済のemailアドレス>に送っていただければ、すぐにお返事いたします。ちなみに、私の郵便番号は<マスキング済の郵便番号>です。最近、仕事で新しいシステムの導入に取り組んでいるのですが、非常に労力のいる作業です。それでもチーム全体で頑張っており、少しずつ成果が出てきています。この業界は常に進化しているため、新しい技術に常に目を向け続ける必要があります。そして、業務の合間に、チームメンバーとランチに行くことも多いです。最近は、あまり外に出ずに社内でランチを済ませることが増えていますが、たまには外に出て、気分転換したいと思っています。,company_name,not_add_corp_after_kanji_company_name
こんにちは！私の名前は鈴木花子です。最近、東京都新宿区のオフィスで働き始めたばかりです。会社名はABCテクノロジーです。ここでの仕事はとても刺激的で、新しいプロジェクトが次々と進んでいます。特に、来月には大きなプレゼンテーションを控えていて、少し緊張しています。私のチームはとても協力的で、皆からサポートを受けながら、日々成長を実感しています。また、プライベートでは映画鑑賞が趣味で、休日には友人と一緒に新作映画を観に行くことが楽しみです。もし何か質問があれば、ぜひご連絡ください。私の電話番号は03-1234-5678、メールアドレスはhana123@example.comです。生まれた日は1985年3月10日ですので、もうすぐ誕生日が来るのが嬉しいです。これからもお仕事に精一杯取り組んでいきたいと思っていますので、よろしくお願いいたします。,こんにちは！私の名前は<マスキング済の氏名>です。最近、<マスキング済の住所>のオフィスで働き始めたばかりです。会社名は<マスキング済の会社名>です。ここでの仕事はとても刺激的で、新しいプロジェクトが次々と進んでいます。特に、来月には大きなプレゼンテーションを控えていて、少し緊張しています。私のチームはとても協力的で、皆からサポートを受けながら、日々成長を実感しています。また、プライベートでは映画鑑賞が趣味で、休日には友人と一緒に新作映画を観に行くことが楽しみです。もし何か質問があれば、ぜひご連絡ください。私の電話番号は<マスキング済の電話番号>、メールアドレスは<マスキング済のemailアドレス>です。生まれた日は<マスキング済の生年月日>ですので、もうすぐ誕生日が来るのが嬉しいです。これからもお仕事に精一杯取り組んでいきたいと思っていますので、よろしくお願いいたします。,company_name,not_add_corp_after_kanji_company_name
今日は私の友人である佐藤花子が、新たに「トレンドデザイン社」を立ち上げたことをお祝いするために、パーティーを開催しました。彼女は、2000年4月5日生まれで、普段は東京都新宿区の自宅から仕事をしているのですが、最近はそのビジネスが忙しくなり、なかなか会うことができませんでした。会場には、彼女の友人や仕事仲間も集まり、笑顔が絶えない楽しいひとときを過ごしました。特に、彼女が自分のブランドを立ち上げるまでの苦労話や、今後の展望について語った際には、参加者全員が興味を持って耳を傾けていました。連絡先としては、彼女の携帯電話番号が090-9876-5432で、メールアドレスはhana.sato@example.comです。友人として、彼女の成功を本当に心から嬉しく思っています。今後の成長が楽しみですし、こちらの住所は、東京都新宿区西新宿2丁目12-1ですので、また近いうちに彼女を訪れたいと思っています。,今日は私の友人である<マスキング済の氏名>が、新たに<マスキング済の会社名>を立ち上げたことをお祝いするために、パーティーを開催しました。彼女は、<マスキング済の生年月日>生まれで、普段は<マスキング済の住所>から仕事をしているのですが、最近はそのビジネスが忙しくなり、なかなか会うことができませんでした。会場には、彼女の友人や仕事仲間も集まり、笑顔が絶えない楽しいひとときを過ごしました。特に、彼女が自分のブランドを立ち上げるまでの苦労話や、今後の展望について語った際には、参加者全員が興味を持って耳を傾けていました。連絡先としては、彼女の携帯電話番号が<マスキング済の電話番号>で、メールアドレスは<マスキング済のemailアドレス>です。友人として、彼女の成功を本当に心から嬉しく思っています。今後の成長が楽しみですし、こちらの住所は、<マスキング済の住所>ですので、また近いうちに彼女を訪れたいと思っています。,company_name,not_add_corp_after_kanji_company_name
こんにちは、株式会社日本テクノロジーの鈴木一郎と申します。私たちは最新のITソリューションを提供する企業で、多くのクライアントとの信頼関係を築いてきました。例えば、最近では福岡県福岡市内の企業様と連携し、システムの導入を行いました。このプロジェクトでは、私たちのチームが一丸となって取り組んでおり、大変好評をいただいています。お客様から頂戴したフィードバックも非常に前向きで、私たちの次のステップを考える上で貴重な参考になっています。もしご興味があれば、ぜひ一度お話ししましょう。私のメールアドレスは suzuki.ichiro@example.com で、連絡先は 090-9876-5432 です。ご連絡をお待ちしています。それでは、皆さんが素晴らしい一日を過ごせるよう願っています。そしてプロジェクト以外でも何か興味があれば、遠慮なく聞いてくださいね。799-0001の地域でも活動していますので、ぜひお立ち寄りください。,こんにちは、<マスキング済の会社名>の<マスキング済の氏名>と申します。私たちは最新のITソリューションを提供する企業で、多くのクライアントとの信頼関係を築いてきました。例えば、最近では<マスキング済の住所>の企業様と連携し、システムの導入を行いました。このプロジェクトでは、私たちのチームが一丸となって取り組んでおり、大変好評をいただいています。お客様から頂戴したフィードバックも非常に前向きで、私たちの次のステップを考える上で貴重な参考になっています。もしご興味があれば、ぜひ一度お話ししましょう。私のメールアドレスは<マスキング済のemailアドレス> で、連絡先は<マスキング済の電話番号> です。ご連絡をお待ちしています。それでは、皆さんが素晴らしい一日を過ごせるよう願っています。そしてプロジェクト以外でも何か興味があれば、遠慮なく聞いてくださいね。<マスキング済の郵便番号>の地域でも活動していますので、ぜひお立ち寄りください。,company_name,not_add_corp_after_kanji_company_name
先日、株式会社富士ソフトの営業部から入ってきた情報に基づき、顧客とのミーティングを行うことになりました。ミーティングには、私たちのチームから佐藤裕子が参加する予定です。佐藤はこのプロジェクトに非常に熱心で、新しい提案を考えているようです。なお、ミーティングの開催場所は東京都港区の弊社オフィスで、日程は来週の水曜日、2023年11月1日の午後3時からです。もし不明な点があれば、私にご連絡ください。連絡先は090-9876-5432、メールアドレスはyuko.sato@example.comです。これまでの関係をうまく活かして、良い結果を出せることを期待しています。プロジェクトの進行に併せて、定期的に打ち合わせを行う予定ですので、引き続き情報の共有をお願い致します。また、今後のサポートが必要な場合は、私までご指摘いただければと思います。弊社はこのプロジェクトを通じてクライアントとの信頼関係をさらに深めていく所存です。このプロジェクトを成功させるために、全力を尽くします。,先日、<マスキング済の会社名>の営業部から入ってきた情報に基づき、顧客とのミーティングを行うことになりました。ミーティングには、私たちのチームから<マスキング済の氏名>が参加する予定です。<マスキング済の氏名>はこのプロジェクトに非常に熱心で、新しい提案を考えているようです。なお、ミーティングの開催場所は<マスキング済の住所>で、日程は来週の水曜日、<マスキング済の生年月日>の午後3時からです。もし不明な点があれば、私にご連絡ください。連絡先は<マスキング済の電話番号>、メールアドレスは<マスキング済のemailアドレス>です。これまでの関係をうまく活かして、良い結果を出せることを期待しています。プロジェクトの進行に併せて、定期的に打ち合わせを行う予定ですので、引き続き情報の共有をお願い致します。また、今後のサポートが必要な場合は、私までご指摘いただければと思います。弊社はこのプロジェクトを通じてクライアントとの信頼関係をさらに深めていく所存です。このプロジェクトを成功させるために、全力を尽くします。,company_name,not_add_corp_after_kanji_company_name
先日、私の会社の同僚である佐藤花子さんと一緒にランチをしました。私たちは東京都渋谷区のとあるレストランで、彼女が以前から気になっていたお店に行くことにしました。彼女は、最近新しいプロジェクトを担当していて、忙しい日々を送っているようでしたが、普段は趣味で絵を描くのが好きだと話してくれました。ランチ中、彼女には生まれた日や住んでいる場所などの個人的な話も少しあったのですが、特に彼女が幼少期を過ごした場所について興味深いエピソードが印象的でした。また、彼女が住んでいるアパートの住所は新宿区で、郵便番号は160-0023です。彼女は、仕事を終えた後に友達と集まり、頻繁に飲みに行くと話していました。私もその会に参加することを約束したためとても楽しみにしています。その後、彼女が仕事関連の連絡をするために使っているメールアドレス（hanako@example.com）や連絡先電話番号（03-1234-5678）を教えてもらったのですが、私たちのコミュニケーションが便利になると思いました。きっと今後も良い友情を築けていけるに違いありません。,先日、私の会社の同僚である<マスキング済の氏名>さんと一緒にランチをしました。私たちは<マスキング済の住所>のとあるレストランで、彼女が以前から気になっていたお店に行くことにしました。彼女は、最近新しいプロジェクトを担当していて、忙しい日々を送っているようでしたが、普段は趣味で絵を描くのが好きだと話してくれました。ランチ中、彼女には生まれた日や住んでいる場所などの個人的な話も少しあったのですが、特に彼女が幼少期を過ごした場所について興味深いエピソードが印象的でした。また、彼女が住んでいるアパートの住所は<マスキング済の住所>で、郵便番号は<マスキング済の郵便番号>です。彼女は、仕事を終えた後に友達と集まり、頻繁に飲みに行くと話していました。私もその会に参加することを約束したためとても楽しみにしています。その後、彼女が仕事関連の連絡をするために使っているメールアドレス（<マスキング済のemailアドレス>）や連絡先電話番号（<マスキング済の電話番号>）を教えてもらったのですが、私たちのコミュニケーションが便利になると思いました。きっと今後も良い友情を築けていけるに違いありません。,company_name,not_add_corp_after_kanji_company_name
