before_mask,after_mask,category,sub_category
こんにちは、私は株式会社ソニーの佐藤花子です。先月、私たちの会社が主催した技術フォーラムに参加しました。今年のフォーラムでは、AI技術の進展についてのプレゼンテーションが行われ、多くの参加者が興味を持っていました。私たちのチームは、特に新しいAIモデルの開発に関する発表を行い、多くのフィードバックをいただきました。もしご興味があれば、私がお話しした内容を詳しくお知らせします。また、私のメールは hanako.sato@example.com で、いつでもご連絡いただければと思います。お電話は、03-1234-5678 ですので、気軽にご連絡ください。ちなみに、私は1980年5月10日に生まれました。今後ともよろしくお願いいたします。私たちが特に注目しているプロジェクトは、環境に優しい技術の開発で、これからもさまざまな取り組みを続けていく予定です。私たちの会社は、東京の渋谷区に本社を構えており、常に最先端の技術を追求しています。,こんにちは、私は<マスキング済の会社名>の<マスキング済の氏名>です。先月、私たちの会社が主催した技術フォーラムに参加しました。今年のフォーラムでは、AI技術の進展についてのプレゼンテーションが行われ、多くの参加者が興味を持っていました。私たちのチームは、特に新しいAIモデルの開発に関する発表を行い、多くのフィードバックをいただきました。もしご興味があれば、私がお話しした内容を詳しくお知らせします。また、私のメールは<マスキング済のemailアドレス>で、いつでもご連絡いただければと思います。お電話は、<マスキング済の電話番号>ですので、気軽にご連絡ください。ちなみに、私は<マスキング済の生年月日>に生まれました。今後ともよろしくお願いいたします。私たちが特に注目しているプロジェクトは、環境に優しい技術の開発で、これからもさまざまな取り組みを続けていく予定です。私たちの会社は、<マスキング済の住所>に本社を構えており、常に最先端の技術を追求しています。,company_name,not_add_corp_after_kanji_company_name
こんにちは、有限会社サクラ商事の鈴木花子です。私たちの会社は長年にわたり高品質な商品の提供に努めており、その実績が評価されています。このたび、私たちは新しいプロジェクトを立ち上げることになりました。プロジェクトの詳細や進捗については、ぜひご連絡いただければと思っています。連絡先は、東京都新宿区西新宿1丁目1-1です。電話番号は03-1234-5678、メールアドレスはsuzuki@example.comです。また、私の生年月日は1985年5月15日ですので、同じ歳の方とも仲良くなれるかもしれません。これからのご縁を楽しみにしております。どうぞよろしくお願いいたします。,こんにちは、<マスキング済の会社名>の<マスキング済の氏名>です。私たちの会社は長年にわたり高品質な商品の提供に努めており、その実績が評価されています。このたび、私たちは新しいプロジェクトを立ち上げることになりました。プロジェクトの詳細や進捗については、ぜひご連絡いただければと思っています。連絡先は、<マスキング済の住所>です。電話番号は<マスキング済の電話番号>、メールアドレスは<マスキング済のemailアドレス>です。また、私の生年月日は<マスキング済の生年月日>ですので、同じ歳の方とも仲良くなれるかもしれません。これからのご縁を楽しみにしております。どうぞよろしくお願いいたします。,company_name,not_add_corp_after_kanji_company_name
"私は、東京都港区にある日本テクノロジー株式会社でエンジニアとして働いている佐藤花子と言います。私の仕事は、主にシステムの開発と保守に関わるもので、日々新しい技術に挑戦しています。会社では、同じチームのメンバーと協力してプロジェクトを進めており、コミュニケーションを大切にしています。先日、私たちのチームは大規模なシステムのリニューアルプロジェクトを受注しました。リニューアル後のシステムは、よりユーザビリティの高いものになるように設計しており、現状の問題点を解決することに重点を置いています。

さて、私の趣味は旅行で、特に国内旅行が大好きです。最近は、友人と一緒に京都に行きました。歴史的な名所を巡ったり、美味しい料理を楽しんだりして、とても充実した時間を過ごしました。また、旅行の計画を立てるときには、必ず現地の情報をしっかりとリサーチするようにしています。旅行先での経験は生活の刺激になり、仕事もより一層頑張れます。

もし何か仕事のご依頼や私に連絡したいことがありましたら、電話番号の080-9876-5432やメールアドレスのhanako.sato@example.comにご連絡ください。どうぞよろしくお願いいたします。","私は、<マスキング済の住所>にある<マスキング済の会社名>でエンジニアとして働いている<マスキング済の氏名>と言います。私の仕事は、主にシステムの開発と保守に関わるもので、日々新しい技術に挑戦しています。会社では、同じチームのメンバーと協力してプロジェクトを進めており、コミュニケーションを大切にしています。先日、私たちのチームは大規模なシステムのリニューアルプロジェクトを受注しました。リニューアル後のシステムは、よりユーザビリティの高いものになるように設計しており、現状の問題点を解決することに重点を置いています。

さて、私の趣味は旅行で、特に国内旅行が大好きです。最近は、友人と一緒に<マスキング済の住所>に行きました。歴史的な名所を巡ったり、美味しい料理を楽しんだりして、とても充実した時間を過ごしました。また、旅行の計画を立てるときには、必ず現地の情報をしっかりとリサーチするようにしています。旅行先での経験は生活の刺激になり、仕事もより一層頑張れます。

もし何か仕事のご依頼や私に連絡したいことがありましたら、電話番号の<マスキング済の電話番号>やメールアドレスの<マスキング済のemailアドレス>にご連絡ください。どうぞよろしくお願いいたします。",company_name,not_add_corp_after_kanji_company_name
私は先日、東京都新宿区にある日本航空株式会社のオフィスを訪れました。そこでは、営業部の佐藤花子さんが私を出迎えてくれました。佐藤さんは、私のために具体的なプロジェクト案を用意してくれており、とても親切に説明をしてくれました。話を進めるなかで、彼女が新宿駅の近くに住んでいることを知りました。その住所は、例えば「東京都新宿区西新宿3-5-1」のような場所です。お互いの趣味や仕事についても話し合い、彼女の生年月日が1985年9月8日であることを確認しました。会議は非常に有意義で、午後の3時半に終わった後、佐藤さんは私に連絡先を教えてくれました。彼女の電話番号は090-2345-6789で、メールアドレスはsato.hanako@example.comです。その後、会議室を後にし、飛行機での出張の準備を始めました。私の出張先は大阪府であり、まもなく要件確認の電話をかける必要があります。出発予定日は2023年10月15日で、宿泊先は大阪市内のビジネスホテルです。,私は先日、<マスキング済の住所>にある<マスキング済の会社名>のオフィスを訪れました。そこでは、営業部の<マスキング済の氏名>さんが私を出迎えてくれました。<マスキング済の氏名>さんは、私のために具体的なプロジェクト案を用意してくれており、とても親切に説明をしてくれました。話を進めるなかで、彼女が新宿駅の近くに住んでいることを知りました。その住所は、例えば「<マスキング済の住所>」のような場所です。お互いの趣味や仕事についても話し合い、彼女の生年月日が<マスキング済の生年月日>であることを確認しました。会議は非常に有意義で、午後の3時半に終わった後、<マスキング済の氏名>さんは私に連絡先を教えてくれました。彼女の電話番号は<マスキング済の電話番号>で、メールアドレスは<マスキング済のemailアドレス>です。その後、会議室を後にし、飛行機での出張の準備を始めました。私の出張先は<マスキング済の住所>であり、まもなく要件確認の電話をかける必要があります。出発予定日は<マスキング済の生年月日>で、宿泊先は大阪市内のビジネスホテルです。,company_name,not_add_corp_after_kanji_company_name
昨年、東京都渋谷区にあるサンプル株式会社で新しいプロジェクトに参加することになりました。私の同僚である佐藤花子さんと一緒に、技術革新に関するセミナーを企画しました。セミナーには多くの参加者が集まり、興味深い意見交換が行われました。花子さんはとても情熱的で、彼女の発想力にはいつも感心しています。私たちは、プロジェクトの進行状況について事務所で何度も打ち合わせを重ねました。神奈川県横浜市にあるオフィスも利用し、そちらでも会議を行いました。参加者からの質問やフィードバックはとても有意義で、私たちのプロジェクトは大きく前進しました。セミナーの後、参加者全員にThank Youメールを送りました。私のアドレスはexample@example.comで、電話番号は090-9876-5432です。今後のプロジェクトの進行が楽しみで、番号の登録も進めています。私たちは、この経験を通して、さらにスキルを磨き、次世代のリーダーとして成長していきたいと思っています。,昨年、<マスキング済の住所>にある<マスキング済の会社名>で新しいプロジェクトに参加することになりました。私の同僚である<マスキング済の氏名>さんと一緒に、技術革新に関するセミナーを企画しました。セミナーには多くの参加者が集まり、興味深い意見交換が行われました。<マスキング済の氏名>さんはとても情熱的で、彼女の発想力にはいつも感心しています。私たちは、プロジェクトの進行状況について事務所で何度も打ち合わせを重ねました。<マスキング済の住所>にあるオフィスも利用し、そちらでも会議を行いました。参加者からの質問やフィードバックはとても有意義で、私たちのプロジェクトは大きく前進しました。セミナーの後、参加者全員にThank Youメールを送りました。私のアドレスは<マスキング済のemailアドレス>で、電話番号は<マスキング済の電話番号>です。今後のプロジェクトの進行が楽しみで、番号の登録も進めています。私たちは、この経験を通して、さらにスキルを磨き、次世代のリーダーとして成長していきたいと思っています。,company_name,not_add_corp_after_kanji_company_name
私の名前は佐藤美咲で、東京都中野区に住んでいます。現在はソフトウェア開発のチームでリーダーを務めているのですが、勤務先は日立製作所という会社です。私たちのチームは主に企業向けのアプリケーションを開発していて、多くのプロジェクトに取り組んでいます。最近では、クライアントからの要望に応じて、業務効率化のためのツールを制作しました。私の生年月日は1985年5月15日で、仕事の合間に趣味の写真撮影を楽しんでいます。今回、私が担当したプロジェクトの詳細について報告する際に、皆さんにはメールでお知らせいたしますので、私のメールアドレスに送っていただけますか？私の電話番号は03-4567-8910になります。よろしくお願いします。,私の名前は<マスキング済の氏名>で、<マスキング済の住所>に住んでいます。現在はソフトウェア開発のチームでリーダーを務めているのですが、勤務先は<マスキング済の会社名>という会社です。私たちのチームは主に企業向けのアプリケーションを開発していて、多くのプロジェクトに取り組んでいます。最近では、クライアントからの要望に応じて、業務効率化のためのツールを制作しました。私の生年月日は<マスキング済の生年月日>で、仕事の合間に趣味の写真撮影を楽しんでいます。今回、私が担当したプロジェクトの詳細について報告する際に、皆さんにはメールでお知らせいたしますので、私のメールアドレスに送っていただけますか？私の電話番号は<マスキング済の電話番号>になります。よろしくお願いします。,company_name,not_add_corp_after_kanji_company_name
こんにちは、私は有限会社アクティブソリューションズの佐藤幸子です。趣味は旅行と料理で、特に和食を作るのが好きです。旅行では、鎌倉や京都に行くことが多いですが、最近は家族で沖縄に行ったりしました。その際、宿泊したホテルはとても素晴らしく、夕日を見ながらの食事が印象的でした。また、スカイツリー近くの有名なレストランにも行きました。ここでは、さまざまなデザートを楽しむことができました。興味がある方には、電話でのご連絡もお待ちしておりますので、私の電話番号は090-9876-5432、またはメールにて、sachiko@example.comまでご連絡ください。ちなみに、私の生年月日は1985年6月15日で、長野県松本市の出身です。私たちの会社では、IT関連のサービスを主に提供しており、近年では特にクラウドサービスに力を入れています。,こんにちは、私は<マスキング済の会社名>の<マスキング済の氏名>です。趣味は旅行と料理で、特に和食を作るのが好きです。旅行では、<マスキング済の住所>に行くことが多いですが、最近は家族で<マスキング済の住所>に行ったりしました。その際、宿泊したホテルはとても素晴らしく、夕日を見ながらの食事が印象的でした。また、<マスキング済の住所>近くの有名なレストランにも行きました。ここでは、さまざまなデザートを楽しむことができました。興味がある方には、電話でのご連絡もお待ちしておりますので、私の電話番号は<マスキング済の電話番号>、またはメールにて、<マスキング済のemailアドレス>までご連絡ください。ちなみに、私の生年月日は<マスキング済の生年月日>で、<マスキング済の住所>の出身です。私たちの会社では、IT関連のサービスを主に提供しており、近年では特にクラウドサービスに力を入れています。,company_name,not_add_corp_after_kanji_company_name
こんにちは、私の名前は佐藤健二です。東京都新宿区西新宿4丁目を拠点にしている「テクノロジーソリューションズ」という会社でシステムエンジニアとして働いています。最近のプロジェクトでは、企業向けのソフトウェア開発に従事しており、多くの顧客とコミュニケーションを取りながら、それぞれのニーズに合わせたシステムを設計しています。私のメールアドレスは satokennji@example.com で、何かご質問があればお気軽にご連絡ください。また、私の連絡先電話番号は 03-1234-5678 です。生年月日は1985年5月8日ですので、今年で38歳になります。仕事の合間を見ては、家族と一緒に旅行をすることが好きで、特に温泉地を訪れるのが楽しみです。最近では箱根や草津温泉に行くことが多く、リフレッシュできるひとときを過ごしています。,こんにちは、私の名前は<マスキング済の氏名>です。<マスキング済の住所>を拠点にしている<マスキング済の会社名>でシステムエンジニアとして働いています。最近のプロジェクトでは、企業向けのソフトウェア開発に従事しており、多くの顧客とコミュニケーションを取りながら、それぞれのニーズに合わせたシステムを設計しています。私のメールアドレスは<マスキング済のemailアドレス>で、何かご質問があればお気軽にご連絡ください。また、私の連絡先電話番号は<マスキング済の電話番号>です。生年月日は<マスキング済の生年月日>ですので、今年で38歳になります。仕事の合間を見ては、家族と一緒に旅行をすることが好きで、特に温泉地を訪れるのが楽しみです。最近では箱根や草津温泉に行くことが多く、リフレッシュできるひとときを過ごしています。,company_name,not_add_corp_after_kanji_company_name
こんにちは、株式会社テクノロジーサポートの佐藤花子です。最近、私たちの会社は新しいプロジェクトを開始しました。このプロジェクトは、AIを活用した業務の効率化を目指しており、多くの人々の生活を便利にすることを目的としています。私たちは既に、神奈川県横浜市中区に新しいオフィスを開設し、チームが日々全力を尽くして取り組んでいます。プロジェクトについての詳細は、ぜひ私の直接の電話080-9876-5432またはメールアドレスhana.sato@example.comまでご連絡ください。お待ちしております。また、私の生年月日は1990年5月15日ですので、何かあれば気軽に聞いてください。,こんにちは、<マスキング済の会社名>の<マスキング済の氏名>です。最近、私たちの会社は新しいプロジェクトを開始しました。このプロジェクトは、AIを活用した業務の効率化を目指しており、多くの人々の生活を便利にすることを目的としています。私たちは既に、<マスキング済の住所>に新しいオフィスを開設し、チームが日々全力を尽くして取り組んでいます。プロジェクトについての詳細は、ぜひ私の直接の電話<マスキング済の電話番号>またはメールアドレス<マスキング済のemailアドレス>までご連絡ください。お待ちしております。また、私の生年月日は<マスキング済の生年月日>ですので、何かあれば気軽に聞いてください。,company_name,not_add_corp_after_kanji_company_name
私の名前は佐藤健太で、現在東京の渋谷にあるマーケティング会社、エクセルコンサルティングで働いています。私たちの会社は、クライアントのニーズに応えるために最善を尽くしており、最近、ある大手企業とのプロジェクトがスタートしました。このプロジェクトでは、クライアントの製品をより多くの顧客に知ってもらうための戦略を立てています。日々の業務に追われる中で、時折、メールでの連絡や電話でのやりとりもあります。私の連絡先は、080-9876-5432で、メールはkenta_sato@example.comです。また、私は1985年5月10日生まれで、年齢は38歳です。仕事を通じて多くの人々と出会い、交流できる機会がたくさんあります。時にはプライベートで会うこともありますが、仕事以外の話題で盛り上がることが多く、楽しい時間を過ごしています。私の趣味は旅行で、これまでに行った国の中で特にイタリアが気に入っています。美味しい料理や歴史的な建物に触れることで、日々のストレスを忘れることができますね。そして、家に帰ると、妻と一緒に映画を観たり、読書をしたりとリラックスする時間も大切にしています。私たちの人生は忙しいですが、充実感を持って過ごせていると感じています。そんな生活の中で、週末には友人たちと一緒に飲みに行くことも楽しみの一つです。お酒を飲みながら、互いの近況を話したり、夢を語り合ったりする時間は、かけがえのないひとときです。,私の名前は<マスキング済の氏名>で、現在東京の渋谷にあるマーケティング会社、<マスキング済の会社名>で働いています。私たちの会社は、クライアントのニーズに応えるために最善を尽くしており、最近、ある大手企業とのプロジェクトがスタートしました。このプロジェクトでは、クライアントの製品をより多くの顧客に知ってもらうための戦略を立てています。日々の業務に追われる中で、時折、メールでの連絡や電話でのやりとりもあります。私の連絡先は、<マスキング済の電話番号>で、メールは<マスキング済のemailアドレス>です。また、私は<マスキング済の生年月日>生まれで、年齢は38歳です。仕事を通じて多くの人々と出会い、交流できる機会がたくさんあります。時にはプライベートで会うこともありますが、仕事以外の話題で盛り上がることが多く、楽しい時間を過ごしています。私の趣味は旅行で、これまでに行った国の中で特にイタリアが気に入っています。美味しい料理や歴史的な建物に触れることで、日々のストレスを忘れることができますね。そして、家に帰ると、妻と一緒に映画を観たり、読書をしたりとリラックスする時間も大切にしています。私たちの人生は忙しいですが、充実感を持って過ごせていると感じています。そんな生活の中で、週末には友人たちと一緒に飲みに行くことも楽しみの一つです。お酒を飲みながら、互いの近況を話したり、夢を語り合ったりする時間は、かけがえのないひとときです。,company_name,not_add_corp_after_kanji_company_name
