before_mask,after_mask,category,sub_category
"私の名前は佐藤慎太郎で、東京都新宿区住吉町に住んでいます。ある日、友人と一緒にランチを楽しんでいると、彼は最近転職したばかりだと言っていました。彼の新しい職場は、東京の有名な企業、富士通株式会社で、そこで特に面白いプロジェクトに関わっているそうです。そのおかげで、毎日が充実しているとのことです。私も刺激を受け、現在の職場での仕事について話し始めました。私はマイクロソフト株式会社に勤めており、新しいソフトウェアの開発に取り組んでいます。特にAI技術の進化に触発されているところです。

そんな話をしていると、ふと思い立ち、友人に連絡先を送ることにしました。私のメールアドレスはsato_shintaro@gmail.comで、電話番号は090-9876-5432です。お互いの近況をもっと共有したいと思っています。友人が話す富士通のプロジェクトは非常に興味深いもので、彼は来月の25日に開催されるセミナーで発表をするらしいです。私も参加する予定です。参加人数が多い場合、事前に登録が必要だと言われています。

また、私たちは地元のスポーツクラブにも通っています。最近は、健康のためにランニングやヨガを始めました。とてもリフレッシュできる時間です。私たちのクラブは、毎週土曜日に集まって一緒に練習をしています。友人が言うには、富士通での忙しさの合間に、こうした趣味を続けることでストレス解消になるそうです。そして、これまでの仕事やプライベートでの出来事をざっくばらんに話し合うことが、私たちの絆を深めてもいると思います。お互いに支え合いながら、次のステップに進んでいけたらいいなと思っています。

このように、私たちの生活はさまざまな瞬間で溢れていますが、互いに刺激し合いながら成長していく姿勢も大切にしていきたいです。","私の名前は<マスキング済の氏名>で、<マスキング済の住所>に住んでいます。ある日、友人と一緒にランチを楽しんでいると、彼は最近転職したばかりだと言っていました。彼の新しい職場は、東京の有名な企業、<マスキング済の会社名>で、そこで特に面白いプロジェクトに関わっているそうです。そのおかげで、毎日が充実しているとのことです。私も刺激を受け、現在の職場での仕事について話し始めました。私は<マスキング済の会社名>に勤めており、新しいソフトウェアの開発に取り組んでいます。特にAI技術の進化に触発されているところです。

そんな話をしていると、ふと思い立ち、友人に連絡先を送ることにしました。私のメールアドレスは<マスキング済のemailアドレス>で、電話番号は<マスキング済の電話番号>です。お互いの近況をもっと共有したいと思っています。友人が話す<マスキング済の会社名>のプロジェクトは非常に興味深いもので、彼は来月の<マスキング済の生年月日>に開催されるセミナーで発表をするらしいです。私も参加する予定です。参加人数が多い場合、事前に登録が必要だと言われています。

また、私たちは地元のスポーツクラブにも通っています。最近は、健康のためにランニングやヨガを始めました。とてもリフレッシュできる時間です。私たちのクラブは、毎週土曜日に集まって一緒に練習をしています。友人が言うには、<マスキング済の会社名>での忙しさの合間に、こうした趣味を続けることでストレス解消になるそうです。そして、これまでの仕事やプライベートでの出来事をざっくばらんに話し合うことが、私たちの絆を深めてもいると思います。お互いに支え合いながら、次のステップに進んでいけたらいいなと思っています。

このように、私たちの生活はさまざまな瞬間で溢れていますが、互いに刺激し合いながら成長していく姿勢も大切にしていきたいです。",company_name,not_add_corp_after_kanji_company_name
先日、私の友人である佐藤花子さんが、東京の新宿区にある「株式会社月の光」という会社で働いていることを教えてくれました。月の光では、ソフトウェア開発を行っているらしく、比較的新しい会社ですが、急成長を遂げているそうです。花子さんは、大学を卒業したばかりの24歳で、友人たちと一緒にお祝いをするために、その会社の紹介をしてくれました。彼女は「東京の新宿区西新宿3丁目2-1」に住んでいると聞いて、驚きました。新宿は賑やかな街ですが、彼女のアパートは静かで居心地が良さそうです。私もそのお祝いに参加することにして、花子さんに連絡を取りました。彼女の携帯番号は080-9876-5432で、メールアドレスはhanako_sato@example.comです。お祝いの日は2023年10月15日に決まり、私も楽しみにしています。彼女の会社のプロジェクトについても聞いてみたいですし、将来一緒に働ける機会があればいいなと思っています。なお、彼女は1998年6月5日生まれのため、私たちと同じ年代で話が弾みそうです。,先日、私の友人である<マスキング済の氏名>さんが、東京の新宿区にある<マスキング済の会社名>という会社で働いていることを教えてくれました。<マスキング済の会社名>では、ソフトウェア開発を行っているらしく、比較的新しい会社ですが、急成長を遂げているそうです。<マスキング済の氏名>さんは、大学を卒業したばかりの24歳で、友人たちと一緒にお祝いをするために、その会社の紹介をしてくれました。彼女は「東京の新宿区西新宿3丁目2-1」に住んでいると聞いて、驚きました。新宿は賑やかな街ですが、彼女のアパートは静かで居心地が良さそうです。私もそのお祝いに参加することにして、<マスキング済の氏名>さんに連絡を取りました。彼女の携帯番号は<マスキング済の電話番号>で、メールアドレスは<マスキング済のemailアドレス>です。お祝いの日は<マスキング済の生年月日>に決まり、私も楽しみにしています。彼女の会社のプロジェクトについても聞いてみたいですし、将来一緒に働ける機会があればいいなと思っています。なお、彼女は<マスキング済の生年月日>生まれのため、私たちと同じ年代で話が弾みそうです。,company_name,not_add_corp_after_kanji_company_name
こんにちは、私の名前は佐藤健一です。今、私は東京の新宿区に住んでいて、仕事は株式会社テクノロジーソリューションズでエンジニアをしています。会社では毎日、クライアントからの要望に応じたシステム開発を行っており、特に最近ではデータ分析のプロジェクトに力を入れています。私の電話番号は03-1234-5678で、何か質問があれば気軽に連絡してください。また、私のメールアドレスはsato.kenichi@example.comですので、メールでもご連絡いただければと思います。私の生年月日は1985年5月10日です。趣味は映画鑑賞と旅行で、休日には友人と映画館に行ったり、国内外の観光地を訪れることが多いです。会社も毎年社員旅行を企画していて、昨年は沖縄に行きました。沖縄の美しい海や文化に触れ、リラックスすることができました。その旅の写真はたくさん撮ったので、またみんなで見返したいと思っています。,こんにちは、私の名前は<マスキング済の氏名>です。今、私は<マスキング済の住所>に住んでいて、仕事は<マスキング済の会社名>でエンジニアをしています。会社では毎日、クライアントからの要望に応じたシステム開発を行っており、特に最近ではデータ分析のプロジェクトに力を入れています。私の電話番号は<マスキング済の電話番号>で、何か質問があれば気軽に連絡してください。また、私のメールアドレスは<マスキング済のemailアドレス>ですので、メールでもご連絡いただければと思います。私の生年月日は<マスキング済の生年月日>です。趣味は映画鑑賞と旅行で、休日には友人と映画館に行ったり、国内外の観光地を訪れることが多いです。会社も毎年社員旅行を企画していて、昨年は沖縄に行きました。沖縄の美しい海や文化に触れ、リラックスすることができました。その旅の写真はたくさん撮ったので、またみんなで見返したいと思っています。,company_name,not_add_corp_after_kanji_company_name
私の名前は鈴木一郎です。2020年5月15日に生まれた息子は、今では３歳になりました。私たちは東京都新宿区西新宿に住んでおり、家の近くには公園があり、毎週末には家族で遊びに行きます。最近は、仕事が忙しくなってきて、なかなか家族と過ごす時間が取れませんが、株式会社カナリアのプロジェクトマネージャーとして頑張っています。この会社では多くの大規模なシステムを手掛けており、クライアントからも非常に信頼されています。また、私のメールアドレスはichiro.suzuki@example.comで、何かご相談があればこちらにご連絡いただけます。電話番号も気軽にご連絡ください、電話は03-1234-5678です。お仕事でのストレスもありますが、仕事仲間と一緒にランチを楽しむことが、私のリフレッシュ方法です。特に、同僚の山田花子とは、何でも話せる友人であり、良いアイデアが生まれることもしばしばです。今後も仕事とプライベートを両立させながら、充実した日々を送りたいと思っています。,私の名前は<マスキング済の氏名>です。<マスキング済の生年月日>に生まれた息子は、今では３歳になりました。私たちは<マスキング済の住所>に住んでおり、家の近くには公園があり、毎週末には家族で遊びに行きます。最近は、仕事が忙しくなってきて、なかなか家族と過ごす時間が取れませんが、<マスキング済の会社名>のプロジェクトマネージャーとして頑張っています。この会社では多くの大規模なシステムを手掛けており、クライアントからも非常に信頼されています。また、私のメールアドレスは<マスキング済のemailアドレス>で、何かご相談があればこちらにご連絡いただけます。電話番号も気軽にご連絡ください、電話は<マスキング済の電話番号>です。お仕事でのストレスもありますが、仕事仲間と一緒にランチを楽しむことが、私のリフレッシュ方法です。特に、同僚の<マスキング済の氏名>とは、何でも話せる友人であり、良いアイデアが生まれることもしばしばです。今後も仕事とプライベートを両立させながら、充実した日々を送りたいと思っています。,company_name,not_add_corp_after_kanji_company_name
私の名前は山田花子で、株式会社サンプル社に勤務しています。勤務地は東京都千代田区大手町1-1です。私の生年月日は1985年5月15日です。業務に関するご連絡は、私の携帯電話080-9876-5432またはメールアドレスyamada.hanako@example.comまでご連絡いただければ嬉しいです。最近、私たちの会社では新しいプロジェクトが立ち上がり、チーム一丸となって取り組んでいます。お客様からのフィードバックを大切にし、品質の向上に努めています。最近のプロジェクトでは、特にお客様の声に耳を傾け、柔軟な対応を心がけています。私たちの目指すことは、より良いサービスを提供し、顧客満足度の向上です。皆さんと一緒に仕事ができるのを楽しみにしています。,私の名前は<マスキング済の氏名>で、<マスキング済の会社名>に勤務しています。勤務地は<マスキング済の住所>です。私の生年月日は<マスキング済の生年月日>です。業務に関するご連絡は、私の携帯電話<マスキング済の電話番号>またはメールアドレス<マスキング済のemailアドレス>までご連絡いただければ嬉しいです。最近、私たちの会社では新しいプロジェクトが立ち上がり、チーム一丸となって取り組んでいます。お客様からのフィードバックを大切にし、品質の向上に努めています。最近のプロジェクトでは、特にお客様の声に耳を傾け、柔軟な対応を心がけています。私たちの目指すことは、より良いサービスを提供し、顧客満足度の向上です。皆さんと一緒に仕事ができるのを楽しみにしています。,company_name,not_add_corp_after_kanji_company_name
私は先日、友人の佐藤花子さんと一緒に、都内のとあるレストランでランチを楽しみました。そのレストランは、東京都港区南青山にある「美味屋」という名前のところで、特に海鮮料理が評判です。花子さんは、元々私の大学の同級生で、現在は株式会社ソフトウェア開発に勤めています。彼女の勤め先は私の知人にも評判の良い会社で、花子さん自身も仕事にやりがいを感じているようです。ランチのあと、私たちは同じく港区にあるおしゃれなカフェに移動し、そこでしばらくおしゃべりをしました。彼女は最近、<マスキング済の生年月日>に生まれた赤ちゃんの育児にも奮闘しており、その話を聞いていると、思わず私もエネルギーをもらうようでした。連絡先は080-9876-5432、メールはhanako.sato@example-mail.comで、もし何かあればいつでも連絡を取ってください。,私は先日、友人の<マスキング済の氏名>さんと一緒に、都内のとあるレストランでランチを楽しみました。そのレストランは、東京都港区にある「<マスキング済の会社名>」という名前のところで、特に海鮮料理が評判です。<マスキング済の氏名>さんは、元々私の大学の同級生で、現在は<マスキング済の会社名>に勤めています。彼女の勤め先は私の知人にも評判の良い会社で、<マスキング済の氏名>さん自身も仕事にやりがいを感じているようです。ランチのあと、私たちは同じく港区にあるおしゃれなカフェに移動し、そこでしばらくおしゃべりをしました。彼女は最近、<マスキング済の生年月日>に生まれた赤ちゃんの育児にも奮闘しており、その話を聞いていると、思わず私もエネルギーをもらうようでした。連絡先は<マスキング済の電話番号>、メールは<マスキング済のemailアドレス>で、もし何かあればいつでも連絡を取ってください。,company_name,not_add_corp_after_kanji_company_name
"私の名前は佐藤健です。昔から夢だった仕事に就くことができ、嬉しく思っています。現在、マイクロソフトという会社で、システムエンジニアとして働いています。オフィスは東京の中央区にあり、忙しい毎日を送っています。具体的には、複雑なシステムの設計や実装に関わっていて、お客様との打ち合わせも頻繁に行っています。仕事に集中するあまり、ついついランチを食べる時間を忘れてしまうこともあります。

私の連絡先は080-9876-5432で、何かあれば気軽に連絡してください。また、メールアドレスはsato@example.comです。プライベートでは、友人たちと旅行へ行くことが好きで、最近は沖縄や北海道に訪れました。特に沖縄の美しい海は忘れられない思い出です。

生まれは1990年3月15日で、両親は今も健在です。家を出たのは大学進学を機に上京してからですが、故郷の福岡はとても懐かしいです。実家は福岡市博多区にあり、実家の味である博多ラーメンがとても恋しいです。以前は毎年帰省していましたが、最近は忙しくてなかなか行けていません。今年の夏には必ず帰る予定です。

また、趣味は映画鑑賞で、特にアクション映画が好きです。週末は新作をチェックしたり、友人と一緒に映画館に足を運ぶことが楽しみの一つです。最近では「ワイルドスピード」シリーズにハマっています。アクションとストーリーが絶妙に絡み合っていて、最先端のカーアクションが見ものです。私の好きな俳優は、主演を務めるドミニク・トレット役のヴィン・ディーゼルです。

このような日々の中で、私は大切な友人や家族との時間も大切にしています。特に母親との時間は、私にとって心の安らぎとなっています。週末には家族と会ったり、時には一緒に外食を楽しむこともあります。居酒屋でお酒を飲みながら、いろいろな話をするのが好きです。私の電話番号が必要な場合は、080-9876-5432に連絡してください。

今後も、多様な経験を重ねながら自己成長を図り、良いエンジニアになりたいと考えています。私の目指す道はまだ遠いですが、日々努力し続けるつもりです。もし、私に興味がある方がいたら、お気軽に連絡してください。お待ちしております。","私の名前は<マスキング済の氏名>です。昔から夢だった仕事に就くことができ、嬉しく思っています。現在、<マスキング済の会社名>で、システムエンジニアとして働いています。オフィスは<マスキング済の住所>にあり、忙しい毎日を送っています。具体的には、複雑なシステムの設計や実装に関わっていて、お客様との打ち合わせも頻繁に行っています。仕事に集中するあまり、ついついランチを食べる時間を忘れてしまうこともあります。

私の連絡先は<マスキング済の電話番号>で、何かあれば気軽に連絡してください。また、メールアドレスは<マスキング済のemailアドレス>です。プライベートでは、友人たちと旅行へ行くことが好きで、最近は沖縄や北海道に訪れました。特に沖縄の美しい海は忘れられない思い出です。

生まれは<マスキング済の生年月日>で、両親は今も健在です。家を出たのは大学進学を機に上京してからですが、故郷の<マスキング済の住所>はとても懐かしいです。実家は<マスキング済の住所>にあり、実家の味である博多ラーメンがとても恋しいです。以前は毎年帰省していましたが、最近は忙しくてなかなか行けていません。今年の夏には必ず帰る予定です。

また、趣味は映画鑑賞で、特にアクション映画が好きです。週末は新作をチェックしたり、友人と一緒に映画館に足を運ぶことが楽しみの一つです。最近では「ワイルドスピード」シリーズにハマっています。アクションとストーリーが絶妙に絡み合っていて、最先端のカーアクションが見ものです。私の好きな俳優は、主演を務めるキャラクターである<マスキング済の声優名>です。

このような日々の中で、私は大切な友人や家族との時間も大切にしています。特に母親との時間は、私にとって心の安らぎとなっています。週末には家族と会ったり、時には一緒に外食を楽しむこともあります。居酒屋でお酒を飲みながら、いろいろな話をするのが好きです。私の電話番号が必要な場合は、<マスキング済の電話番号>に連絡してください。

今後も、多様な経験を重ねながら自己成長を図り、良いエンジニアになりたいと考えています。私の目指す道はまだ遠いですが、日々努力し続けるつもりです。もし、私に興味がある方がいたら、お気軽に連絡してください。お待ちしております。",company_name,not_add_corp_after_kanji_company_name
こんにちは、私の名前は鈴木一郎です。私は、千葉県船橋市本町一丁目に住んでいます。生まれた日付は1985年7月20日です。現在、私は株式会社トタルサービスで働いており、主にプロジェクトマネージャーとして様々な業務に従事しています。仕事の電話番号は043-123-4567で、特に急ぎの場合はこちらを使っていただければと思います。もし、何か質問があれば、私のメールアドレス、suzuki123@example.comまでご連絡いただければと思います。最近は、仕事の都合で忙しい日々が続いていますが、週末には友人たちと会ってリフレッシュするようにしています。私たちは、その時によく河原でバーベキューを楽しんだり、映画を見たりして過ごします。特に、アウトドアが好きなので、時間が許せばキャンプにも行くようにしています。皆さんはどうですか？ぜひ、お話を聞かせてください。,こんにちは、私の名前は<マスキング済の氏名>です。私は、<マスキング済の住所>に住んでいます。生まれた日付は<マスキング済の生年月日>です。現在、私は<マスキング済の会社名>で働いており、主にプロジェクトマネージャーとして様々な業務に従事しています。仕事の電話番号は<マスキング済の電話番号>で、特に急ぎの場合はこちらを使っていただければと思います。もし、何か質問があれば、私のメールアドレス、<マスキング済のemailアドレス>までご連絡いただければと思います。最近は、仕事の都合で忙しい日々が続いていますが、週末には友人たちと会ってリフレッシュするようにしています。私たちは、その時によく河原でバーベキューを楽しんだり、映画を見たりして過ごします。特に、アウトドアが好きなので、時間が許せばキャンプにも行くようにしています。皆さんはどうですか？ぜひ、お話を聞かせてください。,company_name,not_add_corp_after_kanji_company_name
