before_mask,after_mask,category,sub_category
"私の名前は佐藤健一で、東京都新宿区で働いています。現在、私が所属している会社は「株式会社テクノロジー」。ここではIT関連のプロジェクトマネージャーとして、大規模なシステム開発に携わっています。くわえて、私の専門はソフトウェア開発とデータ分析です。私の生年月日は1985年5月10日ですので、ちょうど38歳になったばかりです。新宿には2年ほど住んでいますが、最初は大阪に住んでいたため、自分のスタート地点とはかなり違う環境です。新宿の賑わいには毎日刺激を受けています。

メールアドレスはkenichi.sato@example.comで、仕事のメールについては必ずこのアドレスを使っています。また、連絡が必要な場合は080-9876-5432に電話をしていただければと思います。最近のプロジェクトでは、AIに関する新技術を試験的に導入する機会を得ました。これにより、業務の効率化が期待できると同時に、新しい挑戦に対する意欲が高まりました。もちろん、日々の業務は決して楽ではありませんが、チームメンバーと共に助け合い、時には飲みに行くことを通じて、職場の雰囲気も良くなっています。

私は日本の国際交流に興味があり、ビジネス英語を学ぶためのクラスにも参加しています。日本だけでなく、海外との関係を深めることも重要だと考えているからです。このような活動を通じて、新しい知識を得たり、他の文化を学んだりすることができるのを楽しみにしています。特に英語が堪能な同僚に助けてもらっているため、少しずつ自信を持てるようになってきました。

また、東京都新宿区には素晴らしいレストランやカフェがたくさんあるので、仕事が終わった後には友人たちと食事に行くことがよくあります。お気に入りのレストランでは、スパイシーなインドカレーを楽しむことができます。食事を通じてリラックスし、日頃の責任から一時的に解放される時間は、私にとって大切なリフレッシュの場でもあります。","私の名前は<マスキング済の氏名>で、<マスキング済の住所>で働いています。現在、私が所属している会社は「<マスキング済の会社名>」。ここではIT関連のプロジェクトマネージャーとして、大規模なシステム開発に携わっています。くわえて、私の専門はソフトウェア開発とデータ分析です。私の生年月日は<マスキング済の生年月日>ですので、ちょうど38歳になったばかりです。<マスキング済の住所>には2年ほど住んでいますが、最初は大阪に住んでいたため、自分のスタート地点とはかなり違う環境です。<マスキング済の住所>の賑わいには毎日刺激を受けています。

メールアドレスは<マスキング済のemailアドレス>で、仕事のメールについては必ずこのアドレスを使っています。また、連絡が必要な場合は<マスキング済の電話番号>に電話をしていただければと思います。最近のプロジェクトでは、AIに関する新技術を試験的に導入する機会を得ました。これにより、業務の効率化が期待できると同時に、新しい挑戦に対する意欲が高まりました。もちろん、日々の業務は決して楽ではありませんが、チームメンバーと共に助け合い、時には飲みに行くことを通じて、職場の雰囲気も良くなっています。

私は日本の国際交流に興味があり、ビジネス英語を学ぶためのクラスにも参加しています。日本だけでなく、海外との関係を深めることも重要だと考えているからです。このような活動を通じて、新しい知識を得たり、他の文化を学んだりすることができるのを楽しみにしています。特に英語が堪能な同僚に助けてもらっているため、少しずつ自信を持てるようになってきました。

また、<マスキング済の住所>には素晴らしいレストランやカフェがたくさんあるので、仕事が終わった後には友人たちと食事に行くことがよくあります。お気に入りのレストランでは、スパイシーなインドカレーを楽しむことができます。食事を通じてリラックスし、日頃の責任から一時的に解放される時間は、私にとって大切なリフレッシュの場でもあります。",company_name,not_add_corp_after_kanji_company_name
こんにちは、私は最近、東京の渋谷区にある「未来技術株式会社」でエンジニアとして働き始めた佐藤花子です。私の生年月日は1985年3月15日です。先日、会社の研修でムービングアートのセミナーに参加し、非常に刺激的でした。セミナーの後、同僚の田中一郎と一緒に昼食を取りました。私たちは「やよい軒」で美味しい定食を楽しみました。さらに、私たちはお互いの趣味や今後のキャリアについても話し合いました。私の趣味は写真で、休日にはよくカメラを持って出かけています。私の電話番号は080-9876-5432で、何かあれば気軽に連絡して下さい。また、私のメールアドレスはhanako.sato@example.comです。これからの仕事が楽しみです。,こんにちは、私は最近、<マスキング済の住所>にある<マスキング済の会社名>でエンジニアとして働き始めた<マスキング済の氏名>です。私の生年月日は<マスキング済の生年月日>です。先日、会社の研修でムービングアートのセミナーに参加し、非常に刺激的でした。セミナーの後、同僚の<マスキング済の氏名>と一緒に昼食を取りました。私たちは「やよい軒」で美味しい定食を楽しみました。さらに、私たちはお互いの趣味や今後のキャリアについても話し合いました。私の趣味は写真で、休日にはよくカメラを持って出かけています。私の電話番号は<マスキング済の電話番号>で、何かあれば気軽に連絡して下さい。また、私のメールアドレスは<マスキング済のemailアドレス>です。これからの仕事が楽しみです。,company_name,not_add_corp_after_kanji_company_name
"こんにちは、私の名前は佐藤花子と申します。私は東京に住んでおり、仕事は株式会社グローバルテクノロジーに勤めています。今度、私の大学時代の友人と飲み会を開くことになりました。集まるメンバーは長年親しく付き合っている人たちなので、とても楽しみにしています。友人の中には、今や有名なアーティストとして活躍している人もいます。彼は多忙なスケジュールをこなしていますが、それでも私たちの飲み会には参加してくれると言ってくれました。

また、今回は場所を渋谷の居酒屋に決めました。友人たちに「参加する」と連絡を入れたところ、多くの人が楽しみにしているという反応があり、とても嬉しかったです。私の連絡先は080-9876-5432で、メールアドレスはsato_hanako@example.comです。今は場所や時間も決めたので、あとは当日が来るのを待つだけです。また近況報告や思い出話に花を咲かせるのが待ち遠しいです。参加者には大学時代の仲間、お互いの進路を支え合った信頼できる友人たちです。

実は、飲み会の前に私自身の近況も話すつもりで、少し練習をしています。最近、仕事であるプロジェクトを成功させたので、みんなにその話をてんこ盛りで共有しようと思っています。プロジェクトは非常に大きなもので、チーム全体が一丸となって取り組み、結果が出たときは本当に感動的でした。

それに、私の趣味でもある写真撮影についてのことや、最近行った旅行のこともシェアできればと思っています。私は旅行が好きで、特に北海道の美しい自然が恋しいです。来月にはまた旅行に行く予定で、友達にもその話をして盛り上がりたいです。私は1979年5月15日生まれですので、もうすぐ誕生日です。友人からサプライズの企画があるらしいですが、本当に楽しみです。

最後に、やはり良い友人がいるということが私にとって一番の宝物です。毎日忙しい中でも、こうして集まって楽しい時間を過ごせることに感謝しています。また、その様子をできるだけ多くの友人と共有できる機会があればと思います。これからも大切な人たちとの時間を大事にしていきたいです。","こんにちは、私の名前は<マスキング済の氏名>と申します。私は<マスキング済の住所>に住んでおり、仕事は<マスキング済の会社名>に勤めています。今度、私の大学時代の友人と飲み会を開くことになりました。集まるメンバーは長年親しく付き合っている人たちなので、とても楽しみにしています。友人の中には、今や有名なアーティストとして活躍している人もいます。彼は多忙なスケジュールをこなしていますが、それでも私たちの飲み会には参加してくれると言ってくれました。

また、今回は場所を<マスキング済の住所>に決めました。友人たちに「参加する」と連絡を入れたところ、多くの人が楽しみにしているという反応があり、とても嬉しかったです。私の連絡先は<マスキング済の電話番号>で、メールアドレスは<マスキング済のemailアドレス>です。今は場所や時間も決めたので、あとは当日が来るのを待つだけです。参加者には大学時代の仲間、お互いの進路を支え合った信頼できる友人たちです。

実は、飲み会の前に私自身の近況も話すつもりで、少し練習をしています。最近、仕事であるプロジェクトを成功させたので、みんなにその話をてんこ盛りで共有しようと思っています。プロジェクトは非常に大きなもので、チーム全体が一丸となって取り組み、結果が出たときは本当に感動的でした。

それに、私の趣味でもある写真撮影についてのことや、最近行った旅行のこともシェアできればと思っています。私は旅行が好きで、特に北海道の美しい自然が恋しいです。来月にはまた旅行に行く予定で、友達にもその話をして盛り上がりたいです。私は<マスキング済の生年月日>ですので、もうすぐ誕生日です。友人からサプライズの企画があるらしいですが、本当に楽しみです。

最後に、やはり良い友人がいるということが私にとって一番の宝物です。毎日忙しい中でも、こうして集まって楽しい時間を過ごせることに感謝しています。また、その様子をできるだけ多くの友人と共有できる機会があればと思います。これからも大切な人たちとの時間を大事にしていきたいです。",company_name,not_add_corp_after_kanji_company_name
私の名前は鈴木一郎です。今から10年前に、福岡県福岡市東区に引っ越してきました。私の職場はテクノロジー株式会社という会社で、主にソフトウェア開発に従事しています。会社の同僚たちとよくランチを共にしており、その中に佐藤美咲さんという友人もいます。美咲さんは私のプロジェクトでのパートナーで、いつも明るく、チームの雰囲気を良くしてくれます。美咲さんは、山口県出身で、時々地元の話をしてくれます。先週末、同僚と一緒に居酒屋に行くことになり、私のスマートフォンで予約をしました。電話番号は092-9876-5432です。私のメールアドレスはichiro.suzuki@example.comです。週明けには、顧客からのフィードバックを受けて、プロジェクトを進める予定です。そのため、月曜日には必ず朝9時に出社します。先日、私の誕生日があり、皆にお祝いをしてもらいました。私の生年月日は1990年4月1日です。プレゼントには新しいノートパソコンをもらい、とても嬉しかったです。,私の名前は<マスキング済の氏名>です。今から10年前に、<マスキング済の住所>に引っ越してきました。私の職場は<マスキング済の会社名>という会社で、主にソフトウェア開発に従事しています。会社の同僚たちとよくランチを共にしており、その中に<マスキング済の氏名>さんという友人もいます。<マスキング済の氏名>さんは私のプロジェクトでのパートナーで、いつも明るく、チームの雰囲気を良くしてくれます。<マスキング済の氏名>さんは、山口県出身で、時々地元の話をしてくれます。先週末、同僚と一緒に居酒屋に行くことになり、私のスマートフォンで予約をしました。電話番号は<マスキング済の電話番号>です。私のメールアドレスは<マスキング済のemailアドレス>です。週明けには、顧客からのフィードバックを受けて、プロジェクトを進める予定です。そのため、月曜日には必ず朝9時に出社します。先日、私の誕生日があり、皆にお祝いをしてもらいました。私の生年月日は<マスキング済の生年月日>です。プレゼントには新しいノートパソコンをもらい、とても嬉しかったです。,company_name,not_add_corp_after_kanji_company_name
"私の名前は山田花子で、東京都港区南麻布3丁目に住んでいます。小学校の頃からの友人である鈴木一郎とは、今でも毎週連絡を取り合っています。先週、彼と久しぶりに食事をしました。話題は主に仕事についてで、彼は公務員として働いていて、最近は転職を検討しているとのことでした。彼の働いている部署は、一部の人々からは評価が低いと聞いていますが、鈴木は仕事にやりがいを感じているようでした。

また、私は最近、IT系の企業である日本テクノロジー株式会社に転職したばかりで、毎日新しいことを学びながら忙しい日々を送っています。特に、プロジェクトマネージャーとしての役割を担っており、チームをリードすることにやりがいを感じています。会社には多様なバックグラウンドを持つメンバーが集まっていて、毎日の会議で意見を交わすのがとても楽しいです。

私の月の初めの給与は約25万円ですが、ボーナスもあるため、生活には困っておりません。最近、遠出をしようと考え、友人の鈴木から個人的におすすめされた旅行先についても話しました。また、私には可愛い猫がいるのですが、名前は「タロウ」です。タロウはこの春でちょうど2歳になりました。私たちの家族である彼のおかげで日々癒されています。

私のメールアドレスはhanako_yamada@example.comですが、急用の際は電話で連絡していただけるとありがたいです。私の電話番号は090-9876-5432です。生年月日は1990年3月15日で、母が私の誕生日を毎年お祝いしてくれるおかげで、特別な日を楽しみにしています。東京都内の美味しいレストランでの食事も良い思い出となるでしょう。","私の名前は<マスキング済の氏名>で、<マスキング済の住所>に住んでいます。小学校の頃からの友人である<マスキング済の氏名>とは、今でも毎週連絡を取り合っています。先週、彼と久しぶりに食事をしました。話題は主に仕事についてで、彼は公務員として働いていて、最近は転職を検討しているとのことでした。彼の働いている部署は、一部の人々からは評価が低いと聞いていますが、<マスキング済の氏名>は仕事にやりがいを感じているようでした。

また、私は最近、IT系の企業である<マスキング済の会社名>に転職したばかりで、毎日新しいことを学びながら忙しい日々を送っています。特に、プロジェクトマネージャーとしての役割を担っており、チームをリードすることにやりがいを感じています。会社には多様なバックグラウンドを持つメンバーが集まっていて、毎日の会議で意見を交わすのがとても楽しいです。

私の月の初めの給与は約<マスキング済の金額>ですが、ボーナスもあるため、生活には困っておりません。最近、遠出をしようと考え、友人の<マスキング済の氏名>から個人的におすすめされた旅行先についても話しました。また、私には可愛い猫がいるのですが、名前は<マスキング済のペット名>です。<マスキング済のペット名>はこの春でちょうど<マスキング済の年齢>になりました。私たちの家族である彼のおかげで日々癒されています。

私のメールアドレスは<マスキング済のemailアドレス>ですが、急用の際は電話で連絡していただけるとありがたいです。私の電話番号は<マスキング済の電話番号>です。生年月日は<マスキング済の生年月日>で、母が私の誕生日を毎年お祝いしてくれるおかげで、特別な日を楽しみにしています。<マスキング済の都道府県>内の美味しいレストランでの食事も良い思い出となるでしょう。",company_name,not_add_corp_after_kanji_company_name
皆さん、初めまして。私は、株式会社東京エンジニアリングでシステムアナリストを務めている佐藤花子と申します。私たちの会社は、最新のテクノロジーを駆使して、さまざまな業界向けにソリューションを提供しています。例えば、最近では製造業のクライアントに対して、IoT技術を用いたデータ分析プラットフォームの構築を行いました。私たちのオフィスは東京都渋谷区桜丘町のヒルサイドビルにあり、クライアントとのミーティングには、よくこの場所を利用しています。もし何かご質問やご意見があれば、私のメールアドレスまでご連絡ください。連絡先は、090-9876-5432、メールは hanako.sato@example.com です。それでは、これからも何卒よろしくお願い申し上げます。,皆さん、初めまして。私は、<マスキング済の会社名>でシステムアナリストを務めている<マスキング済の氏名>と申します。私たちの会社は、最新のテクノロジーを駆使して、さまざまな業界向けにソリューションを提供しています。例えば、最近では製造業のクライアントに対して、IoT技術を用いたデータ分析プラットフォームの構築を行いました。私たちのオフィスは<マスキング済の住所>にあり、クライアントとのミーティングには、よくこの場所を利用しています。もし何かご質問やご意見があれば、私のメールアドレスまでご連絡ください。連絡先は、<マスキング済の電話番号>、メールは<マスキング済のemailアドレス>です。それでは、これからも何卒よろしくお願い申し上げます。,company_name,not_add_corp_after_kanji_company_name
先日、私は自分の勤務先であるソニーに、プロジェクトの進捗状況を報告するために資料を作成しなければならなかった。私の名前は山田花子で、今年の4月1日に28歳になります。報告の資料には、新製品の開発に関する詳細情報を含める必要がありました。その際、一緒に働いている佐藤健一さんと二人三脚で進めていました。私たちは、開発室でお互いのアイデアを出し合ったり、データを確認したりして、資料を完成させたのです。住所は東京都千代田区永田町1-1-1で、何かあればこちらへご連絡いただければいいかと思います。私の連絡先は050-1234-5678で、emailはyamada.hanako@example.comです。無事に資料が完成し、そのままプレゼンテーションの準備に入りました。プレゼンの日は、大きな会議室で30人以上の社員の前で行いました。どきどきしましたが、自信を持って発表でき、皆さんからのフィードバックも良好だったので、とても満足しました。これからも頑張っていきたいと思います。,先日、私は自分の勤務先である<マスキング済の会社名>に、プロジェクトの進捗状況を報告するために資料を作成しなければならなかった。私の名前は<マスキング済の氏名>で、今年の4月1日に<マスキング済の生年月日>になります。報告の資料には、新製品の開発に関する詳細情報を含める必要がありました。その際、一緒に働いている<マスキング済の氏名>さんと二人三脚で進めていました。私たちは、開発室でお互いのアイデアを出し合ったり、データを確認したりして、資料を完成させたのです。住所は<マスキング済の住所>で、何かあればこちらへご連絡いただければいいかと思います。私の連絡先は<マスキング済の電話番号>で、emailは<マスキング済のemailアドレス>です。無事に資料が完成し、そのままプレゼンテーションの準備に入りました。プレゼンの日は、大きな会議室で30人以上の社員の前で行いました。どきどきしましたが、自信を持って発表でき、皆さんからのフィードバックも良好だったので、とても満足しました。これからも頑張っていきたいと思います。,company_name,not_add_corp_after_kanji_company_name
私は先日、有限会社佐藤商事に就職した鈴木花子と申します。大学を卒業してから、ずっとこの会社で働くことを目指しており、ようやく夢が叶いました。会社の所在地は東京都渋谷区道玄坂1丁目25-3で、近くにはいろいろなお店がたくさんあって、お昼を楽しむのが待ち遠しいです。特にお気に入りのランチスポットがあって、毎日そこに通うのが楽しみです。また、仕事の内容は主に営業ですが、チームでの協力や顧客とのコミュニケーションが大切な役割を果たしています。もし私に何か質問があれば、どうぞお気軽にご連絡ください。私の電話番号は090-9876-5432、メールアドレスはhanako_suzuki@example.comです。それでは、今後ともよろしくお願いいたします。,私は先日、<マスキング済の会社名>に就職した<マスキング済の氏名>と申します。大学を卒業してから、ずっとこの会社で働くことを目指しており、ようやく夢が叶いました。会社の所在地は<マスキング済の住所>で、近くにはいろいろなお店がたくさんあって、お昼を楽しむのが待ち遠しいです。特にお気に入りのランチスポットがあって、毎日そこに通うのが楽しみです。また、仕事の内容は主に営業ですが、チームでの協力や顧客とのコミュニケーションが大切な役割を果たしています。もし私に何か質問があれば、どうぞお気軽にご連絡ください。私の電話番号は<マスキング済の電話番号>、メールアドレスは<マスキング済のemailアドレス>です。それでは、今後ともよろしくお願いいたします。,company_name,not_add_corp_after_kanji_company_name
