before_mask,after_mask
"Sato Akiko, who was born on September 5, 1989, is currently working at Nippon Tech Corporation, headquartered at 3-2-1 Roppongi, Minato-ku, Tokyo, postal code 106-0032. Her office contact email is akiko.sato@nippontech.co.jp, and her mobile phone number is 090-8888-9999. She lives at 4-12-6 Meguro, Meguro-ku, Tokyo, postal code 153-0063, and her residential phone number is 03-6666-7777.","<masked human name>, who was born on <masked birth date>, is currently working at <masked company name>, headquartered at <masked address>, <masked postal code>. Her office contact email is <masked email address>, and her mobile phone number is <masked phone number>. She lives at <masked address>, <masked postal code>, and her residential phone number is <masked phone number>."
"Yamamoto Kenji, who resides at 5-10-15 Shinjuku, Shinjuku-ku, Tokyo 160-0022, was thrilled to start his new position at Sakura Systems Corporation today, whose headquarters are situated at 2-4-2 Marunouchi, Chiyoda-ku, Tokyo, and he sent a celebratory email to his colleagues from his personal address yamamoto.kenji@example.com, sharing the good news about his career move and providing his updated contact number 08012345678 to ensure smooth communication, emphasizing that his date of birth, March 15, 1992, has always been a lucky charm for him, and marking this milestone with a sense of gratitude and hope for a prosperous future at his new workplace.","<masked human name>, who resides at <masked address>, was thrilled to start his new position at <masked company name> today, whose headquarters are situated at <masked address>, and he sent a celebratory email to his colleagues from his personal address <masked email address>, sharing the good news about his career move and providing his updated contact number <masked phone number> to ensure smooth communication, emphasizing that his date of birth, <masked birth date>, has always been a lucky charm for him, and marking this milestone with a sense of gratitude and hope for a prosperous future at his new workplace."
"Sasaki Ren works for Sunrise Electronics Inc., which is located at 10-5 Minamiazabu, Minato-ku, Tokyo. His email address is ren.sasaki@example.com, and his phone number is 090-1234-5678. Additionally, Ren Sasaki was born on January 30, 1990, and his current postal code is 106-0047.","<masked human name> works for <masked company name>, which is located at <masked address>. His email address is <masked email address>, and his phone number is <masked phone number>. Additionally, <masked human name> was born on <masked birth date>, and his current postal code is <masked postal code>."
"The headquarters of Sakura Electronics Inc., where Matsumoto Takashi is employed as a senior engineer, is located at 3-15-14 Shinjuku, Shinjuku-ku, Tokyo, 160-0022, Japan, and his office phone number is +81-3-4567-8901. Additionally, Matsumoto Takashi's personal email address is takashi.matsumoto@example.com, and he was born on March 5, 1987.","<masked company name>, where <masked human name> is employed as a senior engineer, is located at <masked address>, <masked postal code>, Japan, and his office phone number is <masked phone number>. Additionally, <masked human name>'s personal email address is <masked email address>, and he was born on <masked birth date>."
"Yamamoto Haruki, who works for Sakura Electronics Ltd., often visits their branch located in 1-12-10 Minato-ku, Tokyo, and sends emails to his colleagues using his company email address haruki.yamamoto@sakura-elec.jp. His phone number is 03-1234-5678, and his birthday is February 15, 1985, which he usually celebrates at his favorite French restaurant in Ginza with his close friends and family members, making it a cherished annual tradition.","<masked human name>, who works for <masked company name>, often visits their branch located at <masked address>, and sends emails to his colleagues using his company email address <masked email address>. His phone number is <masked phone number>, and his birthday is <masked birth date>, which he usually celebrates at his favorite French restaurant in Ginza with his close friends and family members, making it a cherished annual tradition."
"Nakamura Ichika, who works at Tokyo Business Solutions Co. Ltd., resides at 3-2-5 Ebisu, Shibuya-ku, Tokyo, with a postal code of 1500013, and her contact number is 08012345678. Ichika's email address is ichika.nakamura@example.com, and her birthdate is May 16, 1990. She recently attended a meeting at the company's head office located at Marunouchi Building, Chiyoda-ku, Tokyo.","<masked human name>, who works at <masked company name>, resides at <masked address>, with a postal code of <masked postal code>, and her contact number is <masked phone number>. Ichika's email address is <masked email address>, and her birthdate is <masked birth date>. She recently attended a meeting at the company's head office located at <masked address>."
"Suzuki Ichiro, who resides in Tokyo at 15-3 Azabu Juban Minato-ku, reached out to ABC Consulting Co. Ltd. to discuss a potential partnership involving cutting-edge AI technologies, his email address ichiro.suzuki@example.com and phone number 08012345678 were shared with the representatives, and his birthday is September 3, 1985.","<masked human name>, who resides in <masked address>, reached out to <masked company name> to discuss a potential partnership involving cutting-edge AI technologies, his email address <masked email address> and phone number <masked phone number> were shared with the representatives, and his birthday is <masked birth date>."
"Nishimura Kyoko, who works at Fujitsu Ltd. and lives at 5-17-1 Ichigaya, Shinjuku-ku, Tokyo, often communicates with her teammates via email sent from kyoko.nishimura@example.com. Her office phone number, 090-1234-5678, and postal code 1620815 are frequently provided in organizational directories for better accessibility, and her date of birth, January 23, 1987, is occasionally referenced in staff profiles during company events or administrative procedures.","<masked human name>, who works at <masked company name> and lives at <masked address>, often communicates with her teammates via email sent from <masked email address>. Her office phone number, <masked phone number>, and postal code <masked postal code> are frequently provided in organizational directories for better accessibility, and her date of birth, <masked birth date>, is occasionally referenced in staff profiles during company events or administrative procedures."
"Matsumoto Rika, who works at Tokyo Electronics Inc., lives at 3-4-5 Minato-ku, Tokyo, Japan, and her postal code is 105-0011. She was born on June 15, 1990, and her personal phone number is 090-1234-5678. Her email address is rika.matsumoto@example.com, and she joined the company in 2015 after completing her master's degree. The company's headquarters is at a major building in Shibuya, Tokyo, and has been operating successfully for over two decades, employing thousands of employees and having global offices. Matsumoto Rika's role involves overseeing international projects, including collaborations with clients in North America and Europe.","<masked human name>, who works at <masked company name>, lives at <masked address>, and her postal code is <masked postal code>. She was born on <masked birth date>, and her personal phone number is <masked phone number>. Her email address is <masked email address>, and she joined the company in 2015 after completing her master's degree. The company's headquarters is at a major building in Shibuya, Tokyo, and has been operating successfully for over two decades, employing thousands of employees and having global offices. <masked human name>'s role involves overseeing international projects, including collaborations with clients in North America and Europe."
"Sakura Yamashita, who was born on November 15, 1985 in Osaka, Japan, is currently the CEO of Nippon Tech Solutions Inc., located at 2-3-5 Umeda, Kita-ku, Osaka City, with the postal code 547-0002 and the contact number 06-1234-5678, and her email address sakura.yamashita@nippontech.jp is actively used for professional correspondence as she manages various international clients and strategic projects for the company.","<masked human name>, who was born on <masked birth date> in Osaka, Japan, is currently the CEO of <masked company name>, located at <masked address>, with the postal code <masked postal code> and the contact number <masked phone number>, and her email address <masked email address> is actively used for professional correspondence as she manages various international clients and strategic projects for the company."
"Suzuki Ichika sent an official email from her address ichika.suzuki@example.com to inform the regional managers at FujiTech Corporation, headquartered at 5-12-3 Akasaka, Minato-ku, Tokyo, with a postal code of 107-0052, regarding the new hiring policy updates, and her contact number for further clarification is listed as 090-1234-5678; her date of birth, which is required for employment verification, is November 22, 1985.","<masked human name> sent an official email from her address <masked email address> to inform the regional managers at <masked company name>, headquartered at <masked address>, with a postal code of <masked postal code>, regarding the new hiring policy updates, and her contact number for further clarification is listed as <masked phone number>; her date of birth, which is required for employment verification, is <masked birth date>."
"Nakamura Shota recently started working at Sakura Heavy Industries Co., Ltd., which is located at 3-15-4 Roppongi, Minato-ku, Tokyo, with a postal code of 106-0032, and his office phone number for work-related inquiries is 03-4567-8910. His email address is shota.nakamura@sakura-hi.co.jp, and his date of birth is January 23, 1991.","<masked human name> recently started working at <masked company name>, which is located at <masked address>, with a postal code of <masked postal code>, and his office phone number for work-related inquiries is <masked phone number>. His email address is <masked email address>, and his date of birth is <masked birth date>."
"Keiko Yamada works at the headquarters of Toshiba Corporation, located at 1-1, Shibaura, Minato-ku, Tokyo, with the postal code 105-8001. Her contact email is keiko-yamada123@toshiba.co.jp, and her work phone number is 03-34567890. She was born on March 15, 1988, and resides at an address in Yokohama, Kanagawa, which is 2-12-5, Minamisaiwai, Nishi-ku, Yokohama, Kanagawa, 220-0005.","<masked human name> works at the headquarters of <masked company name>, located at <masked address>, with the postal code <masked postal code>. Her contact email is <masked email address>, and her work phone number is <masked phone number>. She was born on <masked birth date>, and resides at an address in <masked address>."
"The employee named Suzuki Ichirou, who works for Tokyo Advanced Research Institute located at 2-34-1 Akasaka, Minato-ku, Tokyo with the postal code 1070052, often uses the email ichirou.suzuki@example.com to communicate with international colleagues, and his direct contact number for work-related matters is 09012345678. Suzuki Ichirou's date of birth is December 25, 1985, making him a key contributor to the institute's AI development team.","The employee named <masked human name>, who works for <masked company name> located at <masked address> with the postal code <masked postal code>, often uses the email <masked email address> to communicate with international colleagues, and his direct contact number for work-related matters is <masked phone number>. Suzuki Ichirou's date of birth is <masked birth date>, making him a key contributor to the institute's AI development team."
"Yamada Hanako recently accepted a position as a senior designer at Tokyo Creative Agency, which is located at 2-5-12 Hiroo, Shibuya-ku, Tokyo, with postal code 150-0012, and her professional email address is hanako.yamada@email.jp, she lives in an apartment near Meguro Station and her phone number is 090-1234-5678, her birthday is February 20, 1988.","<masked human name> recently accepted a position as a senior designer at <masked company name>, which is located at <masked address>, <masked postal code>, and her professional email address is <masked email address>, she lives in an apartment near Meguro Station and her phone number is <masked phone number>, her birthday is <masked birth date>."
"Nakamura Kyoko, who resides at 3-18-10 Minami-Aoyama, Minato-ku, Tokyo, with a postal code of 107-0062 and works as a software engineer at Nippon Tech Corporation, can be reached at her personal phone number 08012345678 or via email at kyoko.nakamura@example.com; in addition, her date of birth is February 15, 1990.","<masked human name>, who resides at <masked address>, with a postal code of <masked postal code> and works as a software engineer at <masked company name>, can be reached at her personal phone number <masked phone number> or via email at <masked email address>; in addition, her date of birth is <masked birth date>."
"Sato Yuki works as a software engineer for Nippon Tech Co. Ltd, located at 3-18-6 Roppongi, Minato-ku, Tokyo. His office phone number is 0456789012, and he resides at 5-12-15 Akasaka, Minato-ku, Tokyo with the postal code 1070052. His personal email address is yuki.sato@example.com, and he was born on July 23, 1992.","<masked human name> works as a software engineer for <masked company name>, located at <masked address>. His office phone number is <masked phone number>, and he resides at <masked address> with the postal code <masked postal code>. His personal email address is <masked email address>, and he was born on <masked birth date>."
"Nakamura Hiroshi, a marketing director at Sunrise Co., which is located in the Yokohama Landmark Tower, 2-2-1 Minatomirai, Nishi-ku, Yokohama, Kanagawa Prefecture, with postal code 2208172, often communicates via his business email address hiroshi.nakamura@sunrise.co.jp, and his direct office line is 0451234567. His birthplace is Kyoto, Japan, and he was born on January 23, 1985.","<masked human name>, a marketing director at <masked company name>, which is located in <masked address>, <masked postal code>, often communicates via his business email address <masked email address>, and his direct office line is <masked phone number>. His birthplace is Kyoto, Japan, and he was born on <masked birth date>."
"Yamamoto Haruki, who works as a senior designer at Kyoto Innovation Studio, located at 23-5 Nishikyo-ku, Kyoto-shi, Kyoto Prefecture, Japan, with the postal code 602-8143, received an email at yamamoto.haruki@gmail.com from a new client discussing a collaborative project potential; furthermore, his professional phone number, 090-1234-5678, was shared in the same correspondence for direct updates, and Haruki's date of birth, January 15, 1990, was requested for identity verification purposes in one of the attached application forms.","<masked human name>, who works as a senior designer at <masked company name>, located at <masked address>, with the postal code <masked postal code>, received an email at <masked email address> from a new client discussing a collaborative project potential; furthermore, his professional phone number, <masked phone number>, was shared in the same correspondence for direct updates, and Haruki's date of birth, <masked birth date>, was requested for identity verification purposes in one of the attached application forms."
"Yamamoto Hiroshi, who works at Nippon Electronics Inc., lives at 3-4-5 Sakura Street, Minato-ku, Tokyo, with the postal code 1060043, and his contact email is yamamoto.hiroshi@example.com. He was born on October 25, 1985, and his mobile phone number is 08012345678. Yesterday, he visited his company's regional headquarters to discuss an upcoming project launch and had a meeting with CEO Takeda Haruko regarding the new product strategy, which will be implemented starting next month, during which they finalized their plans for deployment across multiple platforms while also taking into account the feedback from international clients.","<masked human name>, who works at <masked company name>, lives at <masked address>, with the postal code <masked postal code>, and his contact email is <masked email address>. He was born on <masked birth date>, and his mobile phone number is <masked phone number>. Yesterday, he visited his company's regional headquarters to discuss an upcoming project launch and had a meeting with CEO <masked human name> regarding the new product strategy, which will be implemented starting next month, during which they finalized their plans for deployment across multiple platforms while also taking into account the feedback from international clients."
"At TokyoTech Co., located at Shinagawa East One Tower, 2-16-1 Konan, Minato-ku, Tokyo, an employee named Yamaguchi Hiroshi, whose official email address is hiroshi.yamaguchi@tokyotech.co.jp and work phone number is 0312345678, celebrated his birthday, which falls on March 3, 1985, while updating his residential address to 3-2-1 Kitanaka, Yokohama, Kanagawa 220-0012.","<masked company name>, located at <masked address>, an employee named <masked human name>, whose official email address is <masked email address> and work phone number is <masked phone number>, celebrated his birthday, which falls on <masked birth date>, while updating his residential address to <masked address>."
"Sato Keiko, who was born on July 15, 1990, has recently moved to an apartment on 2-3-5 Aoyama, Minato-ku, Tokyo, with a postal code of 107-0062, and she works at a renowned company named Sunrise Technologies, where her email address for work is keiko.sato@sunrisetech.co.jp, and her personal phone number is 09012345678, which she has used for many years.","<masked human name>, who was born on <masked birth date>, has recently moved to an apartment on <masked address>, with a postal code of <masked postal code>, and she works at a renowned company named <masked company name>, where her email address for work is <masked email address>, and her personal phone number is <masked phone number>, which she has used for many years."
"Smith Eric, living at 123 Sunny Valley, Osaka, works at GlobalTech Solutions Ltd as a software engineer; his contact email is eric.smith@example.com, and his mobile number is 09012345678. He was born on February 14, 1985, and GlobalTech's registered office is located at 56 Cloud Street, Kyoto, with the postal code being 6028555.","<masked human name>, living at <masked address>, works at <masked company name> as a software engineer; his contact email is <masked email address>, and his mobile number is <masked phone number>. He was born on <masked birth date>, and <masked company name>'s registered office is located at <masked address>, with the postal code being <masked postal code>."
"Hanako Yamada, currently working as a project manager at Nippon Electronics Co., resides at Whispering Pines Avenue, 14-7 Minato-ku, Tokyo, Japan, with a postal code of 1080011, and her personal contact number is 090-1234-5678. You can reach her via email at hanako.yamada@example.com, and she was born on February 15, 1986.","<masked human name>, currently working as a project manager at <masked company name>, resides at <masked address>, <masked postal code>, and her personal contact number is <masked phone number>. You can reach her via email at <masked email address>, and she was born on <masked birth date>."
"On March 15, 2023, Yamamoto Kei, a software engineer working at Fujitsu Limited and residing in 3-2-5 Marunouchi, Chiyoda-ku, Tokyo, registered his email address yamamoto.kei@example.com and provided his contact number 09012345678 for project purposes, while his actual home address was kept confidential, though his date of birth, which is August 9, 1987, was documented for verification purposes.","On March 15, 2023, <masked human name>, a software engineer working at <masked company name> and residing in <masked address>, registered his email address <masked email address> and provided his contact number <masked phone number> for project purposes, while his actual home address was kept confidential, though his date of birth, which is <masked birth date>, was documented for verification purposes."
"Yamamoto Hiroshi recently moved to 1-2-3 Roppongi, Minato-ku, Tokyo, Japan, which has the postal code 1060032, and he now works at Sakura Solutions Inc., where his direct line is 09012345678 and his email is yamamoto.hiroshi@example.com. Yamamoto Hiroshi's birthday is January 15, 1985, and he graduated from Tokyo University with a degree in Computer Science in 2007. He is currently managing a project with a deadline on December 31, 2023, where collaboration with clients, such as from Hokkaido and Osaka branches, plays a vital role in achieving success, requiring frequent communications and coordination via phone and email.","<masked human name> recently moved to <masked address>, which has the postal code <masked postal code>, and he now works at <masked company name>, where his direct line is <masked phone number> and his email is <masked email address>. <masked human name>'s birthday is <masked birth date>, and he graduated from <masked company name> with a degree in Computer Science in 2007. He is currently managing a project with a deadline on December 31, 2023, where collaboration with clients, such as from Hokkaido and Osaka branches, plays a vital role in achieving success, requiring frequent communications and coordination via phone and email."
"The head of marketing at Sunrise Electronics, Matsumoto Kenta, has a meeting scheduled at their office located at 3-15-22, Minamiazabu, Minato-ku, Tokyo, 106-0047 next Tuesday, and his assistant has already sent an email regarding the agenda to kenta.matsumoto@sunrise.co.jp, while Kenta himself will be reachable at his direct line, which is +81-3-1234-5678 should there be any last-minute changes to the plan; Matsumoto Kenta, born on May 7, 1985, has also confirmed his attendance at the company's annual retreat happening later this month.","The head of marketing at <masked company name>, <masked human name>, has a meeting scheduled at their office located at <masked address> next Tuesday, and his assistant has already sent an email regarding the agenda to <masked email address>, while <masked human name> himself will be reachable at his direct line, which is <masked phone number> should there be any last-minute changes to the plan; <masked human name>, born on <masked birth date>, has also confirmed his attendance at the company's annual retreat happening later this month."
"Mr. Sato Hiroshi, who works as a software engineer at Nippon Tech Solutions, resides at 2-3-5 Shinjuku, Shinjuku-ku, Tokyo, his email address is hiroshi.sato@example.com, his work phone number is 03-1234-5678, and his postal code is 123-4567; his birthday, which falls on November 15, 1985, is a date often celebrated with friends and family.","<masked human name>, who works as a software engineer at <masked company name>, resides at <masked address>, his email address is <masked email address>, his work phone number is <masked phone number>, and his postal code is <masked postal code>; his birthday, which falls on <masked birth date>, is a date often celebrated with friends and family."
"Suzuki Ichirou recently moved into a new home located at 5-16-3 Meguro-ku, Tokyo, his contact number is 090-1234-5678, and his email address is suzuki.ichirou@example.com. His employer, Nihon Tech Solutions Co., Ltd., is situated at 3-1-1 Shinjuku, Tokyo, with a postal code of 1600022. Ichirou's date of birth is December 25, 1985, and he enjoys working on innovative tech projects during his leisure time.","<masked human name> recently moved into a new home located at <masked address>, his contact number is <masked phone number>, and his email address is <masked email address>. His employer, <masked company name>, is situated at <masked address>, with a postal code of <masked postal code>. <masked human name>'s date of birth is <masked birth date>, and he enjoys working on innovative tech projects during his leisure time."
"The headquarters of Tokyo Innovations Inc. is located at 3-4-5 Ginza, Chuo-ku, Tokyo, Japan, with a postal code of 1040061, and the CEO, Kobayashi Kenji, is reachable at kenji.kobayashi@example.com or via his office phone at 0356781234. His date of birth is December 7, 1980, and he often visits satellite offices in Shibuya for weekly meetings with project managers and team leads.","<masked company name> is located at <masked address>, <masked postal code>, and the CEO, <masked human name>, is reachable at <masked email address> or via his office phone at <masked phone number>. His date of birth is <masked birth date>, and he often visits satellite offices in <masked address> for weekly meetings with project managers and team leads."
