before_mask,after_mask
"Honda Kenichi, who works for Global Tech Solutions Inc., resides at 3-2-5 Minami-Aoyama, Minato-ku, Tokyo, and his ZIP code is 1234567. He graduated from Kyoto University in 2010 and his email address is kenichi.honda@mail.com. Honda Kenichi's mobile phone number is +81-90-1234-5678, and his date of birth is February 14, 1985.","<masked human name>, who works for <masked company name>, resides at <masked address>, and his ZIP code is <masked postal code>. He graduated from Kyoto University in 2010 and his email address is <masked email address>. <masked human name>'s mobile phone number is <masked phone number>, and his date of birth is <masked birth date>."
"On a sunny day in Tokyo, Yamamoto Akiko, who works at GreenTech Innovations Ltd. located at 2-14-2 Akasaka, Minato-ku, Tokyo, with the postal code 1070052, decided to email her old friend using the address yamamoto.akiko@example.com to inform them of her upcoming birthday, which is June 18, 1990, while her contact number, 09012345678, remained the same and she also shared her new residential address at 5-3-7 Roppongi, Minato-ku, Tokyo, along with her company’s recent change of office location to Shinjuku Green Building, 3-5-1 Shinjuku, Shinjuku-ku, Tokyo.","On a sunny day in Tokyo, <masked human name>, who works at <masked company name> located at <masked address>, with the postal code <masked postal code>, decided to email her old friend using the address <masked email address> to inform them of her upcoming birthday, which is <masked birth date>, while her contact number, <masked phone number>, remained the same and she also shared her new residential address at <masked address>, along with her company’s recent change of office location to <masked address>."
"Suzuki Ichirou, who works as a software developer at FutureTech Innovations Inc., is currently residing at 3-5-12 Minami-Senju, Arakawa-ku, Tokyo, Japan, with the postal code 116-0013, and his email address is ichirou.suzuki@futuretech.com. His official contact number at the office is 03-6290-1234, and he was born on December 5, 1988.","<masked human name>, who works as a software developer at <masked company name>, is currently residing at <masked address>, <masked postal code>, and his email address is <masked email address>. His official contact number at the office is <masked phone number>, and he was born on <masked birth date>."
"Suzuki Ichirou secured his new job at Kyoto Pharmaceuticals Inc., located at 45-6 Higashiyama-cho, Sakyo-ku, Kyoto-shi, Kyoto, with the postal code 606-8424, and he was assigned work email suzuki.ichirou@kyoto-pharma.jp along with the phone number 075-123-4567; Ichirou's birthdate is February 2, 1985, as he indicated during the interview process.","<masked human name> secured his new job at <masked company name>, located at <masked address>, with the postal code <masked postal code>, and he was assigned work email <masked email address> along with the phone number <masked phone number>; <masked human name>'s birthdate is <masked birth date>, as he indicated during the interview process."
"Nakamura Ichiko sent an email to her colleague at ABC Trading Co. Ltd., which is located at 1234 Sakura Street, Minato-ku, Tokyo, zip code 105-0011, requesting an update on the ongoing client negotiations scheduled for March 25, 2023, and she provided her personal phone number, 090-1234-5678, for urgent communication, along with her email address, ichiko.nakamura@example.com, for follow-up details, and mentioned that her birthday is on September 15, 1985.","<masked human name> sent an email to her colleague at <masked company name>, which is located at <masked address>, <masked postal code>, requesting an update on the ongoing client negotiations scheduled for March 25, 2023, and she provided her personal phone number, <masked phone number>, for urgent communication, along with her email address, <masked email address>, for follow-up details, and mentioned that her birthday is on <masked birth date>."
"Sato Hiroshi sent an email to his colleague expressing his gratitude for the support received during the project completion, and in the email, he mentioned that he works for Creative Solutions Inc., which is located at 3-5-7 Shibuya, Shibuya-ku, Tokyo, ZIP code 150-0002, and he provided his contact information, including his work email sato.hiroshi@example.com and his direct phone number 03-1234-5678, to ensure smooth communication for future collaborations; furthermore, in the same message, he referenced his date of birth, 1978-12-16, as part of a lighthearted conversation about the generational differences within their team.","<masked human name> sent an email to his colleague expressing his gratitude for the support received during the project completion, and in the email, he mentioned that he works for <masked company name>, which is located at <masked address>, ZIP code <masked postal code>, and he provided his contact information, including his work email <masked email address> and his direct phone number <masked phone number>, to ensure smooth communication for future collaborations; furthermore, in the same message, he referenced his date of birth, <masked birth date>, as part of a lighthearted conversation about the generational differences within their team."
"Sato Kenji received an email from his colleague Takahashi Aiko about the upcoming project meeting scheduled at Hiroshi Corporation, located at 3-5-7 Roppongi, Minato-ku, Tokyo, Japan, 106-0032, on October 15th, 2023, and she confirmed her availability using the email address aiko.takahashi@examplemail.jp, while Kenji was thinking about contacting her about the meeting through his office phone number, which is 03-1234-5678, or his mobile phone number, 080-9876-5432, since he needed to clarify the project's objectives; furthermore, Sato Kenji's birthday is June 25, 1985, and he works on project management at the company where his email address is kenji.sato@hiroshicorp.co.jp.","<masked human name> received an email from his colleague <masked human name> about the upcoming project meeting scheduled at <masked company name>, located at <masked address>, <masked postal code>, on <masked birth date>, and she confirmed her availability using the email address <masked email address>, while <masked human name> was thinking about contacting her about the meeting through his office phone number, which is <masked phone number>, or his mobile phone number, <masked phone number>, since he needed to clarify the project's objectives; furthermore, <masked human name>'s birthday is <masked birth date>, and he works on project management at the company where his email address is <masked email address>."
"Yamada Hanako recently joined Fukuoka Tech Inc. located at 4-2-33 Hakataekimae, Fukuoka City, Fukuoka, Japan, with a postal code of 8120011, and her personal email address hanako.yamada@example.jp is actively used for communication, while her contact number is 09012345678. Additionally, she was born on January 15, 1985 and is currently working on innovative AI-driven projects for the company.","<masked human name> recently joined <masked company name> located at <masked address>, <masked postal code>, and her personal email address <masked email address> is actively used for communication, while her contact number is <masked phone number>. Additionally, she was born on <masked birth date> and is currently working on innovative AI-driven projects for the company."
"Yamamoto Satoshi, who works at Yokohama Tech Solutions Inc., resides at 204-708 Minato Mirai, Nishi-ku, Yokohama, Kanagawa, with the postal code 2200012, his email address is satoshi.yamamoto@example.com, and his mobile phone number is 08012345678. Yamamoto Satoshi was born on January 19, 1987, and frequently commutes from his home to the office using the Minato Mirai Line.","<masked human name>, who works at <masked company name>, resides at <masked address>, with the postal code <masked postal code>, his email address is <masked email address>, and his mobile phone number is <masked phone number>. <masked human name> was born on <masked birth date>, and frequently commutes from his home to the office using the Minato Mirai Line."
"Yamada Kenichi, who works for Softbank Corporation located at 1-9-1 Higashi-Shimbashi, Minato-ku, Tokyo with a postal code of 1057303 and phone number 0350000000, has an email address kenichi.yamada@example.com and celebrates his birthday on February 28, 1985.","<masked human name>, who works for <masked company name> located at <masked address> with a postal code of <masked postal code> and phone number <masked phone number>, has an email address <masked email address> and celebrates his birthday on <masked birth date>."
"Yamamoto Hiroshi sent an email to his client from the address yamamoto.hiroshi@example.com, which belongs to Yamamoto Consulting Co. Ltd., situated at 3-15-8 Shibuya, Shibuya-ku, Tokyo, and he provided his personal phone number, 09012345678, alongside his company's postal code, 1500002, during their online meeting on June 15, 2023.","<masked human name> sent an email to his client from the address <masked email address>, which belongs to <masked company name>, situated at <masked address>, and he provided his personal phone number, <masked phone number>, alongside his company's postal code, <masked postal code>, during their online meeting on <masked birth date>."
"Yamada Hanako, who works for Nippon Creative Solutions Inc., resides at 3-20-5 Aoyama, Minato-ku, Tokyo, with the postal code 1070061, and her contact email hanako.yamada@example.com is often used for work-related correspondence. Her personal mobile number, 09012345678, is reserved for close friends and family only. Hanako's date of birth, August 15th, 1985, often surprises people given her youthful appearance, and she celebrates her birthday with colleagues at the office every year, usually organizing an informal dinner party at notable Tokyo restaurants. She recently gave a presentation about innovative problem-solving strategies for clients, showcasing her capabilities and cementing her reputation as a reliable team lead. Additionally, Hanako frequently travels for business to Osaka and Nagoya, making reservations for accommodation in advance and often receives mail addressed to her office in Tokyo, which lists Nippon Creative Solutions Inc. as the sender's organization.","<masked human name>, who works for <masked company name>, resides at <masked address>, with the postal code <masked postal code>, and her contact email <masked email address> is often used for work-related correspondence. Her personal mobile number, <masked phone number>, is reserved for close friends and family only. Hanako's date of birth, <masked birth date>, often surprises people given her youthful appearance, and she celebrates her birthday with colleagues at the office every year, usually organizing an informal dinner party at notable Tokyo restaurants. She recently gave a presentation about innovative problem-solving strategies for clients, showcasing her capabilities and cementing her reputation as a reliable team lead. Additionally, Hanako frequently travels for business to Osaka and Nagoya, making reservations for accommodation in advance and often receives mail addressed to her office in Tokyo, which lists <masked company name> as the sender's organization."
"Suzuki Ichirou, who resides in Nagoya at 3-2-1 Nakamura-cho, works for the well-known company Hitachi Ltd., and his email address is ichirou.suzuki@example.com; also, his mobile number is 09012345678, while his date of birth is March 5, 1985, and he often commutes between Osaka and Tokyo for business meetings, particularly to handle international negotiations that require his specialized expertise in engineering and technology management, which makes him a key figure in the company's global expansion strategy.","<masked human name>, who resides in <masked address>, works for the well-known company <masked company name>, and his email address is <masked email address>; also, his mobile number is <masked phone number>, while his date of birth is <masked birth date>, and he often commutes between Osaka and Tokyo for business meetings, particularly to handle international negotiations that require his specialized expertise in engineering and technology management, which makes him a key figure in the company's global expansion strategy."
"Nakamura Ayaka recently moved to a new apartment located at 3-12-5 Minato-ku, Tokyo, with a postal code of 1050013, and her email address ayaka.nakamura@example.com was updated to reflect her new location; she works at Fujitsu Limited, and her office contact number is 09012345678. Additionally, her date of birth is July 15, 1990, which she often uses to verify her identity during official procedures.","<masked human name> recently moved to a new apartment located at <masked address>, with a postal code of <masked postal code>, and her email address <masked email address> was updated to reflect her new location; she works at <masked company name>, and her office contact number is <masked phone number>. Additionally, her date of birth is <masked birth date>, which she often uses to verify her identity during official procedures."
"Suzuki Ichiro, who works at Kintetsu Corporation and lives in Osaka, Japan, at 3-4-5 Namba, holds the position of Senior Manager, and his professional email address is ichiro.suzuki@example.com, while his personal phone number is 090-1234-5678; he was born on June 15, 1985, and his company's headquarters is located at 1-2-3 Umeda, Kita-ku, Osaka, with the postal code being 530-0001.","<masked human name>, who works at <masked company name> and lives in <masked address>, holds the position of Senior Manager, and his professional email address is <masked email address>, while his personal phone number is <masked phone number>; he was born on <masked birth date>, and his company's headquarters is located at <masked address>, with the postal code being <masked postal code>."
"Mr. Nakamura Hiroshi, who works at Kyushu Electric Power Company transitioned to their Kumamoto office located at 2-4-5 Tokuhisa, Chuo-ku, Kumamoto City, Kumamoto Prefecture, Japan with a postal code of 8601234, and his personal email address hiroshi.nakamura@example.jp has been updated alongside his phone number 09012345678 to reflect his new assignment starting from August 23, 1980 which also coincides with his birthday celebration.","<masked human name>, who works at <masked company name> transitioned to their Kumamoto office located at <masked address>, <masked postal code>, and his personal email address <masked email address> has been updated alongside his phone number <masked phone number> to reflect his new assignment starting from <masked birth date> which also coincides with his birthday celebration."
"Suzuki Kotaro, who works at Nippon Electronics Corporation located at 2-3-10 Shinjuku, Shinjuku-ku, Tokyo, with a postal code of 1600022, received an email from his manager at kotaro.suzuki@nipponelectronics.co.jp on his registered date of birth, which is June 10, 1985, and confirmed via his mobile phone number 09012345678 that the upcoming conference would take place at KDX Toranomon Building, Minato-ku, Tokyo next month.","<masked human name>, who works at <masked company name> located at <masked address>, with a postal code of <masked postal code>, received an email from his manager at <masked email address> on his registered date of birth, which is <masked birth date>, and confirmed via his mobile phone number <masked phone number> that the upcoming conference would take place at <masked address> next month."
"Fuji Electronics Corporation, located at 3-5-8 Shinjuku, Shinjuku-ku, Tokyo, 160-0022, is where Yamamoto Akiko works, and her email address for professional communication is akiko.yamamoto@fuji-elec.jp, while her personal phone number is 08012345678; Yamamoto Akiko, born on February 25, 1987, often travels to Osaka for business meetings and stays at Hotel Gracery, which is her preferred accommodation in the area.","<masked company name>, located at <masked address>, <masked postal code>, is where <masked human name> works, and her email address for professional communication is <masked email address>, while her personal phone number is <masked phone number>; <masked human name>, born on <masked birth date>, often travels to Osaka for business meetings and stays at <masked company name>, which is her preferred accommodation in the area."
"Yamada Kenta sent an email to his colleagues at KyokuTech Solutions from his personal email address yamada.kenta@mailexample.com while he was traveling near the address 5-12-3 Ginza, Chuo-ku, Tokyo, and his phone number for arranging meetings is 08012345678; his birthday is March 18, 1987, and he will be attending the annual conference at Osaka Convention Center organized by KyokuTech Solutions next week.","<masked human name> sent an email to his colleagues at <masked company name> from his personal email address <masked email address> while he was traveling near the address <masked address>, and his phone number for arranging meetings is <masked phone number>; his birthday is <masked birth date>, and he will be attending the annual conference at <masked address> organized by <masked company name> next week."
"Suzuki Ichika, who works at the well-known IT company Technowave Solutions, resides at 5-2-1 Minami Azabu, Minato-ku, Tokyo, with a postal code of 1060047. Her email address is ichika.suzuki@example.com, and you can reach her by phone at 09012345678. Ichika's date of birth is February 14, 1990, which makes her a Pisces by zodiac sign and a technology enthusiast known for her contributions to cybersecurity innovations.","<masked human name>, who works at <masked company name>, resides at <masked address>, with a postal code of <masked postal code>. Her email address is <masked email address>, and you can reach her by phone at <masked phone number>. Ichika's date of birth is <masked birth date>, which makes her a Pisces by zodiac sign and a technology enthusiast known for her contributions to cybersecurity innovations."
"Yamada Hiroshi recently moved to a new apartment located at 3-15-6 Shinjuku, Shinjuku-ku, Tokyo, Japan, with a postal code of 1600022. He registered his new email address, yamadahiroshi@gmail.com, and updated his work contact information with his company, Sunrise Technologies Inc., which includes his department's direct line, 0356781234. His date of birth is February 2, 1985, and he frequently shares his insights with his colleagues using the online intranet system provided by his company.","<masked human name> recently moved to a new apartment located at <masked address>, <masked postal code>. He registered his new email address, <masked email address>, and updated his work contact information with his company, <masked company name>, which includes his department's direct line, <masked phone number>. His date of birth is <masked birth date>, and he frequently shares his insights with his colleagues using the online intranet system provided by his company."
"Suzuki Ichirou, who works at Nippon Tech Solutions Co., Ltd., is currently residing at the following address: 3-5-7 Minato-machi, Atsugi-shi, Kanagawa Prefecture, 243-0018, Japan, and his contact email address is ichirou.suzuki@nippontech.com. Additionally, his landline number associated with his residence is 046-228-1234, and he celebrates his birthday every year on September 16th, having been born in the year 1985.","<masked human name>, who works at <masked company name>, is currently residing at the following address: <masked address>, <masked postal code>, Japan, and his contact email address is <masked email address>. Additionally, his landline number associated with his residence is <masked phone number>, and he celebrates his birthday every year on <masked birth date>."
"The meeting organized by Nippon Tech Solutions at their headquarters, located at 3-5 Minatocho, Nakamura-ku, Nagoya, with a postal code of 4600023, was attended by Yamada Hanako, whose email address is hanako.yamada@example.com and whose contact number is 080-1234-5678. Yamada Hanako celebrates her birthday on March 3, 1990.","The meeting organized by <masked company name> at their headquarters, located at <masked address>, with a postal code of <masked postal code>, was attended by <masked human name>, whose email address is <masked email address> and whose contact number is <masked phone number>. <masked human name> celebrates her birthday on <masked birth date>."
"Nakamura Shouichi works at Tokyo Global Holdings, located at 5-3-2 Akasaka, Minato-ku, Tokyo, Japan, with the postal code 1070052. His email address is shoichi.nakamura@example.com, and his office phone number is 03-1234-5678. Additionally, Shouichi was born on October 15, 1990, and currently resides at 12-4-10 Sendagi, Bunkyo-ku, Tokyo.","<masked human name> works at <masked company name>, located at <masked address>, <masked postal code>. His email address is <masked email address>, and his office phone number is <masked phone number>. Additionally, <masked human name> was born on <masked birth date>, and currently resides at <masked address>."
"Nakamura Shiori recently relocated to a new apartment at 3-chome, Minami-aoyama, Minato-ku, Tokyo, Japan, 107-0062, and has updated her mailing address with her employer, Toyota Motor Corporation, where she works as a project manager, and her contact email is shiori.nakamura@example.com, while her personal phone number remains unchanged at 080-1234-5678, and her birthdate, being June 15, 1990, is also recorded in the company's internal employee database.","<masked human name> recently relocated to a new apartment at <masked address>, <masked postal code>, and has updated her mailing address with her employer, <masked company name>, where she works as a project manager, and her contact email is <masked email address>, while her personal phone number remains unchanged at <masked phone number>, and her birthdate, being <masked birth date>, is also recorded in the company's internal employee database."
"Yamada Hanako, who works at Kyoto Electronics and Communications Co., shared her company's newly launched product details via email on hanako.yamada@kyotoelectronics.co.jp while providing additional contact information, including her phone number 08012345678 and the company address at 5 Higashiyama Ward, Kyoto, Japan, 605-8510. Moreover, her team celebrated her birthday on June 15, 1985, during a recent team-building event held at the company's headquarters.","<masked human name>, who works at <masked company name>, shared her company's newly launched product details via email on <masked email address> while providing additional contact information, including her phone number <masked phone number> and the company address at <masked address>, <masked postal code>. Moreover, her team celebrated her birthday on <masked birth date> during a recent team-building event held at the company's headquarters."
"Suzuki Ichiro sent an email to his client using his work email address ichiro.suzuki@example.co.jp, confirming the delivery of goods to ABC Corporation, located at 1234 Sakura Street, Minato-ku, Tokyo, Japan, ZIP code 1050011, and he provided his personal phone number, 08012345678, for further communication; Suzuki Ichiro, born on March 15, 1985, explained that his delivery schedule would be adjusted due to unforeseen circumstances with his team at DEF International Ltd.","<masked human name> sent an email to his client using his work email address <masked email address>, confirming the delivery of goods to <masked company name>, located at <masked address>, <masked postal code>, and he provided his personal phone number, <masked phone number>, for further communication; <masked human name>, born on <masked birth date>, explained that his delivery schedule would be adjusted due to unforeseen circumstances with his team at <masked company name>."
"Yamada Kenta works at Kanto Electronics Co. Ltd. located at 5-12-3 Minato Mirai, Nishi Ward, Yokohama, Kanagawa, his office phone number is 0459876543, and he often uses his email address kentayamada@example.com to communicate with clients, where his residence postal code is 2200022, and his date of birth is February 14, 1985.","<masked human name> works at <masked company name> located at <masked address>, <masked phone number>, and he often uses his email address <masked email address> to communicate with clients, where his residence postal code is <masked postal code>, and his date of birth is <masked birth date>."
"Yamada Hanako sent an invitation to a formal corporate dinner hosted by Kyoto Tech Innovations located at 5 Kawaramachi-Dori, Shimogyo-ku, Kyoto, with a postal code of 600-8023, and the invitation was forwarded from her email hanako.yamada@example.com to her manager Shimizu Ichirou, whose birthday will be celebrated on March 14, 1985, and she also mentioned her work phone number, 0751234567, in case of any immediate queries regarding the event logistics.","<masked human name> sent an invitation to a formal corporate dinner hosted by <masked company name> located at <masked address>, with a postal code of <masked postal code>, and the invitation was forwarded from her email <masked email address> to her manager <masked human name>, whose birthday will be celebrated on <masked birth date>, and she also mentioned her work phone number, <masked phone number>, in case of any immediate queries regarding the event logistics."
