before_mask,after_mask
"Kobayashi Haruki recently moved to a new address at 12-3 Minami Azabu, Minato-ku, Tokyo 106-0047, which is not far from his workplace at Sakura Electronics Co. Ltd., and he usually reaches out to clients using his work email haruki.kobayashi@sakura-electronics.jp or his mobile number 08012345678. Kobayashi Haruki's date of birth is February 14, 1987.","<masked human name> recently moved to a new address at <masked address>, which is not far from his workplace at <masked company name>, and he usually reaches out to clients using his work email <masked email address> or his mobile number <masked phone number>. <masked human name>'s date of birth is <masked birth date>."
"Yamada Hanako, who works at Toshiba Corporation located at 1-1 Shibaura, Minato City, Tokyo, Japan, with postal code 105-8007, often communicates via her email hanako.yamada@example.com and can be reached at her mobile number 08012345678. Her date of birth is September 15, 1985, which she has shared for official documentation purposes.","<masked human name>, who works at <masked company name> located at <masked address>, with postal code <masked postal code>, often communicates via her email <masked email address> and can be reached at her mobile number <masked phone number>. Her date of birth is <masked birth date>, which she has shared for official documentation purposes."
"Yamada Hanako, who lives at 1234 Sakura Street, Minato-ku, Tokyo with the postal code 1051234, works for Nippon Electronics Corporation, and her contact email address is hanako.yamada@example.com, was born on July 15, 1985, and can be reached at her personal phone number 09012345678 during business hours.","<masked human name>, who lives at <masked address> with the postal code <masked postal code>, works for <masked company name>, and her contact email address is <masked email address>, was born on <masked birth date>, and can be reached at her personal phone number <masked phone number> during business hours."
"Hiroshi Yamamoto, who works at Tokyo Tech Solutions Inc., lives at 3-7-5 Minato-ku, Tokyo, Japan, and he regularly communicates through his email address yamamoto.hiroshi@example.com. His office phone number is +81-3-6789-5432, while his home phone is 03-7890-1234. Furthermore, his postal code is 105-0034, and he celebrates his birthday on January 23, 1985. He often visits the Tokyo branch located at 12-5-6 Chiyoda-ku on weekdays for client meetings and additional corporate activities.","<masked human name>, who works at <masked company name>, lives at <masked address>, and he regularly communicates through his email address <masked email address>. His office phone number is <masked phone number>, while his home phone is <masked phone number>. Furthermore, his postal code is <masked postal code>, and he celebrates his birthday on <masked birth date>. He often visits the Tokyo branch located at <masked address> on weekdays for client meetings and additional corporate activities."
"Suzuki Ichiro from Future Tech Innovations Inc. lives at 3-5-7 Minato-ku, Tokyo, Japan, postal code 1050013, and his contact email is ichiro.suzuki@futuretech.com. His date of birth is March 15, 1985, and his phone number is 08012345678. He is a senior software developer working on AI projects in collaboration with teams across global offices.","<masked human name> from <masked company name> lives at <masked address>, <masked postal code>, and his contact email is <masked email address>. His date of birth is <masked birth date>, and his phone number is <masked phone number>. He is a senior software developer working on AI projects in collaboration with teams across global offices."
"Takahashi Kenji, who works as a senior manager at Tokyo Electronics Corporation located at Shibuya Cross Tower, 35-6 Shibuya, Shibuya-ku, Tokyo, and whose office phone number is 0354329871, routinely communicates with international clients via his email address kenji.takahashi@tokyoelectronics.co.jp, while having his personal residence in Setagaya-ku, the postal code of which is 1540003; his date of birth is January 9, 1983.","<masked human name>, who works as a senior manager at <masked company name> located at <masked address>, and whose office phone number is <masked phone number>, routinely communicates with international clients via his email address <masked email address>, while having his personal residence in <masked address>, the postal code of which is <masked postal code>; his date of birth is <masked birth date>."
"As one of the key members of Nippon Technology Inc., an innovative IT company headquartered at 52-18 Shibuya, Shibuya-ku, Tokyo, postal code 1500002, Sato Hiroshi introduces cutting-edge solutions at international conferences, and his email address sato.hiroshi@example.com often serves as the primary contact point, while his date of birth on February 2, 1985 marks a legacy of excellence throughout his professional journey.","As one of the key members of <masked company name>, an innovative IT company headquartered at <masked address>, <masked postal code>, <masked human name> introduces cutting-edge solutions at international conferences, and his email address <masked email address> often serves as the primary contact point, while his date of birth on <masked birth date> marks a legacy of excellence throughout his professional journey."
"Yamamoto Kei worked at SoftBank Corp., which is located at Tokyo Shiodome Building, 1-9-1 Higashi-Shimbashi, Minato-ku, Tokyo, Japan, and is reachable via his email address yamamoto_ke7@example.com. His contact number is 0312345678, and his postal code for his home address is 105-0021. His birth date is July 3, 1985, which he always mentions during company gatherings.","<masked human name> worked at <masked company name>, which is located at <masked address>, and is reachable via his email address <masked email address>. His contact number is <masked phone number>, and his postal code for his home address is <masked postal code>. His birth date is <masked birth date>, which he always mentions during company gatherings."
"Yamamoto Keiko was born on March 15, 1985, and currently resides at 2-10-5 Shibuya, Shibuya-ku, Tokyo, Japan, postal code 150-0002. She works for Nippon Software Innovations Inc. and her company email is yamamotokeiko@nsi.co.jp. Her mobile number is 090-1234-5678, and she has been with the company for over 10 years, contributing to numerous international projects, including collaborations with teams in Europe and Asia to develop innovative software solutions, which have garnered accolades both domestically and globally.","<masked human name> was born on <masked birth date>, and currently resides at <masked address>, <masked postal code>. She works for <masked company name> and her company email is <masked email address>. Her mobile number is <masked phone number>, and she has been with the company for over 10 years, contributing to numerous international projects, including collaborations with teams in Europe and Asia to develop innovative software solutions, which have garnered accolades both domestically and globally."
"Mr. Harada Jiro, who resides at 3-5-7 Asakusa, Taito-ku, Tokyo, with the postal code 1110032, works at Sakura Tech Corporation, located in Shinagawa Ward, Tokyo, and can be reached via the email address harada.jiro@example.com or his mobile phone number 080-1234-5678; furthermore, he was born on February 20, 1985, and frequently visits his workplace at least five times a week.","<masked human name>, who resides at <masked address>, with the postal code <masked postal code>, works at <masked company name>, located in <masked address>, and can be reached via the email address <masked email address> or his mobile phone number <masked phone number>; furthermore, he was born on <masked birth date>, and frequently visits his workplace at least five times a week."
"Yamada Kenji recently started working at Mitsubishi Electric Corporation, whose headquarters are located at 2-3-3 Marunouchi, Chiyoda-ku, Tokyo, Japan, with the postal code 1000005. His contact email address is kenji.yamada@example.com, and his mobile phone number is 08011112222. He celebrates his birthday on March 15, 1992, and he currently resides at 15-6 Minami-Aoyama, Minato-ku, Tokyo, Japan.","<masked human name> recently started working at <masked company name>, whose headquarters are located at <masked address>, <masked postal code>. His contact email address is <masked email address>, and his mobile phone number is <masked phone number>. He celebrates his birthday on <masked birth date>, and he currently resides at <masked address>."
"Yamada Hanako, who resides at 3-2-1 Minami-Azabu, Minato City, Tokyo, 106-0047, has an email address hanako.yamada@example.com, and she works at Nissan Motor Corporation in Yokohama whose contact number is 045-123-4567; her birthday, celebrated on March 14th every year, falls on 1990, and she often uses her personal mobile number 090-8765-4321 for casual correspondence.","<masked human name>, who resides at <masked address>, <masked postal code>, has an email address <masked email address>, and she works at <masked company name> whose contact number is <masked phone number>; her birthday, celebrated on March 14th every year, falls on <masked birth date>, and she often uses her personal mobile number <masked phone number> for casual correspondence."
"Today, I received a friendly email from Kimura Akiyama, a team leader at TechForward Corporation, who was inviting me to attend their upcoming product launch at the company’s headquarters located at 5-10-3 Minamiazabu, Minato-ku, Tokyo, Japan, which is under the postal code 1060047; I later tried to contact her at her phone number 080-1234-5678, but due to the busy schedule, I left a voicemail requesting to meet her on her birthday, January 15, 2000, to celebrate at our usual cafe.","Today, I received a friendly email from <masked human name>, a team leader at <masked company name>, who was inviting me to attend their upcoming product launch at the company’s headquarters located at <masked address>, which is under the postal code <masked postal code>; I later tried to contact her at her phone number <masked phone number>, but due to the busy schedule, I left a voicemail requesting to meet her on her birthday, <masked birth date>, to celebrate at our usual cafe."
"Yamada Kenji, who works at FastTech Innovations Inc. located at 3-2-1 Shinjuku, Shinjuku-ku, Tokyo, Japan, 1600022, often communicates with clients through his email kenji.yamada@fasttech.co.jp and can be reached at his office phone number 03-1234-5678, his date of birth is February 27, 1985, and he recently attended a major tech conference representing his company.","<masked human name>, who works at <masked company name> located at <masked address>, <masked postal code>, often communicates with clients through his email <masked email address> and can be reached at his office phone number <masked phone number>, his date of birth is <masked birth date>, and he recently attended a major tech conference representing his company."
"Hiroshi Nakamura, who works at Tokyo Software Solutions located at 3-24-5 Shibuya, Shibuya-ku, Tokyo, postal code 5678912, and whose personal email address is hiroshi.nakamura@email.com, mentioned that his birthdate is July 15, 1986, during a conversation about his professional background and experience in the field of software engineering, and he also provided his office contact number, 03-7654-3210, for further business inquiries.","<masked human name>, who works at <masked company name> located at <masked address>, <masked postal code>, and whose personal email address is <masked email address>, mentioned that his birthdate is <masked birth date>, during a conversation about his professional background and experience in the field of software engineering, and he also provided his office contact number, <masked phone number>, for further business inquiries."
"On March 15, 2023, Yoshida Kenta attended a business meeting at the headquarters of Shinagawa Electronics Corporation located at 2-8-10 Higashi-Shinagawa, Shinagawa-ku, Tokyo 140-0002, where he shared his insights on industry trends, later sending follow-up emails from his personal address kenta.yoshida@mail.com while his cellphone number 080-1234-5678 was also shared with the attendees to ensure smooth communication throughout the week.","On March 15, 2023, <masked human name> attended a business meeting at the headquarters of <masked company name> located at <masked address>, where he shared his insights on industry trends, later sending follow-up emails from his personal address <masked email address> while his cellphone number <masked phone number> was also shared with the attendees to ensure smooth communication throughout the week."
"Mitsui Fudosan Co., located at 2-1-1 Nihonbashimuromachi, Chuo-ku, Tokyo, is where Takahashi Keiko works as a senior engineer. Her contact email is keiko.takahashi88@example.com, and her office phone number is 03-1234-5678. Takahashi Keiko resides at 5-12-3 Minami-aoyama, Minato-ku, Tokyo, with the postal code 107-0062, and her birthdate is September 12, 1990.","<masked company name>, located at <masked address>, is where <masked human name> works as a senior engineer. Her contact email is <masked email address>, and her office phone number is <masked phone number>. <masked human name> resides at <masked address>, with the postal code <masked postal code>, and her birthdate is <masked birth date>."
"Yamada Ayako, who works as a marketing manager at Toshiba Corporation, resides at 3-2-1 Senju, Adachi-ku, Tokyo, Japan, with the postal code 120-8501. Her contact details include an email address ayako.yamada@toshiba.co.jp and a personal phone number 090-1234-5678. She was born on March 15, 1985, and her work phone number is 03-3456-7890.","<masked human name>, who works as a marketing manager at <masked company name>, resides at <masked address>, <masked postal code>. Her contact details include an email address <masked email address> and a personal phone number <masked phone number>. She was born on <masked birth date>, and her work phone number is <masked phone number>."
"John Nakamura received a job offer from KDDI Corporation, which is located at 2-3-1 Nishi-Shinjuku, Shinjuku-ku, Tokyo, and his office extension phone number is 0332456789. His home address is 4-12-3 Minami-Aoyama, Minato-ku, Tokyo, and the postal code is 1070062. Additionally, his personal email address is john.nakamura79@example.com, and his birthday falls on December 5, 1985.","<masked human name> received a job offer from <masked company name>, which is located at <masked address>, and his office extension phone number is <masked phone number>. His home address is <masked address>, and the postal code is <masked postal code>. Additionally, his personal email address is <masked email address>, and his birthday falls on <masked birth date>."
"On March 15, 2023, Yamaguchi Kenta sent an email from his personal address yamaguchi.kenta@example.com to inquire about the availability of the product in the Tokyo branch office of Marubeni Corporation, located at 5-8 Nihonbashi 2-Chome, Chuo-ku, Tokyo, Japan, with the postal code being 1030027. He also mentioned his phone number, 09012345678, for further contact and requested a callback if the product was available before his birthday on June 2, 1990.","On March 15, 2023, <masked human name> sent an email from his personal address <masked email address> to inquire about the availability of the product in the Tokyo branch office of <masked company name>, located at <masked address>, with the postal code being <masked postal code>. He also mentioned his phone number, <masked phone number>, for further contact and requested a callback if the product was available before his birthday on <masked birth date>."
"Yamada Hanako was a valued employee at Sakura Tech Corporation located at 5-12-6 Shinjuku, Tokyo, with the postal code 1600022, her work email address was hanako.yamada@sakuratech.co.jp, and she could be reached directly on her mobile number 08012345678. Hanako Yamada was born on the delightful morning of March 3, 1985.","<masked human name> was a valued employee at <masked company name> located at <masked address>, <masked postal code>, her work email address was <masked email address>, and she could be reached directly on her mobile number <masked phone number>. <masked human name> was born on <masked birth date>."
"In the bustling district of Ginza, Tokyo, Yamamoto Keiko, who works as a project manager for Nippon Tech Solutions Ltd., can often be spotted handling emails at keiko.yamamoto@nippontech.co.jp, and she is reachable at the office via 0356781234. Her home address is 3-4-5 Ginza, Chuo-ku, Tokyo, postal code 1040061, where she has lived since celebrating her 32nd birthday on July 15, 1992.","In the bustling district of Ginza, Tokyo, <masked human name>, who works as a project manager for <masked company name>, can often be spotted handling emails at <masked email address>, and she is reachable at the office via <masked phone number>. Her home address is <masked address>, <masked postal code>, where she has lived since celebrating her 32nd birthday on <masked birth date>."
"Honda Ichiko registered for a yoga class at Sakura Wellness Studio located at 3-15-22 Shibuya, Tokyo, with her email address hondai@example.com, her contact number 090-2345-6789, and her postal code 150-0001, submitting her birthdate as June 21, 1987.","<masked human name> registered for a yoga class at <masked company name> located at <masked address>, with her email address <masked email address>, her contact number <masked phone number>, and her postal code <masked postal code>, submitting her birthdate as <masked birth date>."
"Mochizuki Kenta, born on January 25, 1989, has been working as a software engineer at SoftTech Solutions Co. Ltd., headquartered at 3-5-7 Minami Aoyama, Minato-ku, Tokyo, with a postal code of 107-0062, and can be reached via his business email kenta.mochizuki@example.com or his personal phone number 080-1234-5678.","<masked human name>, born on <masked birth date>, has been working as a software engineer at <masked company name>, headquartered at <masked address>, with a postal code of <masked postal code>, and can be reached via his business email <masked email address> or his personal phone number <masked phone number>."
"Mitsubishi Corporation is headquartered at 3-1 Marunouchi 2-chome, Chiyoda-ku, Tokyo, Japan, and the office manager there, Yamaguchi Haruto, receives work correspondence at yamaguchi.haruto@mitsubishicorp.co.jp. He was born on September 5, 1985, and his direct office number is 03-1234-5678, while his personal residence is located at 4-5-6 Roppongi, Minato-ku, Tokyo, with the postal code 123-4567.","<masked company name> is headquartered at <masked address>, and the office manager there, <masked human name>, receives work correspondence at <masked email address>. He was born on <masked birth date>, and his direct office number is <masked phone number>, while his personal residence is located at <masked address>, with the postal code <masked postal code>."
"Hiroshi Nakamura, a marketing executive at Global Connect Co., is currently based at 3rd Floor, Asakura Building, 2-16-5 Minami-Aoyama, Minato-ku, Tokyo, with the postal code 107-0062. His direct email for business inquiries is hiroshi.nakamura@gconnect.jp, and his mobile phone number is 090-1234-5678. Hiroshi was born on February 9, 1985.","<masked human name>, a marketing executive at <masked company name>, is currently based at <masked address>, with the postal code <masked postal code>. His direct email for business inquiries is <masked email address>, and his mobile phone number is <masked phone number>. Hiroshi was born on <masked birth date>."
"On May 6th, 1995, Kimura Ayako was born in the bustling city of Osaka, Japan, and she is currently employed at Horizon Tech Solutions as a senior software engineer, living at 3-2-1 Namba, Chuo-ku, Osaka, 556-0011 Japan, while her email address is ayako.kimura@horizontech.co.jp and her contact number is 06-1234-5678.","On <masked birth date>, <masked human name> was born in the bustling city of <masked address>, and she is currently employed at <masked company name> as a senior software engineer, living at <masked address>, while her email address is <masked email address> and her contact number is <masked phone number>."
"Hirose Kenta works as a software developer at Kyodai Tech Solutions Inc., which is headquartered in Apex Tower, 12-5 Shinjuku 1-chome, Shinjuku-ku, Tokyo, 1600022 under the zip code 1600022. His contact email is kenta.hirose@kyodai-tech.co.jp, and the office phone number is 03-1234-5678. Hirose Kenta's date of birth is February 29, 1992.","<masked human name> works as a software developer at <masked company name>, which is headquartered in <masked address>, <masked postal code> under the zip code <masked postal code>. His contact email is <masked email address>, and the office phone number is <masked phone number>. <masked human name>'s date of birth is <masked birth date>."
"The CEO of Kyowa Corporation, named Sato Keiji, resides at 3-24-10 Minato-ku, Tokyo with a postal code of 1120095 and can be reached via his personal email address keiji.sato@example.com or through his mobile number 09012345678. Additionally, his birth date is January 15, 1987, and he frequently receives correspondence sent to his business address at Kyowa's headquarters, located at 7-15-3 Shinjuku, Tokyo.","The CEO of <masked company name>, named <masked human name>, resides at <masked address> with a postal code of <masked postal code> and can be reached via his personal email address <masked email address> or through his mobile number <masked phone number>. Additionally, his birth date is <masked birth date>, and he frequently receives correspondence sent to his business address at <masked company name>'s headquarters, located at <masked address>."
"Last month, Suzuki Kenji signed a contract to work with Matsuki Corporation and relocated to their headquarters at 3-4-5 Akasaka, Minato-ku, Tokyo, which has the postal code 1060032, and he provided his email address, kenji.suzuki@example.com, alongside his direct contact number, 08012345678, while his date of birth, listed on the official documents, is January 15, 1985.","Last month, <masked human name> signed a contract to work with <masked company name> and relocated to their headquarters at <masked address>, which has the postal code <masked postal code>, and he provided his email address, <masked email address>, alongside his direct contact number, <masked phone number>, while his date of birth, listed on the official documents, is <masked birth date>."
"Nakamura Keiko sent an email to the HR department of Toyota Motor Corporation to inquire about her employment contract termination, and in the email, she provided her full residential address at 2-5-8 Minami-Azabu, Minato-ku, Tokyo, with the postal code 1060047, along with her contact phone number 08012345678, and her birth date, November 15, 1990, mentioning that she had initially joined the company on May 20, 2017.","<masked human name> sent an email to the HR department of <masked company name> to inquire about her employment contract termination, and in the email, she provided her full residential address at <masked address>, with the postal code <masked postal code>, along with her contact phone number <masked phone number>, and her birth date, <masked birth date>, mentioning that she had initially joined the company on May 20, 2017."
"Sato Haruki, who works at the prestigious firm Tokyo Tech Solutions Inc., resides at 4-10-8 Shinjuku, Shinjuku-ku, Tokyo, Japan, with a postal code of 1600022. His email address, harukisato@example.com, is often used for business correspondence, and his phone number, 09012345678, is listed on his contact card. Born on December 25, 1990, he graduated from Kyoto University with honors in engineering before joining the company.","<masked human name>, who works at <masked company name>, resides at <masked address>, <masked postal code>. His email address, <masked email address>, is often used for business correspondence, and his phone number, <masked phone number>, is listed on his contact card. Born on <masked birth date>, he graduated from Kyoto University with honors in engineering before joining the company."
"Honda Keisuke, a software engineer at Nippon Technologies Ltd., resides at 3-12-5 Minato Avenue, Minato-ku, Tokyo 105-0021, his personal email is keisuke.honda@ntechs.jp, and his mobile phone number is 080-1234-5678. He often commutes to work from his home, and his birth date is May 15, 1991, which makes him skilled and experienced for his current role, contributing significantly to the company's innovation and development projects while also coordinating with his colleague Yamada Junichiro at the Yokohama branch of the company, who can sometimes be reached at 045-9876-5432 if Keisuke is unavailable.","<MASKED NAME>, a software engineer at <MASKED COMPANY>, resides at <MASKED ADDRESS>, his personal email is <MASKED EMAIL>, and his mobile phone number is <MASKED PHONE NUMBER>. He often commutes to work from his home, and his birth date is <MASKED DOB>, which makes him skilled and experienced for his current role, contributing significantly to the company's innovation and development projects while also coordinating with his colleague <MASKED NAME> at the Yokohama branch of the company, who can sometimes be reached at <MASKED PHONE NUMBER> if <MASKED NAME> is unavailable."
