before_mask,after_mask
"Yamamoto Kenji, who works at Nippon Tech Solutions Inc., lives at 3-5-7 Minato-ku, Tokyo, zip code 1050001, and his contact email is yamamoto.kenji@example.com, while his birthday is July 15, 1985, and his mobile phone number is 09012345678, reflecting a busy life balancing work and family in the bustling city of Tokyo.","<masked human name>, who works at <masked company name>, lives at <masked address>, zip code <masked postal code>, and his contact email is <masked email address>, while his birthday is <masked birth date>, and his mobile phone number is <masked phone number>, reflecting a busy life balancing work and family in the bustling city of Tokyo."
"Kyoto-based cultural consultant agency Arigato Traditions Co., Ltd., led by the CEO Matsumoto Koji, operates from their headquarters located at 3 Chome-12 Nakagyo Ward, Kyoto City, Kyoto Prefecture, Japan, with the postal code of 6048305 and uses the main contact number 0751234567 to manage inquiries, while Matsumoto Koji's email address for correspondence is koji.matsumoto@example.com, and his birthdate is recorded as February 16, 1980.","<masked company name>, led by the CEO <masked human name>, operates from their headquarters located at <masked address>, <masked postal code>, and uses the main contact number <masked phone number> to manage inquiries, while <masked human name>'s email address for correspondence is <masked email address>, and his birthdate is recorded as <masked birth date>."
"Mitsui Co., Ltd. is headquartered at 1-2-3 Marunouchi, Chiyoda-ku, Tokyo, Japan, with a postal code of 100-0005, and the company recently hired a new employee, Suzuki Ichirou, who can be reached at suzuki_ichirou@example.com or 03-1234-5678. His birthday is March 15, 1990, and he currently resides at 5-10-2 Roppongi, Minato-ku, Tokyo, 106-0032.","<masked company name> is headquartered at <masked address>, <masked postal code>, and the company recently hired a new employee, <masked human name>, who can be reached at <masked email address> or <masked phone number>. His birthday is <masked birth date>, and he currently resides at <masked address>, <masked postal code>."
"Suzuki Kenji, who works as a project manager at ABC Corporation, resides at 2-3-15 Shinjuku, Shinjuku-ku, Tokyo, with the postal code 160-0022, and his contact email is kenji.suzuki@example.com. He usually communicates with his colleagues via his work number, which is 03-1234-5678, and he was born on September 25, 1985.","<masked human name>, who works as a project manager at <masked company name>, resides at <masked address>, <masked postal code>, and his contact email is <masked email address>. He usually communicates with his colleagues via his work number, which is <masked phone number>, and he was born on <masked birth date>."
"Honda Kenta, who works at Mitsubishi Electric Corporation located at 2-3-33 Minatomirai, Nishi-ku, Yokohama, Kanagawa, has an email address kenta.honda@example.com and his phone number is 0451234567. His residential address is 5-10-15 Kaminoge, Setagaya-ku, Tokyo, and his postal code is 1580093. Born on July 20, 1987, Kenta often attends international conferences to present his research on sustainable energy solutions.","<masked human name>, who works at <masked company name> located at <masked address>, has an email address <masked email address> and his phone number is <masked phone number>. His residential address is <masked address>, and his postal code is <masked postal code>. Born on <masked birth date>, <masked human name> often attends international conferences to present his research on sustainable energy solutions."
"The new marketing manager at Tokyo Digital Solutions Inc., named Sato Haruka, has been actively involved in strategizing campaigns from their office located at 7-3-1 Ginza, Chuo-ku, Tokyo, with the postal code 1110021, and has recently published her work email address haruka.sato@t-d-solutions.jp to promote communication with stakeholders while her contact phone number 03-1234-5678 and birthday September 15, 1990 have also occasionally appeared in company newsletters to encourage team engagement.","<masked company name>, named <masked human name>, has been actively involved in strategizing campaigns from their office located at <masked address>, <masked postal code>, and has recently published her work email address <masked email address> to promote communication with stakeholders while her contact phone number <masked phone number> and birthday <masked birth date> have also occasionally appeared in company newsletters to encourage team engagement."
"Mitsubishi Heavy Industries has its headquarters located at 2-16-5 Konan, Minato-ku, Tokyo, Japan, 108-8215, and Yamamoto Ichiro, who works there as a project manager, used to live at 3-2-1 Tsukishima, Chuo-ku, Tokyo before he moved to his current residence. His phone number is 080-1234-5678, and his email address is ichiro.yamamoto@example.com. Yamamoto Ichiro was born on May 15, 1980.","<masked company name> has its headquarters located at <masked address>, <masked postal code>, and <masked human name>, who works there as a project manager, used to live at <masked address> before he moved to his current residence. His phone number is <masked phone number>, and his email address is <masked email address>. Yamamoto Ichiro was born on <masked birth date>."
"Honda Yuki, a Tokyo resident living at 1234 Shinjuku Street, Tokyo, Japan, often sends emails from his personal email address honda.yuki@example.com when corresponding with colleagues about work at Marubeni Corporation located at Marunouchi 3-Chome in Chiyoda, Tokyo, and he frequently uses his mobile number 09012345678 as his primary contact, with his birthday being March 15, 1990.","<masked human name>, a Tokyo resident living at <masked address>, often sends emails from his personal email address <masked email address> when corresponding with colleagues about work at <masked company name> located at <masked address>, and he frequently uses his mobile number <masked phone number> as his primary contact, with his birthday being <masked birth date>."
"Yamada Hanako has worked at Sony Corporation for over 15 years, her office is located at 1-7-1 Konan Minato-ku Tokyo, Japan, postal code 108-0075, her contact number is 09012345678, and she frequently communicates via her email hanako.yamada@example.com. Her date of birth is January 15, 1982, and she often mentions her extensive experience in multimedia technology during global summits and corporate meetings.","<masked human name> has worked at <masked company name> for over 15 years, her office is located at <masked address>, <masked postal code>, her contact number is <masked phone number>, and she frequently communicates via her email <masked email address>. Her date of birth is <masked birth date>, and she often mentions her extensive experience in multimedia technology during global summits and corporate meetings."
"Mr. Nakamura Koji, who works at ABC Corporation, lives in Shibuya-ku, Tokyo, at the address 1-12-5 Udagawacho, and his postal code is 1500042. His email address is koji.nakamura@abc-corp.com, and his phone number is 09012345678. He was born on March 8, 1986.","<masked human name>, who works at <masked company name>, lives in <masked address>, at the postal code <masked postal code>. His email address is <masked email address>, and his phone number is <masked phone number>. He was born on <masked birth date>."
"Yamada Hanako, who is employed at Tokyo-Tech Solutions Inc., resides at 4-3-2 Minato-ku, Tokyo, with postal code 1080023, her personal email address is hanako.yamada@example.com, and she celebrates her birthday on June 15, 1989, often receiving calls on her mobile number 080-1234-5678 which she uses for work and personal purposes.","<masked human name>, who is employed at <masked company name>, resides at <masked address>, with postal code <masked postal code>, her personal email address is <masked email address>, and she celebrates her birthday on <masked birth date>, often receiving calls on her mobile number <masked phone number> which she uses for work and personal purposes."
"Yamada Hiroshi sent an email to the HR department of Panasonic Corporation from his address at 2-3-1 Marunouchi, Chiyoda-ku, Tokyo, with the postal code 100-0005, and his email address, yamada.hiroshi@example.com, requesting the details of his employment contract and outlining changes he wishes to make due to his upcoming birthday on May 18, 1985; he also included his phone number, 0312345678, so they could call him for any clarifications.","<masked human name> sent an email to the HR department of <masked company name> from his address at <masked address>, with the postal code <masked postal code>, and his email address, <masked email address>, requesting the details of his employment contract and outlining changes he wishes to make due to his upcoming birthday on <masked birth date>; he also included his phone number, <masked phone number>, so they could call him for any clarifications."
"Sakura Yamamoto, who works at Nippon Software Corporation located at 4-10-15 Ginza, Chuo-ku, Tokyo, 104-0061, often communicates with her team using her email address sakura.yamamoto@example.jp, and her mobile number, 090-1234-5678, while her date of birth is February 25, 1985.","<masked human name>, who works at <masked company name> located at <masked address>, <masked postal code>, often communicates with her team using her email address <masked email address>, and her mobile number, <masked phone number>, while her date of birth is <masked birth date>."
"Takahashi Hikaru, an employee at Fujitsu United Solutions Inc., works at the Tokyo branch office located at Shinjuku-ku, Nishi-Shinjuku 6-10-1, with the postal code 1600023 and the contact phone number 0351234567, while his email address is hikaru.takahashi@fujitsu.com, and his birthday falls on July 19, 1988.","<masked human name>, an employee at <masked company name>, works at the Tokyo branch office located at <masked address>, with the postal code <masked postal code> and the contact phone number <masked phone number>, while his email address is <masked email address>, and his birthday falls on <masked birth date>."
"Suzuki Ichiro, who works at NEC Corporation and resides at 2-3-5 Minato-ku Tokyo, frequently sends emails to his clients using his email address ichiro.suzuki@example.com while his office phone number 090-1234-5678 is often provided to business partners for contact purposes, and Ichiro was born on March 15, 1985.","<masked human name>, who works at <masked company name> and resides at <masked address>, frequently sends emails to his clients using his email address <masked email address> while his office phone number <masked phone number> is often provided to business partners for contact purposes, and <masked human name> was born on <masked birth date>."
"Mitsubishi Corporation announced that Suzuki Ichiro, a senior executive, would be appointed to their new subsidiary headquartered at Toranomon Hills Mori Tower, 1-23-1, Toranomon, Minato-ku, Tokyo, with the ZIP code of 105-6329, and his contact email address is ichiro.suzuki@mitsubishi.co.jp. Additionally, the personal phone number of Suzuki Ichiro is 090-1234-5678, and his date of birth is September 16, 1980.","<masked company name> announced that <masked human name>, a senior executive, would be appointed to their new subsidiary headquartered at <masked address>, with the ZIP code of <masked postal code>, and his contact email address is <masked email address>. Additionally, the personal phone number of <masked human name> is <masked phone number>, and his date of birth is <masked birth date>."
"Suzuki Ichirou, who was born on February 14, 1985, works at Tokyo Electronics Corporation located at 3-2-5 Minato, Chiyoda-ku, Tokyo, Japan, with a postal code of 1008905, and his professional email address is suzuki.ichirou@tokyoelectronics.jp, while his mobile phone number is +81-90-1234-5678.","<masked human name>, who was born on <masked birth date>, works at <masked company name> located at <masked address>, <masked postal code>, and his professional email address is <masked email address>, while his mobile phone number is <masked phone number>."
"Takahashi Kenji received an invitation to visit the headquarters of SoftTech Co. Ltd., located at 3-12-5 Minami Aoyama, Minato-ku, Tokyo, 107-0062, and during the meeting held on December 15, 2023, he shared his personal contact email, kenji.takahashi88@email.com, as well as his mobile phone number, 09012345678. Additionally, his official registration at the company includes his date of birth, March 22, 1980, and his designation as a Senior Data Analyst.","<masked human name> received an invitation to visit the headquarters of <masked company name>, located at <masked address>, <masked postal code>, and during the meeting held on December 15, 2023, he shared his personal contact email, <masked email address>, as well as his mobile phone number, <masked phone number>. Additionally, his official registration at the company includes his date of birth, <masked birth date>, and his designation as a Senior Data Analyst."
"Honda Keisuke, who works at Tokyo Unified Systems Inc., resides at 2-12-8 Shibuya, Shibuya-ku, Tokyo, Japan, with the postal code 150-0002. He can be reached via email at keisuke.honda@example.com or by phone at 08012345678. His date of birth is March 3, 1985, and his company's headquarters is located in Shinjuku Business Tower, 3-1-2 Nishi-Shinjuku, Tokyo.","<masked human name>, who works at <masked company name>, resides at <masked address>, with the postal code <masked postal code>. He can be reached via email at <masked email address> or by phone at <masked phone number>. His date of birth is <masked birth date>, and his company's headquarters is located in <masked address>."
"Yamamoto Shigeru, who works at Nippon Electric Corporation located at 123 Shinjuku Street, Shinjuku Ward, Tokyo, with a postal code of 1600022, often communicates through his email address shigeru.yamamoto@example.com or his cell phone number 09012345678, and his birthday falls on February 14, 1982.","<masked human name>, who works at <masked company name> located at <masked address>, <masked postal code>, often communicates through his email address <masked email address> or his cell phone number <masked phone number>, and his birthday falls on <masked birth date>."
"Nakamura Shouta, who works at ABC Tech Solutions Inc., resides in a condo located at 2-15-3 Minami-Oi, Shinagawa-ku, Tokyo, with a postal code of 1400013. His work email is shouta.nakamura@example.com, and he often communicates over the phone using 03-1234-5678. Born on July 18, 1986, he frequently visits the nearby parks during weekends.","<masked human name>, who works at <masked company name>, resides in a condo located at <masked address>, with a postal code of <masked postal code>. His work email is <masked email address>, and he often communicates over the phone using <masked phone number>. Born on <masked birth date>, he frequently visits the nearby parks during weekends."
"Yamada Kenji is currently employed at Nippon Tech Innovations, located at 3-25-2 Roppongi, Minato-ku, Tokyo, his office phone number is 03-4567-8901, and he communicates frequently through his email kenji.yamada@nippontech.co.jp; born on March 15, 1987, Kenji resides in Fuchu, Tokyo at a residential address 6-8-12 Midoricho, with a postal code of 183-0055.","<masked human name> is currently employed at <masked company name>, located at <masked address>, his office phone number is <masked phone number>, and he communicates frequently through his email <masked email address>; born on <masked birth date>, <masked human name> resides in <masked address> with a postal code of <masked postal code>."
"Hanada Keiko, who works at Nippon Telecommunication Solutions Co. Ltd., resides in Shinjuku City, Tokyo, at the address 3-12-7 Shinjuku Sanchome, postal code 160-0022, and her contact email is hanada.keiko@example.com. She was born on December 15, 1987, and her mobile number is 09012345678. Hanada Keiko often collaborates with Suzuki Naoki from Osaka, whose office is located at 5-21-4 Tenmabashi, Kita Ward, postal code 530-0041, and whose business email is naoki.suzuki@businessmail.com. Suzuki's firm, Osaka Trade Corporation, has a contact number of 0667654321.","<masked human name>, who works at <masked company name>, resides in <masked address>, <masked postal code>, and her contact email is <masked email address>. She was born on <masked birth date>, and her mobile number is <masked phone number>. <masked human name> often collaborates with <masked human name> from Osaka, whose office is located at <masked address>, <masked postal code>, and whose business email is <masked email address>. <masked company name> has a contact number of <masked phone number>."
"Suzuki Ichiro recently moved to his new address at 4-6-7 Shinjuku, Shinjuku-ku, Tokyo, and he works for a well-known company called Tokyo Tech Solutions Inc. His email is ichiro.suzuki@example.jp, and his mobile phone number is +819012345678. He was born on July 18, 1990, and he enjoys celebrating his birthday with his colleagues and friends every year at his favorite café near his workplace.","<masked human name> recently moved to his new address at <masked address>, and he works for a well-known company called <masked company name>. His email is <masked email address>, and his mobile phone number is <masked phone number>. He was born on <masked birth date>, and he enjoys celebrating his birthday with his colleagues and friends every year at his favorite café near his workplace."
"Yamada Hanako, a senior analyst at SoftTech Solutions Inc., often works from her home office located at 3-5-12 Akasaka, Minato-ku, Tokyo, Japan, postal code 1070052. She can be reached via email at hanako.yamada@example.com, and her birthday is February 14, 1985. Her direct contact number for business inquiries is 090-1234-5678.","<masked human name>, a senior analyst at <masked company name>, often works from her home office located at <masked address>, <masked postal code>. She can be reached via email at <masked email address>, and her birthday is <masked birth date>. Her direct contact number for business inquiries is <masked phone number>."
"Nakamura Hiroshi, who works for Kyowa Electronics Co., Ltd., often travels to the main office located at 3-4-5 Minami Azabu, Tokyo, the postal code of which is 1060047, and sends emails from his business email address nakamura.hiroshi@kyowa.co.jp, while his personal phone number is 08012345678; he was born on March 15, 1985.","<masked human name>, who works for <masked company name>, often travels to the main office located at <masked address>, <masked postal code>, and sends emails from his business email address <masked email address>, while his personal phone number is <masked phone number>; he was born on <masked birth date>."
"Yamada Hanako, who works as a software engineer at Tokyo Tech Solutions Inc. located at 3-8-1 Minato-ku, Akasaka, Tokyo, reached out via her company email yamada.hanako@tokyotechsolutions.jp to discuss the upcoming project deadline scheduled for next month, where her contact details including her phone number 09012345678 and her birthday August 25, 1993 were exchanged within the collaborative team meeting to ensure alignment on deliverables.","<masked human name>, who works as a software engineer at <masked company name> located at <masked address>, reached out via her company email <masked email address> to discuss the upcoming project deadline scheduled for next month, where her contact details including her phone number <masked phone number> and her birthday <masked birth date> were exchanged within the collaborative team meeting to ensure alignment on deliverables."
"Yamada Hanako, born on March 5, 1985, currently resides at 15-3 Shinjuku Road, Shinjuku Ward, Tokyo 163-0223, and works for Nippon Tech Solutions Ltd. with her professional email being hanako.yamada@nippontech.co.jp and her contact number listed as 090-1234-5678; she enjoys spending her weekends hiking in the mountains and exploring traditional Japanese tea houses.","<masked human name>, born on <masked birth date>, currently resides at <masked address>, and works for <masked company name> with her professional email being <masked email address> and her contact number listed as <masked phone number>; she enjoys spending her weekends hiking in the mountains and exploring traditional Japanese tea houses."
"Sato Kenji, who works at Global Tech Solutions in Tokyo, Japan, often attends international conferences held at Osaka Bay Convention Center, his email address is kenji.sato@example.com, and he resides at 3-15-2 Shibuya, Shibuya-ku, Tokyo 150-0001, with a contact number of 03-1234-5678. His birthdate is December 5, 1990, and he recently presented a groundbreaking project in renewable energy technology at the conference.","<masked human name>, who works at <masked company name> in Tokyo, Japan, often attends international conferences held at <masked address>, his email address is <masked email address>, and he resides at <masked address>, <masked postal code>, with a contact number of <masked phone number>. His birthdate is <masked birth date>, and he recently presented a groundbreaking project in renewable energy technology at the conference."
"Yamada Haruto works for Nippon Technology Solutions and currently resides at Sakura Heights, 2-15-7 Minato-ku, Tokyo, Japan with the postal code 1050012, his contact number for mobile inquiries is 080-5678-1234, and his official email address for business correspondence is haruto.yamada@nippon-tech.co.jp. Born on July 17th, 1985, Yamada Haruto has been a key contributor to the company since his joining in 2010, where he has managed various projects including the AI-driven solutions development and overseas market expansions. Often regarded as a leader in his field, Mr. Yamada earned his Master's degree in Computer Science from a prominent Japanese university before pursuing his career, and his residence's proximity to Tokyo Tower has been a favored detail among his friends, occasionally hosting gatherings with colleagues and friends on weekends to discuss innovative technologies over dinner.","<masked human name> works for <masked company name> and currently resides at <masked address> with the postal code <masked postal code>, his contact number for mobile inquiries is <masked phone number>, and his official email address for business correspondence is <masked email address>. Born on <masked birth date>, <masked human name> has been a key contributor to the company since his joining in 2010, where he has managed various projects including the AI-driven solutions development and overseas market expansions. Often regarded as a leader in his field, <masked human name> earned his Master's degree in Computer Science from a prominent Japanese university before pursuing his career, and his residence's proximity to Tokyo Tower has been a favored detail among his friends, occasionally hosting gatherings with colleagues and friends on weekends to discuss innovative technologies over dinner."
"Suzuki Ichirou works as a senior software engineer at TechWave Solutions Inc., located at 3-7-12 Shinjuku, Shinjuku-ku, Tokyo, Japan, with the postal code 1600022. His personal mobile number is 08012345678, and his email address is ichirou.suzuki@techwave.co.jp. He was born on June 15, 1985 and resides at 5-2-3 Setagaya, Setagaya-ku, Tokyo. Recently, he completed a project for optimizing cloud infrastructure.","<masked human name> works as a senior software engineer at <masked company name>, located at <masked address>, <masked postal code>. His personal mobile number is <masked phone number>, and his email address is <masked email address>. He was born on <masked birth date> and resides at <masked address>. Recently, he completed a project for optimizing cloud infrastructure."
"Suzuki Haruto, who works for Toshiba Corporation located at 1-1 Shibaura, Minato City, Tokyo, 105-8001, has recently changed his contact email from haruto.suzuki@example.com to haruto123.toshiba@example.com, and his direct phone number remains 03-3457-1234; he also lives at 2-10-12 Azabu Juban, Minato City, Tokyo, with a postal code of 106-0045; interestingly, his birthday is July 22, 1985, which he plans to celebrate with his colleagues and family this year.","<masked human name>, who works for <masked company name> located at <masked address>, <masked postal code>, has recently changed his contact email from <masked email address> to <masked email address>, and his direct phone number remains <masked phone number>; he also lives at <masked address>, with a postal code of <masked postal code>; interestingly, his birthday is <masked birth date>, which he plans to celebrate with his colleagues and family this year."
"Mitsui Fudosan Co., Ltd., headquartered in Otemachi, 1-1, 2-Chome, Chiyoda-ku, Tokyo, Japan, with a postal code of 1000001, employs Akimoto Yukio whose email address is yukio.akimoto@example.jp and phone number is +81-3-1234-5678. Akimoto Yukio lives at 3-4-5 Hinode, Saitama, Japan, postal code 3300002, and was born on January 12, 1987.","<masked company name>, headquartered in <masked address>, <masked postal code>, employs <masked human name> whose email address is <masked email address> and phone number is <masked phone number>. <masked human name> lives at <masked address>, <masked postal code>, and was born on <masked birth date>."
